user,rating,date,review
Max,"5,0",28 juillet 2018,"Après un an d'utilisation quasi quotidienne, je viens écrire ce commentaire pour faire part de ma grande satisfaction quand à cet aspirateur.
✴️✴️Beaucoup de points forts à cet aspirateur ✴️✴️
✔️ Sa puissance : il aspire très fort et bien.
✔️ Sa légèreté : son poids est léger et permet de la transporter facilement.
✔️ Sa maniabilité : il passe presque partout, suit bien le balais quand on le tire et se retourne rarement sur lui même.
✔️ Nettoyage ultra rapide et facile : il suffit d'enlever le compartiment à poussière, de le vider, de le laver à l'eau et c'est reparti.
✔️Rangement pratique : le balais d'aspiration s'emboîte et se fixe à l'aspirateur.
Même si l'aspiration génère un bruit de 79 décibels comme indiqué et qu'il dépasse un peu la moyenne de bruit des aspirateurs (75), je trouve que ça reste correct et acceptable.
Concernant une critique que j'ai pu lire sur la mauvaise qualité de la partie coudée du manche, je n'ai pas identifié de gêne particulière à l'utilisation à ce jour.
Moi qui cherchais un aspirateur qui aspire vraiment, je ne suis pas déçu et je n'hésiterai pas à reprendre le même modèle le jour où celui là lâchera.
☑️ Conclusion ☑️: un rapport qualité prix particulièrement bon pour cet aspirateur puissant et léger à la fois.
En espérant que mon avis vous soit utile
Si besoin, n'hésitez pas 😉"
sabrina,"5,0",11 août 2018,"Facile à ranger. Aspire fort. Lumite trop fort, il faut jouer avec la petite trappe d'aspiration qui se trouve sur la poignée pour pas que l'aspiration décolle le sol. Sauf que j'ai une astuce pour passer l'aspirateur sans être essoufflée après avoir passer la maison avec l'aspirateur..  J'ai mis une photo. Au lieu de jouer avec la trap du manche pour diminuer la puissance daspiration , Coller des petits patin aux extrémités! C'est un soulagement!!! Pour le dos, le bras et nos nerfs!!  Le câble s'énroule seule grasse au bouton poussoir sur l'appareil.bon rapport qualité prix. Voilà!"
gouriou grégory,"1,0",24 août 2018,"Aspirateur très puissant. Bon fonctionnement durant 6 mois, et depuis il n'aspire plus rien. J'ai changé le filtre et nettoyer tous les éléments mais rien n'y fait. De plus aucune garantie n'est proposée...Merci Amazon!!!"
Hell yeah,"3,0",9 septembre 2018,"J'avais lu les commentaires avant de l'acheter en me disant que même si il était mentionné que la puissance d'aspiration était trop forte ce ne serait pas un soucis pour moi et qu'au contraire, ça voulait dire qu'il aspirait bien.
En fait non ... Obligée de l'utiliser avec la trappe d'air du manche ouverte sinon l'utilisation est impossible, l'aspirateur reste collé au sol et il faut forcer comme une brute pour le déplacer, c'est même quasi impossible il ne glisse plus.
Le point positif est la simplicité de nettoyage du bac collecteur."
MrgxSmn,"5,0",23 mai 2018,"Foncez!!!
Je voulais un aspirateur qui aspire vraiment, pas comme ceux qui finissent en décoration dans les placards parce qu’ils n’aspirent pas tout..
Adieu les poils dans le canapé, adieu le pollen, adieu les arraignée
Certe bruyant, mais pour ce prix là je suis ravie!!!!
Il est vraiment top j’adore la petite brosse intégrée pour faire canapé, paillasson, matelas et les affaires des animaux!! Je recommande vivement"
swat06,"4,0",1 juin 2018,"A ce prix là , on a un bon aspirateur , qui aspire bien , avec des accessoires utiles et pratiques , finalement peu bruyant , il manquerait 1m de fil en plus pour mon 84m²  , et pour chercher la petite bête , il est très léger , trop peut être ;-))
je m'en sers tous les jours , il sera vite mis a l'épreuve pour la durée ."
FRnki69,"4,0",12 mai 2017,"compact jolie aspire trés fort sans aucune retombé de poussiere
d'ailleur joué avec l'appel d'aire pour evité de rester collé au sol (-_-)
sinon pour le prix je dirais que c'est trés bien
je recomande cette aspirateur"
noelle rocher,"5,0",8 septembre 2018,"Vraiment très contente ! ! Cette aspirateur est vraiment très peu bruyant la puissance d’aspiration selon le sol peut se régler avec la petite molette sur le manche est vraiment hyper léger ,  le fils est suffisamment long sans avoir besoin de changer de prise toutes les trois minutes  et sans aucune hésitation je vous le recommande vraiment ... a voir dans le temps mais franchement confiante !! Merci"
ouizaza,"1,0",24 octobre 2018,aspirateur qui a tenu a peine 5 mois sa fait 20 jours qu'il est en reparation et que moi j'empreinte celui de la voisine comme une débile
Client d'Amazon,"5,0",9 août 2018,"Vivant dans un 50m2 avec un chien et un accès direct au jardin, toujours pleins de poils et de poussières venant de dehors il me fallait un aspirateur de qualité qui respecte mon budget. Et bien je suis conquise !
Deuxième fois que je commande un produit rowenta et je suis à nouveau satisfaite.
Il a une bonne aspiration, le fil est assez long, il est pratique et les accessoires sont bien utiles.
Ayant eu 2 aspirateurs dans la même gamme de marques différentes, il y a vraiment une différence avec celui ci, enfin un aspirateur qui aspire vraiment.. allez y les yeux fermés !"
José Lecq,"1,0",13 août 2018,"En a peine un an le second et il n’aspire Toujours pas , pas pratique et franchement pas agréable aviser . Je suis déçu !!! Je préfère largement les sacs . Je suis fidèle à Rowenta depuis des années mais cet aspirateur un flop."
kaina El achhab,"1,0",29 juillet 2018,"Au bout d’une semaine d’utilisation, il n’aspire plus trop malgré l’avoir nettoyer et pris le temps de de déboucher chaque endroit."
GAUDEZ,"3,0",28 septembre 2018,"Ça aspire bien et c’est l’essentiel , voir même ca colle un peu trop au carrelage.
Ok pour brosse parquet vrai plus.
Léger mais du coup peu se retourner si à coups
Les reproches : fait un peu cheap, les roues ne tournent pas ..., tuyau flexible un peu court pour moi 1m85.
Premier sans sac ... peut être le dernier je vois pas l’interet de nettoyer l’aspi à chaque passage, ça tombe par terre, les cheveux s’enroulent sur le pré-filtre."
DIY-Arcueil,"4,0",19 mai 2018,"Utilisateur depuis 7 mois, cet aspirateur fait très bien son travail, pas très bruyant, facile à entretenir. Seul un bémol, ses 2 grandes roues se bloquent par le poid de l'aspirateur et l'aspirateur glisse sur la surface de parquet au lieu de rouler. Peut-etre le mien possède un défaut de montage? Si vous avez un astuce pour corriger ce problème, je suis preneur. Sinon je suis satisfait de cet aspirateur."
Cel,"1,0",6 novembre 2018,"Au bout de deux semaines il n’aspire plus rien même pas un cheveux !!!
J’ai tout nettoyé correctement mais rien n’y fait
Je déconseille"
JG,"5,0",7 avril 2017,"Très puissant et compact, il respire la qualité Rowenta, c'est parfait pour mon utilisation je le recommande sans aucune hésitation."
Jean-Marc,"3,0",21 novembre 2018,"Une puissance correct pour sol dur et tapis.
Leger, facile a nettoyeur.
Par contre la brosse parquet n'est pas pratique, elle se plaque au sol.
On regrette la brosse delta des anciens modèles.
Il se retourne aussi facilement lors des déplacements du à sa forme trop ""arrondie""
Actuellement en réparation, le câble ne reste plus bloqué et se rembobine automatiquement…"
Client d'Amazon,"1,0",21 novembre 2018,"Trés déçue par le produit - très léger, mais à tel point qu'o dirait un jouet !
Il est effectivement facile à nettoyer mais le mien n'a plus de puissance, il n'aspire plus rien, après seulement 8 mois.
Matériaux vraiment cheap.
Je ne recommande pas."
Elhem,"4,0",4 octobre 2018,"Il est léger et très puissant.
Je rejoint les autres commentaires concernant le plastique de la Manche et des accessoires: ça paraît de bas de gamme. Pour vider le réservoir il faut enlever une pièce donc toucher la poussière ce qui n'est pas pratique.
Vu la puissance sur les sols durs et les tapis le prix abordable et la légèreté j'ai mis 4 étoiles"
Ludmila,"5,0",30 juillet 2017,"Le produit de très bonne qualité, une très bonne puissance d'aspiration, compact, pas trop brouillant. Je suis très satisfaite de cet achat!"
Lydia,"1,0",11 décembre 2018,Au bout de quelques mois il n'aspire plus.
Historic J,"1,0",7 avril 2019,"L'aspirateur n'aspire plus rien au bout de 6 mois et vous êtes en train de me présenter un devis de 80€ pour les réparations d'un aspirateur que j’ai acheté il y a 6 mois à 90€?
Il n’y a donc aucune garantie ni aucun suivi sur les marchandises que vous vendez?
C’est absolument honteux pour une entreprise comme Rowenta qui se veut être une marque de confiance comme pour vous qui vendez des appareils défectueux. Autant acheter un petit aspirateur d’une petite marque pour 20€, cela fera aussi bien l’affaire."
Vanes,"5,0",31 janvier 2019,"Je viens de commander cet aspirateur sur amazon pour l'offrir à ma mère car je l'ai depuis plus d'un an (acheté en magasin en promo) et j'en suis très satisfaite.
Je l'utilise pratiquement tout les jours car j'ai 2 enfants en bas âge,  il arrive même de le sortir 2 fois par jours,  il aspir vraiment fort il faut regler la puissance avec la trappe sur le manche donc très pratique pas besoin de se baisser comme sur d'autres aspirateur où la puissance se règle avec un bouton sur l'aspirateur même.
Il est facile à vider, à nettoyer il suffit de passer le filtre sous l'eau, personnellement je le fais très rarement juste quand je vois qu'il en a besoin.
Il est livré avec plusieurs brosse,  de quoi nettoyer tapis, endroit étroit ou difficile d'accès.
Léger,  facil à rangeoet assez compact.
Donc voilà après plus d'un an je peux que le recommander surtout niveau qualité prix."
Client d'Amazon,"5,0",8 janvier 2019,"J'en avais marre des sacs à renouveler sur mon aspirateur et j'étais tentée d'en acquérir un sans sac. On me disait que c'était une erreur, qu'ils n'avaient pas une grande contenance et surtout qu'ils étaient bruyants et n'étaient pas puissants en aspiration. Or: la contenance n'a pas vraiment d'importance puisqu'il n'y a pas de sac à changer, juste à vider le réservoir à poussière. J'ai déjà fait le tour de mon logement (90 m2) 3 fois et le bac est loin d'être plein même avec les ""moutons"" sous les lits et mon chien qui perd ses poils. Pour le bruit, il n'est pas silencieux 100 % mais pas plus bruyant que mon ancien aspirateur. Pour la puissance d'aspiration... j'avais souri en lisant les avis mentionnant qu'il aspirait tellement fort qu'il fallait ouvrir la petite trappe de régul.. Hé bien, je suis obligée de l'ouvrir complètement sinon le balai se colle au sol et j'ai du mal à le déplacer ! (carrelage et  parquet). Juste un petit bémol: il n'y a pas de blocage de cette petite trappe et, comme elle est positionnée juste où on met la main pour tenir le balai, elle se referme sans arrêt, genant le travail. Je suis satisfaite de mon achat. De plus, il est esthétique, compact donc peu encombrant et léger à trainer, à porter par sa poignée plutot bien placée."
patricia handtsaem,"2,0",23 juin 2018,"il aspire bien le problème est qu'il reste collé au sol tant il aspire et cela est fatiguant de l'utiliser cela provient du fait qu'in se met en suceur
l'arrivée d'air se trouve sur la poignet au lieu d'être sur le corps
il bouge sans cesse je vais devoir positionner l'arrivée d'air et scotcher pour ne plus qu'il se met en suceur"
JMP,"5,0",11 avril 2019,"Pour le prix, parfait ; dans l’absolu, c’est un choix d’aspirateur, qui peut être considéré comme parfait selon l’usage. Je vais etre plus precis.
- puissant, léger, maniable, suffisamment silencieux. Franchement, rien à reprocher.
- tuyaux et fils un peu court : mais là, c’est un choix : l’aspirateur est leger, il est conçu pour aller vite. Il ne faut pas le considérer comme un gros aspirateur lourd que l’on traine en prenant son temps. C’est une philisophie. Pour ma part, tel quel, il me va parfaitement.
- il est vrai (ce que j’ai lu dans les commentaires) qu’il peut « coller » au sol tellement il aspire. C’est d’autant plus vrai quand le réservoir est vide. Mais il y a un petit réglage facile (au niveau de la prise en main) qui permet justement de régler le débit d’air à volonté."
GT,"4,0",27 décembre 2018,"J’ai commandé cet aspirateur pour sa puissance car mon ancien aspirateur d’une marque réputée n’aspirait plus rien. De ce côté-là, je ne suis pas déçue. Il est même parfois difficile de le décoller du sol et de le manipuler tellement l’aspiration est forte. Il y a cependant un petit clapet sur le manche qui permet de diminuer la puissance d’aspiration. Il aspire parfaitement les saletés et la poussière. Bon rapport qualité/prix. Pour l’instant, je suis contente de mon achat! A voir dans quelques mois s’il ne s’essouffle pas!"
dangar81,"3,0",20 mars 2019,"Après plus de 20 ans de bons et loyaux services de mon Philips, j’ai du le remplacer dans  l’urgence !.
Mon choix c’est porter sur ce Rowenta, et je dirais que c’est un aspirateur efficace, il aspire très bien, par contre je trouve qu’ergonomiquement, il aurait pu être mieux pensé !.
Le tuyau est trop rigide, et par rapport au lieu de fixation, ( sur l’avant de l’aspirateur, en pointe), l’aspirateur peut facilement se renverser, étant sur 3 roues !.
D’autre part, le fil est plat, et le désagrément est qu’il se coince facilement sous un meuble, une chaise ou une porte, c’est agaçant !.
Enfin, il est léger, soit, mais on sent que la fragilité est là, il ne faudra pas trop le brusquer !.
Donc, on peut retenir qu’il fait bien l’essentiel, aspirer, et le système sans sac est pratique, facile à vider et nettoyer, mais l’ergonomie n’est pas idéale, c’est dommage !."
Gwen91,"5,0",31 juillet 2018,"Aspirateur commandé en remplacement d'un autre d'une autre marque et je suis plus que ravie.
Aspire très fort tous les types de sols et particulièrement bien les tapis en grosse laine qui sont si difficile à aspirer.
Pas trop bruyant et les accessoires sont bien pratiques.
Bonne marque et bon aspirateur."
Ewa,"4,0",7 novembre 2018,"Appareil reçu il y a quelques jours et pour l'instant je suis satisfaite. c est agréable de manier un appareil petit et leger. La capacité du bac semble petite mais largement suffisant, et puis comme c est un sans sac, je peux le vider souvent. Tres bonne aspiration il reste même collé au tapis a puissance max. Seule bemol je m interroge sur la solidité du bac de recueuil de poussière sur la durée. nous verrons."
Pitchoun,"4,0",24 février 2019,"Un aspirateur assez silencieux. J'utilise principalement la brosse spéciale sols durs puisque je n'ai que du parquet et du carrelage chez moi et j'en suis assez satisfaite sauf que je trouve que cette brosse n'est pas assez articulée. Je m'explique : si je baisse le manche vers le sol, la brosse a dû mal à se coller au sol automatiquement. D'autre part, le tuyau flexible pourrait être un peu plus long (10 cm de plus) car en utilisant la petite brosse au bout de ce flexible l'aspirateur se cabre et le manche posé à l'arrière de l'aspirateur, tombe."
DavyXIV,"5,0",6 mars 2018,"Peu bruyant, super aspiration solide et totalement démontable pour le nettoyage et l'entretien c'est top !
Le filtre est nettoyable à l'eau donc pas besoin d'en racheter de nouveaux.
Rapport qualité prix nickel"
elvira,"4,0",6 juillet 2018,"Je viens de l'essayer est il n'y a rien a redire. Puissant, compact, leger j'aime beaucoup! Je reviendrais update mon commentaire dans 3 mois ;)"
Benoît,"1,0",12 août 2018,N asoire pas correctement
Client d'Amazon,"3,0",16 février 2019,"J'ai acheté ce produit car il est de qualité compte tenu du rapport qualité/prix.
Le + :
-Il aspire fort
-La brosse intégrée au tuyau
-La grande capacité du réservoir
Le - :
-Le tuyau et le balai sont trop petit pour les grandes personnes
-Pas de régulateur de puissance. Il faut jouer avec le débit d'air situé sur le manche.
-Trop léger sur le devant de l'aspirateur ce qui fait qu'il a tendance a basculer en arrière.
-Les roues ne tournent pas très bien. Quand on le tire vers soit, vu que les roues ne tournent pas très bien, on a tendance a tirer fort et au vu du poids léger ce qui provoque souvent un retournement de l'aspirateur.
Conclusion : Pas mal du tout pour un aspirateur compte tenu du prix. Fait le taff niveau aspiration mais niveau finition encore des progrès à faire. Je recommande."
Chris CT,"5,0",4 décembre 2018,"Jamais vu un aspirateur pareil!! Tellement puissant qu'il m'a décollé le linoléum.... même en laissant passer l'air par la poignée... Vraiment dommage qu'on ne puisse pas régler la puissance!!! Par contre, pour les tapis, le matelas, fauteuils et canapé, whouah : poussière, acariens et résidus de toutes sortes = Dézingués!!! Rowenta, Ça serait sympa d'ajouter un variateur de puissance"
V,"1,0",9 mars 2019,"De la pure arnaque.
Achete l été dernier et déjà HS.
L aspirateur aspire beaucoup trop fort et se mets desormais a siffler a chaque utilisation. Je demande remboursement pour cet ""achat jetable"". Inadmissible."
BJ,"3,0",23 avril 2018,"En voyant les commentaires sur la puissance de l'aspiration, j'ai pensé que c'était plutôt un atout mais maintenant que je l'ai testé, je dois avouer que c'est plutôt un inconvénient car il est très difficile de décoller l'aspirateur du sol et cela devient vraiment une corvée de passer l'aspirateur.dommage"
M. Bebon-Ohnmacht,"1,0",1 juin 2019,"Bonjour,
Pour donner suite aux remarques de mon épouse ce matin je j'ai des commentaires quelques peu virulents mais je suis vraiment contrarié.
Nous avions aussi lu les commentaires avant de l'acheter et je rejoins ceux de Hell yeah
Mais je ne crois pas que l’aspiration est trop forte.
Incontestablement on EST obligé de l'utiliser avec la trappe d'air du manche ouverte sinon l'utilisation est impossible.
La tête d'aspiration, il faut le préciser en bonne position, reste collée même sur le carrelage, "" impensable""
Il ne glisse plus. Même moi qui suis un homme doit forcer pour le déplacer, j'ai même peur de rayer le carrelage.
Je ne parle pas des tapis car là… on le déplace ou on le soulève.
Je ne sais pas qui et comment a été testé cet aspirateur chez Rowenta ou chez Amazon.
On n’a pas de droit de mettre en vente un tel produit.
C’est un défaut de conception
J'ai trouvé une solution de dépannage temporaire en remplaçant la tête d'aspiration de Rowenta  avec celle de mon ancien aspirateur Polti … Impensable, ça fonctionne mieux surtout ça ne reste plus collé…
Ce qui le rend légers c’est le plastic mais qui me semble de qualité moindre…
Le bruit ça va c’est dans les normes.
Rapport qualité prix de ce fait très moyen.
Si j'avais encore l’emballage je le retournais mais je vais faire la demande.
J’estime que si on achète un nouvel article ce n’est pas pour le rafistoler pour qu’il fonctionne correctement
J’attends des explications, Rowenta, Amazon mais je ne peux pas conseiller du tout cet aspirateur
Bien à Vous"
fab,"4,0",15 octobre 2018,"Bien,manque vraiment un variateur de débit d aspiration. Trop puissant parfois du coup on doit entre  ouvrir la tirette qui laisse passer l'air en haut du manche en espérant que cela ne tire pas trop sur le moteur."
AmazCustomer,"4,0",4 mai 2018,"Aspirateur, un vrai, léger, pratique, et qui décolle le sol, malheureusement pas de variateur de puissance directement sur le traîneau mais un clapet à glisser sur le manche pour pouvoir décoller l'aspi du sol. Très bon produit au premier abord, utilisé 2 fois, à voir avec le temps."
Tonio,"4,0",2 février 2018,"Déjà il est beau, à l'utilisation on peut découvrir un aspirateur compacte, léger, très maniable mais surtout qu'il fait bien son travail.
Le pouvoir aspirant est bon et le réservoir à poussière s’enlève aisément. Je ne met pas cinq étoiles parce que je le trouve assez
bruyant. Bon produit.....à recommander."
LARA,"1,0",19 avril 2019,"De la vraie camelote, il a marché une semaine et puis ne fonctionne plus du tout. J ai vide la poussière rien à faire le truc ne veut plus démarrer , il a grillé de l intérieur.
Je déconseille fortement , je n aurais jamais du acheter ce modèle
Pourtant les commentaires négatifs était nombreux.
Je vais demander un remboursement."
Cécile ,"1,0",6 février 2019,"Après moin d un an d utilisation, je peux dire que je ne le conseille pas du tout. Le fil ne se déroule plus , il aspire très mal malgré d’un nettoyage et vidage après chaque utilisation. Vraiment très déçu de ce produit. Je ne le recommande pas du tout"
Francois LAMBERT,"5,0",9 avril 2018,"Après utilisations maintenant je peux vous dire que c'est un bon rapport-qualité prix. Très bonne aspiration, ma femme se plaignait trop souvent que l'ancien aspirateur n'aspirer pas beaucoup. Maintenant tout va bien. Je recommande ce produit."
tedo valérie,"1,0",13 avril 2019,"très bas de gamme pour le prix, les roues ne roulaient pas,à mon avis le tube télescopique ne résistera pas 6 mois l'aspiration était correcte je l'ai essayé une heure et renvoyé. En magasin la qualité est moins bas de gamme sur le même modèle .En résumé je pense que la marque ne fabrique pas la même qualité pour être vendu sur Amazon qu'en magasin."
karim,"5,0",10 novembre 2017,leger et aspire tellement bien que je suis oblige de diminuer le debit d'aspiration car sinon il colle au sol. beau design
Antoine45,"3,0",25 novembre 2017,"Points +: poids, puissance, maniabilité
Points -: qualité de la brosse, reste collé au sol, fil électrique un peu court.
Reste à 99€ un produit d'apoint intéressant"
JLee935,"1,0",10 juin 2019,"A très bien fonctionné pendant 6 mois, et là a tout simplement cessé d'aspirer...
J'ai pourtant nettoyé le filtre, nettoyé le bac etc... mais rien à faire il n'aspire pas. J'ai fait une demande pour l'envoyer en atelier de réparation, mais vu qu'aucune garantie n'est offerte via Amazon, s'ils ne peuvent pas le réparé il sera tout simplement à jeter."
Abde,"1,0",28 mars 2019,Des problèmes d'aspirations rencontré je ne le recommande pas
LECUYER,"5,0",22 avril 2019,"Au début je n'étais pas ""emballé"" par cet Aspirateur, ayant avant un Dyson.
Mais je trouve que cet aspirateur est BEAUCOUP plus puissant que le Dyson.
La vidage du bocal de réception est facile, la maniabilité et simple.
L'aspirateur est très léger et maniable.
L'aspiration peut être modulé avec un clapé tout simplement sur le tuyau.
Les filtres faciles de nettoyage.
Je suis content de cette acquisition et de l'aspiration qu'il offre.
A recommander + + +"
Client d'Amazon,"5,0",16 mars 2019,"Utilisation quotidienne pour un 90m2. Je l'ai choisi pour son prix et les commentaires positifs. Certains commentaires m'ont fait douter par rapport au bruit (trop bruyant pour certain), et bien en fait je suis pas déçu de mon achat car il est beaucoup moins bruyant que mon ancien aspirateur. Pour moi il est top, maniable (roue sous aspirateur qui permet rotation 360°). En plus, le manche permet de passer sous le lit. À voir comment il évolu dans le temps."
Client d'Amazon,"1,0",15 avril 2019,"Je suis très mécontente de ce produit, ça fait à peine 6 mois que je l ai il est bon à mettre à la poubelle!!! Il n aspire plus et alors il fait du bruit c'est assourdissant. Achat qui m a fait perdre de l argent doublement puisque je suis bonne pour en racheter un!!"
FRITSCH   Thierry,"5,0",6 juillet 2018,"comme tout le monde le dit  trés puissan tcause leonberg j ai brulé le dyson animal pro  donc 2 aspirateurs un einhel ""pro""dans moncas le rowenta sert a la finition il colle et enleve la poussiere du sol dur ; la turbo brosse du dyson ne passe pas sous les meubles de+ elle fonctionne avec l aspiration donc nulle cest un parfait pettit aspi d apoint"
gg,"4,0",31 mars 2019,"Acheté pour une maison de 165 m2
Capacité d aspiration impressionnante comparable voir supérieur à mon ancien dyson..
Petit bémol le plastique du manche me semble light.. mais bon pour le prix je reste très satisfaite je ne m attendais pas à si bien
Je recommande en espèrant qu' il dure longtemps."
Client d'Amazon,"1,0",6 janvier 2019,Cassé au bout de quelques mois....
edbak,"5,0",1 mai 2019,"Très bon aspirateur, j'en ai même deux. Il aspire très bien, voir trop bien. Maniable léger et moins bruyant que Dyson.
Les moins :
Manque le réglage de la puissance moteur
Diminuer le bruit
Mais bon à 100€ on ne peut pas en demander plus. Une marque Française et fiable c'est déjà très bien."
SALAMON,"5,0",6 juillet 2018,"Pas de bruit par rapport a la majorite des aspirateurs que j'ai employes.
Un  petit coup de pouce et on  on regle l'aspiration par la fente au bou de ce doigt.
La marque me donne l'idee de la qualite et la duree de l'appareil
Se range tres facilement.
Tres tres content de cet achat. C'est habituel chez Amazon"
Client d'Amazon,"1,0",13 mars 2019,"Après quelques mois, j ai un bruit énorme à chaque fois que j’aspire. J ai envoye en réparation avec amazone et je n’ai toujours trouvé pas de nouvelles.
En résumé très bon aspirateur mais pas ds la durée"
