user,rating,date,review
Audrey Gouvernet,"5,0",20 mai 2019,"Aspirateur au top !! Je cherchais un aspirateur qui remplissait sa fonction première : aspirer !! Rien à redire ! Je dirais même qu'il aspire un peu trop je suis obligée d'ouvrir la petite trappe sur le manche sinon le balai reste collé au sol. Parfait pour faire les toiles d'araignées rebelles ! J'en suis très contente. Le design est franchement sympa , le cordon d'alimentation est bien long , il est très maniable et le système pour vider le bac est très simple et rapide. Je recommande les yeux fermés !"
aaricia,"5,0",1 septembre 2018,"Très bien. Très puissant et assez compact. La poignée sur le dessus permet de bien le prendre en main. L embout de nettoyage est intégré donc aucun risque de perte  et n abîme pas les meubles avec ses pis de protection.
Il est très puissant donc il faut ouvrir la sortie d air sur le manche. Je recommande."
N. H.,"1,0",28 avril 2019,"Deux  mois seulement après l'achat, la puissance d'aspiration a commencé à décliné. Après nettoyage complet des filtres et des pièces, toujours même problème. Un aspirateur qui n'aspire pas n'a pas beaucoup d'utilité.
A éviter!!"
RED,"4,0",9 mai 2019,une étoilé en moin car il déteste les poussières fines ... première utilisation le filtre au dessus du bac etait deja tres énpoussinièré ... a voir avec le temps mais au vue de lutilisation dans mon foyer je ne lui donne pas plus d'un an a vivre ...
Client d'Amazon,"4,0",3 septembre 2018,Aspirateur très puissant. Je dirais un peu trop d’ailleurs. Une entrée d’air plus grande ne serait pas de refus sur le balai car des fois c’est du sport de tirer sur le manche tellement il est collé au sol par sa puisante aspiration.
caramel,"4,0",10 juin 2019,"Aspirateur très maniable, léger et qui fait son ""boulot"" correctement
Plus de sacs à commander
Rowenta est une très bonne marque ; après avoir eu pendant des années la marque Miele j'ai voulu changer
et je ne suis pas déçue"
Client d'Amazon,"5,0",4 décembre 2018,"Les plus :
Facile à utiliser et à nettoyer.
Léger et d'une taille relativement petite.
Aspiration assez puissante.
Les moins :
Un peu bruyant, difficile d'exiger le silence dans cette gamme de prix."
Nicolas ternard,"5,0",21 avril 2019,Un aspirateur Rowenta c'est la base. Tout le monde connaît la marque rien à dire de plus
Sulzer,"5,0",17 mai 2019,"Réception en Prime, 3 jours après la commande : Bravo. Etat du colis : impeccable.
Les commentaires des acheteurs m ont  été très utiles . En effet, l'aspirateur aspire trop bien.
Il se monte extrêmement facilement, pas besoin  de notice.
Très ravie"
Moi,"4,0",26 mars 2018,"Très bonne aspiration
Il est vraiment compact et maniable
Pas contre il manque un peu de longueur de tuyau ce qui m’oblige à soulever l’aspira Pour faire les hauts de murs"
Tibibi,"3,0",13 avril 2019,"Pour ceux qui pensent que plus forte est l'aspiration mieux c'est, c'est qu'ils n'ont pas de problèmes de dos!
J'ai réglé la force d'aspiration au minimum mais le réglage au manche n'est pas pratique car il se trouve à l'endroit ou on le tient. Le traineau est plutôt léger ce qui est très bien mais c'est aussi pourquoi il faut faire attention sinon il se retrouve facilement sur le dos lors de changements de direction."
Caro Coco,"1,0",7 avril 2019,"Très bon aspirateur, léger, compact mais s'est mis à siffler au bout de 2 mois. Je pense que d'ici peu il va se pre de un coup de masse et j'en achèterais un autre mais plus ce modèle là. Déçue..."
denise schigeowski,"1,0",18 mars 2019,passer du dayson au rowenta c est comme passer de la Ferrari a la 2 ch difference d aspiration. je ne suis pas contente  je vais reprendre un dayson  pour remplacer le mien de 10 an
pif_paf_pouf,"3,0",2 février 2019,"Contrairement la plupart des aspirateurs Rowenta qui sont français, celui ci est fabriqué en Chine. Il aspire bien mais je le trouve moins pratique que ses équivalents français un peu plus chers, plus pratiques et de conception plus solide. En terme de praticité je dirai qu'il n'est pas facile à vider sans en faire tomber à côté et j'ai un peu peur de sa durée dans le temps, certaines pièces paraissent fragiles."
KvR,"4,0",9 septembre 2017,"il fait ce qu'on lui demande: engloutir la poussière et autres particules. Il est limite pour le bruit, mais prend peu de place et reste d'un poids correct. En espérant qu'il vieillisse bien."
Client d'Amazon,"4,0",21 mars 2018,"Pour compléter les commentaires qui ont guidées ce choix. ... aspiration super.... Le pb de variation se résout par la réduction d'entrée d'air. Oui en plastique mais lequel ne l'est pas aujourd'hui.
Delai respecté... je conseille cet achat"
Dubon,"1,0",26 décembre 2018,Au bout d'un mois d'utilisation se met à siffler de manière stridente !!
LOVIGHI MARTINE,"4,0",28 novembre 2018,"Cet aspirateur destiné à l'étage d'une maison (un autre plus lourd reste au rez de chaussée) remplit parfaitement sa fonction : il est léger, plutôt puissant et efficace. Bien équipé, tous ses petits accessoires sont bien pratiques. Un petit bémol : il faut toujours batailler pour démancher les différentes brosses (comme malheureusement bien des aspirateurs)"
DC,"3,0",23 octobre 2018,"Un peu décu de mon achat
Trop léger il glisse sur le carrelage ,le manche on dirait que l on a rien dans les mains ....
réservoir petit mais se vide facilement.
j AI  été TROMPER PAR LES AVIS QUI MON FAIT ACHETER SE PRODUIT.😡"
suzie91,"5,0",31 mars 2019,"Acheté pour un petit appartement. Remplit son job parfaitement. Effectivement, grosse puissance d aspiration, mais que l on peut moduler aisément. Je conseille ++"
woonille,"5,0",14 novembre 2018,"PARFAIT ! Fait très bien son travail, aspire correctement, bac facile à vider même avec des poils d'animaux. Je suis ravie. Prix imbattable pour la qualité apportée."
Liliyou,"5,0",14 juillet 2018,"Extrêmement puissant,c’est incroyable !!! L aspirateur reste collé au sol,c est magnifique,je recommande fortement cette marque et cet aspirateur en plus je l’ai essayé des rece Et franchement je ne regrette pas du tout ...."
MathieuB,"5,0",27 juillet 2018,"Mon vieux aspirateur commençait à avoir du mal et je l'ai remplacé par celui ci. Vraiment simple d'utilisation, pratique pour vider le réservoir et ne s'encrasse pas même avec des animaux. J'en suis satisfait"
Julie Guichard,"5,0",22 février 2019,"Très bon aspirateur. On a l’impression qu’on va décoller le sol. Facile d’utilisation et léger.
Bon rapport qualité prix pour ma part."
Jacques Crombet,"5,0",29 mai 2018,J'ai choisi la meilleure note pour cet article qui correspond parfaitement à la description faite en ligne. J'ai aimé la facilité d'achat en ligne. Rien ne m'a déplu. Je ne peux que recommander cet article
Client d'Amazon,"5,0",26 mars 2019,Enfin un aspirateur qui fait ce pourquoi je l ai ACHETE!!! Je suis bluffée vu le prix je ne regrette pas du tout et je confirme forte aspiration et léger !! A voir a l usage mais si dans 2 ou 5 ans il aspire plus aucun regret pour le changer vu le prix!!! Je recommande
jeannot,"5,0",7 décembre 2018,Cet aspirateur est de bonne qualité. Il a tout de suite plu dès le premier usage. C'est le plus important. J'en suis content.
SAUJET,"4,0",26 septembre 2017,"Aspirateur très puissant même parfois trop puissant selon la surface à aspirer.
Assez discret et peu encombrant. Brosse intégrée sur le tuyau très pratique."
lefevre alex,"4,0",24 septembre 2017,"Aspirateur très puissant. Pas trop bruyant. Très léger.
Très contente de mon achat délais de livraison respectés.
Prix correct par rapport à la qualité du produit.
A voir dans la durée. Vous pouvez l'acheter les yeux fermés!!"
ludovic cusenier,"3,0",10 juin 2019,"Le produit aspire bien même trop vu la brosse qui se coince dans chaque joint , sinon le cable est assez long , le produit est joli mais très cheap quand on vois les roulettes et la qualité du plastique , bon produit dans l'ensemble mais je préfèrerais mon précédent Rowenta"
Christophe,"4,0",7 mars 2019,"Produit acheté pour une utilisation peu soutenue, résidence secondaire, mais fait le job est peu encombrant. Très bon rapport qualité prix."
David POMMIER,"5,0",31 mars 2019,Après plusieurs mois d’utilisation il est toujours puissant et efficace. Après en avoir passé plusieurs bon marché et nul j’ai enfin un aspirateur digne de ce nom
sarah,"5,0",20 juin 2018,J'adore niveau qualité prix je ne suis pas du tout déçu.Il est très puissant (voir un peu trop) il se range facilement le balai(embout) est assez plat donc passe facilement sous les meubles.J'ai des chiens et chats et convient parfaitement pour les poils des animaux le bac ne se remplis pas trop vite et il se vide facilement .....Vraiment j'adore
Cleman,"4,0",25 avril 2018,"produit livré rapidement avec Prime en 2 jours comme annoncé par le vendeur. Comme le titre l'indique, l'aspirateur est compact mais joue parfaitement son rôle d'aspirateur ! produit de qualité. Je recommande."
sanchez julia,"5,0",30 mai 2019,Tres contente de mon achat ! La puissance se règle au niveau du Manche ce qui peut-être un plus en fonction des endroits où l'on passe pas besoin de se baisser pour régler la puissance sur la base de l'aspirateur . J'avais un dyson avant je ne regrette pas dutout mon achat
joly,"5,0",1 septembre 2017,"Satisfait de cet achat, qualité prix satisfaisant pour son efficacité et son mécanisme silencieux, peux encombrant et facile pour le rangement"
THIERRY DURAND,"5,0",2 janvier 2019,"Acheté pour notre appartement 3 pièces pour remplacer l'ancien, celui ci est très puissant, voire trop, facile pour vider, lever et ne prend pas beaucoup de place"
polux polix,"5,0",26 août 2018,"très bon aspirateur très forte aspiration .petit,léger ,jolie que demander de plus il correspond à ce que je rechercher ."
CRESPO Anne,"5,0",2 septembre 2018,"Aspirateur parfait pour appartement.Un bémol lorsqu’il faut le nettoyer , en ouvrant le bloc beaucoup des poussières et des éléments aspirés sont collés et tombent à nouveau parterre. Il faut donc l’ouvri Dehors ou sur une poubelle"
soiadou faty,"5,0",14 avril 2019,J’aime beaucoup sa légèreté il est super efficace pas de poussière ou presque pas c’est génial je l’utile 1 jour sur 2 un peu bruyant c’est vrai mais bon pour le prix je trouve que l’aspirateur et au top
Gomez Emeline,"4,0",15 février 2019,Alors on ne peut pas dire qu'il n'aspire pas mais c'est difficile du coup car colle vraiment au sol. Il y a un cache pour regler un peu l'intensité mais il est mal placé je le baisse toujours avec les mouvements cest le point négatif apres j'en suis contente pour le prix j'ai enfin trouvé un aspirateur qui aspire tout.. je fais même ma poussiere avec l embout brosse
Julien ,"5,0",5 janvier 2019,"Pour sa taille cet aspirateur possède une puissance d'aspiration assez bluffante. Il ne prend pas beaucoup de place.
Le système de nettoyage est effectivement très simple à utiliser même si je trouve qu'on a tendance à en mettre un peu à côté.
Petit bémol pour le système de ré enroulage du fil à l'intérieur. Ca n'engage que moi mais j'ai l'impression qu'il vieillira mal."
VILLERY Thomas,"4,0",13 décembre 2018,Très bonne aspiration. Un peu trop même. Il faut créer une fuite pour que la brosse ne colle pas au carrelage. N aime pas aspirer la cendre. Perte d'aspiration rapide  suite au filtre colmaté  mais ce filtre en tissu est très facile à nettoyer.  Par contre J ai du enlever un autre filtre dans l'aspirateur qui faisait un sifflement très fort lors de l'utilisation  d l'aspirateur.
BC,"1,0",6 mai 2019,Passez votre chemin.. n'aspire pas correctement
rené Sattler,"4,0",17 janvier 2018,"je suis satisfait de mon achat ,juste un point négatif : la partie du manche courbé en plastique ne j'emboite pas bien et si on force on a du mal  l'enlever  ."
goubil,"4,0",3 avril 2018,"Bon rapport qualité /prix. Moi qui passe l'aspirateur 3/4 fois par jours (3 gros chiens) il est efficace, puissant, ce vide facilement, léger, marche télescopique de grande taille, assez silencieux. Bref pour moi il est très bien"
POUPETTA,"4,0",2 mars 2018,"Bonjour, je l'ai acheté pour ma voisine. Elle le trouve très bien, puissant et facile à monter. A voir dans la durée, s'il est résistant ou pas.
Cordialement."
Client d'Amazon,"5,0",25 octobre 2018,"Pour l’achat de ce produit j’ai compté sur les avis des clients et franchement je ne regrette pas du tout
Je recommande"
djip,"5,0",17 février 2019,Bon aspirateur très bonne puissance d'aspiration !! Facile à utiliser et nettoyer !! Je le conseille vivement !! Bon alternative pour ceux qui ne peuvent pas s'offrir un Dyson !!
Tatane,"5,0",29 novembre 2017,"puissant, efficace très bon rapport qualité prix que demander de plus.
points négatifs si j'ose dire !! :  tuyau un peu court et pas de réglage de la puissance car il aspire vraiment très fort !!!!"
véronika,"4,0",21 mai 2019,"Aspirateur conforme a ce que l'on attend de ce produit, mais trop puissant pour du carrelage, on reste coller au sol du coup fatiguant."
Client d'Amazon,"5,0",22 janvier 2019,"Pratique, on peut moduler au niveau de la poignée  l'aspiration que l'on souhaite. Le manche possède une mini brosse , parfaite pour les dessus de meubles. Je l'utilise aussi pour faire la corbeille de mon chat,pas de soucis tous et aspiré.  Sur carrelage et parquet, les aspérités au niveaux des plinthes sont réellement aspirées. Je recommande vivement."
Client d'Amazon,"4,0",30 novembre 2018,Je suis très contente de cette aspirateur pas bruyant mais efficace pour avaler toute poussière et poil de chien un plaisir de nettoyer
Guédan Joël,"5,0",2 mai 2019,"Fonctionne très bien avec une très bonne aspiration, solide, pratique."
Massi BOUDJ,"5,0",1 avril 2019,"Parfait très puissant et robuste, pour plus de longévitée pensez à retirer le filtre et à le nettoyer de temps en temps"
Pierre,"5,0",19 novembre 2018,"Pour remplacer un Dyson, j'ai testé cet aspirateur. Étonnant de puissance. Effectivement il colle au sol! Heureusement, on peut régler l'aspiration. Très facile à vider, en un clic. Je n'aime pas la brosse par contre. Mais dans l'ensemble, et pour le prix, c'est top. À voir dans le temps."
IW,"5,0",3 mars 2019,"Je. suis entièrement satisfaite de mon achat , il correspond exactement à mes besoins. Léger, bonne maniabilité, plus de corvée pour trouver le bon sac puisqu'il n'y en a pas, très facile à nettoyer d'autant que j'ai 2 chiens et rangement dans un petit espace. Je le recommande vivement."
BOUTOUBA,"5,0",12 octobre 2018,Je ne regrette pas ce choix. Aspire facilement avec une puissance plutôt silencieux et manipulation facile d’une piece à l autre. Doit vraiment faire parti des meilleurs de sa catégorie
lilou4,"5,0",13 décembre 2018,"Je suis très satisfaite de cet aspirateur, il est léger, super puissant, les différentes brosses sont très pratiques et utiles, le cordon à une très bonne longueur, bref je le recommande vivement, je suis très contente de mon achat."
chris 68,"4,0",29 juillet 2018,"C'est un très bon outil, mais comme l'écrivent certains, il colle au sol. Il devrait être vendu avec la brosse pour parquet en plus. Je l'ai achetée et je n'ai plus ce problème de trop forte succion."
DUBAR DANIEL,"3,0",6 novembre 2018,"Le câble de l'aspirateur s'enroule difficilement dès la première utilisation...
Le ressort spirale de cet aspirateur est trop faible.
S’encombrer d'un câble non rangé d'aspirateur n'est vraiment pas pratique...
A fuir à moins de prévoir l'achat d'un nouvel enrouleur de remplacement..."
valerie esposito,"5,0",19 août 2018,"pour le prix je suis très contente du produit c est vrai que quand je l ai vu
on aurait vraiment dit un jouet mais l aspiration est vraiment forte j adore ce produit"
mélanie renard,"4,0",22 février 2019,Je recommande cet achat sans problème en plus le prix est abordable et le produit de bonne qualité! Très bonne puissance d'aspiration et l’appareil se dirige très bien ! et la petite brosse ronde est top pour enlever les poils de chats sur l'arbre à chat ou sur le canapé !!! Pourvu que ça dure car j'en suis très contente!
Client d'Amazon,"5,0",23 mai 2019,Produit ayant rapport / qualité prix très attractif.  Produit correspondant à la description du vendeur.
CHEHAMI Fadia,"5,0",31 juillet 2018,"Excellent produit, il est léger et maniable. Il aspire très bien mieux que tous les aspirateurs que j'ai eu jusqu'à présent il faut même parfois ouvrir la grille au niveau du balai pour relâcher l'aspiration tellement il est puissant. Le seul bémol est le cordon que je trouve un peu fin."
CLOUET Emmanuelle,"5,0",9 mai 2018,Il aspire au top. Un peu trop mais on peut toujours ouvrir la trappe présente sur le tube. Le vidage est bien. Seul hic. Il est un peu casse pied pour rentrer le fil.
Jeanne- Marie DELAUNAY,"4,0",3 septembre 2018,"Je pense que ma notation parle d'elle-même : l'aspirateur est petit et léger, donc facile à ranger et à utiliser.
Comme d'autres utilisateurs l'ont indiqué, la puissance d'aspiration est très élevée, de sorte qu'il faut ouvrir la manette du manche pour l'abaisser.
J'en suis très contente et le recommande"
Pons Roger,"4,0",9 février 2019,"Très puissant , trop puissant même ,colle au sol ,mais il fait le travail ."
Client d'Amazon,"5,0",5 avril 2019,"Très bien,fini les achats d'aspirateur pour la forme, et celui là me convient parfaitement, nettoie bien ma moquette et les sols durs pas trop bruyant, efficace"
Billy the kid ,"5,0",5 mars 2019,Rien à redire cette aspirateur et top et pas chère
Selim Mahieu,"5,0",13 octobre 2018,Super aspirateur. Comme un dyson avec un prix beaucoup plus raisonnable. On peux changer la puissance de l aspirateur pour plus de facilité si besoin.
Client d'Amazon,"5,0",31 août 2018,"L’aspirateur est léger, pas si bruyant que ça (mon ancien en fin de vie faisait un boucan d’enfer en comparaison).
Marche fort ! Si vous ne réglez pas la prise d’air, vous ne décollez pas du sol.
Très bon aspirateur, très bon rapport Q/P"
sylvie06,"5,0",15 octobre 2018,enfin un aspirateur qui ne fait pas sembler d aspirer ; gros débit a régler automatiquement….mais un rapport qualité prix excellent et même mieux que des aspirateur beaucoup plus cher...
Florent V,"5,0",10 mars 2019,Très satisfait de notre achat. Aspirateur très puissant et silencieux. Le reservoir n’est pas simple à vider au début il faut prendre le coup de main.
Laetitia L.,"5,0",10 juin 2019,Parfait aspire super bien je recommande
Client d'Amazon,"3,0",22 avril 2018,Aspire très bien facile d entretien mais apres 6 mois d utilisation parfois il y a un sifflement assourdissant .
Anthony maurent,"4,0",12 janvier 2019,"Il est juste top! Franchement je voie pas l’interet De payer une fortune, quand on a un produit de cette qualité à un prix raisonnable"
Pascal,"1,0",2 décembre 2018,Déçu par le produit. Trop petit....je le retourne à Amazon.
laurent julia,"4,0",19 octobre 2018,Sur le plancher flottant et linau non fait des trace avec ces  petite roue .
Client d'Amazon,"4,0",16 mars 2019,cela fait deux semaines que j'ai cet aspirateur et je n'ai pour le moment pas à me plaindre le seul bémol que je pourrais lui faire c'est que le contrôle de la puissance se fait sur le manche grâce à une ouverture que l'on peut ouvrir ou fermer selon le niveau de puissance souhaité.
Client d'Amazon,"3,0",4 mars 2019,"Maniabilité moyenne. Tube flexible trop court pour grande personne (1,80m). Les roues glissent plus sur le sol qu'elles ne roulent. Enrouleur de câble faiblard.
Bonne aspiration, léger, bien vu la brosse accessoire en bout de tube."
MÉNARD JULIEN,"5,0",7 août 2018,"Bon produit, très léger il aspire très fort avec silence, il fait très peu de bruit et il est d’une simplicité à nettoyer.."
nattier philippe,"5,0",26 octobre 2017,Acheter pour mes enfants cet aspirateur remplit tout mes attentes puissant et  assez silencieux équiper de nombreux accessoires et surtout il a un petit gabarit pour l’instant je suis très content a voir dans la durée j' ai confiance dans la marque Rowenta
sebM02,"5,0",4 juin 2019,"très léger, de bonne qualité avec une aspiration très très puissante idéal pour les poils de chien ou chat sur les sièges de voiture ou sur les canapés. Très content de mon achat."
woman47,"5,0",16 mars 2019,"Cool, cet aspirateur ! Et compact.
Très bien conçu.
Efficace."
vincent joel,"5,0",15 mars 2019,Bonjour bien reçu aspirateur premier essai très concluant je le recommande.
Client Amazon,"5,0",13 septembre 2018,il est conforme a la photo tres leger et fontionne parfaitement bien je recommande
Camcam,"4,0",7 juin 2019,"Très bon produit. Très forte aspiration, très esthétique, compact Et extrêmement léger. Seul hic,  il manque un bouton pour régler l'intensité d'aspiration qui peut quand même se faire par le clapet coulissant en haut du manche. Car du coup la forte aspiration rend le manche beaucoup moins maniable."
C. Isabelle,"5,0",26 décembre 2017,"excellente qualité, aspire vraiment bien. Les accessoires sont un plus.
Il n est pas super silencieux mais cela est sans importance."
cécile chamblay,"5,0",28 septembre 2018,"Facile à utiliser, facile à démonter le filtre,
Aspirateur léger facilement transportable"
Prim T.,"2,0",15 janvier 2019,"Aspirateur qui aspire trop fort donc rien ! Même avec la perte d’aspiration en haut du manche ouverte, la tête reste trop collée au sol difficile à déplacer, et pousse donc toutes les miettes etc. Je ne sais pas si le problème ne vient pas de la tête au sol..."
EPP   Meg,"5,0",9 novembre 2017,Excellent produit. Le fils est assez long. Puissance d'aspiration est très bien. Nous en sommes très contents.On le recommande.Mieux que notre ancien Koenig.
ArdnassaK ,"4,0",9 mai 2019,"Très bon produit. Pas déçu du tout pour un achat en urgence car mon ancien m’avais lâcher
Reçu avant la date estimée.
Très simple a monté.  Efficace sur les sols dure , carrelage parquet . Aspire très bien .
Et contre les poiles de chiens !
Je recommande."
ae engel,"5,0",13 novembre 2018,"en plus de sa légèreté et de sa mobilité il aspire vraiment bien et se vide en 2 temps 3 mouvements. bon achat
."
amandine,"5,0",23 septembre 2018,Pas très bruyant.  Forte aspiration. Bon rapport qualité prix.
Arnaud REMY,"5,0",9 juin 2019,conforme
isabelle leveau,"5,0",28 février 2018,Si vous cherchez un aspirateur super puissant il faut acheter celui la .vraiment au top .juste un regret on ne peut pas ranger les petits accessoires dans l aspirateur .
The Joul,"5,0",7 avril 2019,"Malgré un bruit assez élevé et une succion ridiculement puissante, c'est un aspirateur qui fait exactement ce dont j'ai besoin : aspirer tout d'une façon très efficace et définitive (pas besoin de repasser trois fois au même endroit). Facile à remplacer, facile à déplacer, je recommande."
lambert,"5,0",9 mai 2019,"Bon produit, comme tout aspirateur il est un peu bruyant mais très performant pour son côté compact."
Paulo,"5,0",11 décembre 2018,"Très bon aspirateur, fait ce qu'on lui demande"
Tony ,"5,0",7 décembre 2018,Super
arlette deschamps,"5,0",17 octobre 2018,"Super aspirateur et très très puissant, je le recommande"
Client d'Amazon,"4,0",9 juin 2019,Nickel
Neys,"4,0",2 janvier 2019,"APPAREIL RECU RAPIDEMENT AUJOURDHUI. ESSAYAGE : IL EST TRES PERFORMANT ET ASPIRE TRES FORT. UN PEU TROP MEME LOL
IL EST LEGER ET PRATIQUE AVEC SA PETITE BROSSE POUR LES RECOINS ...
je suis satisfaite, on verra maintenant ce que cela donnera avec le temps"
sans,"2,0",9 janvier 2019,"puissance +++; manipulation tube ----- nulle
vidage bac: on en met partout
à éviter avec des animaux"
Client d'Amazon,"5,0",12 novembre 2018,PARFAIT
Aurore refford,"5,0",19 novembre 2017,"Aspirateur léger, maniable, qui remplit pleinement sa fonction d'aspiration, ultra facile a vider. Ca devient presque plaisant de passer l'aspirateur. Vraiment ravie de cet achat!"
Client d'Amazon,"5,0",8 décembre 2018,"Tout est parfait comme d'habitude chez rowenta, silencieux, facile à utiliser et à nettoyer, force d'aspiration réglable, correspond à mes attentes"
mandras mickael,"5,0",26 novembre 2018,Recu aujourd hui je l ai essayer tres bon produit leger la brosse colle au sol point  de vue niveau nettoyage de l appareil tres faciles je le recommande
NANOU 39,"5,0",31 janvier 2019,tres contente de l achat
Sansan,"5,0",15 décembre 2018,"Aspire parfaitement et les accessoires sont pratiques. Seul bémol, comme l’aspiration est forte, j’ai mis un autre balai d’aspiration avec une ouverture plus ample afin de pouvoir conserver la puissance pour plus d’aisance."
Aurelien ,"5,0",22 avril 2019,"Super aspirateur je recommande !
Une bonne puissance d'aspiration surtout pour les poils d'animaux"
cyril boutaud,"1,0",30 décembre 2018,Aspir pas très fort
sabrina brochard,"4,0",23 avril 2018,"aspirateur opérationnel, très bonne puissance, bonne prise en mains et nettoyage facile.
je le recommande en plus c'est fabrication Française."
Yan,"4,0",27 mai 2019,"Très bon aspirateur
Il faut juste régler la trappe d aspiration pour réguler celle ci sinon séance de muscu gratuite
Mais en même temps c est ce que l on attend d un aspirateur
Donc ne pas hésiter
Bon rapport qualité prix !!!"
NAME_NOT_RETURNED,"5,0",26 août 2018,Relplacer l’ancien dans une société qui l’uti Tous les jours
Amélie Cariou,"5,0",14 décembre 2018,Nous sommes très satisfait de cet aspirateur. Il aspire bien (même les poils de notre chat sur le canapé) contrairement à notre ancien aspirateur. Les différents embouts sont utiles.
