user,rating,date,review
Client d'Amazon,"5,0",25 mai 2017,très satisfaite de mon achat il est silencieux et très puissant je le conseil à tout le monde puissance et silence réuni c'est formidable bravo rowenta
Pomshawai95,"5,0",15 juin 2017,"le bruit et plutôt faible
une très bonne aspiration
les différents accessoires sont très utiles
je suis entièrement satisfait de mon achat"
Jaouad.H,"5,0",23 mai 2018,"Bon rapport qualité / puissance / prix
C'est un aspirateur traineau, mais il est très compact ce qui le rend assez maniable.
Il faut voir dans la durée si, les filtres ne se colmatent pas, mais pour l'instant il fait le job.
Les + :
- bonne longueur de câble
- bonne finition
- compact et complet
- Bonne aspiration
-Buse d'aspiration directement intégrée au tuyau / ce qui le rend plus pratique à l'usage
- le faible prix
les - :
- A voir dans le temps, car les aspirateur sans sac ont un filtre qui à tendance à se colmater avec les particules fines ce qui fait baisser la puissance d'aspiration..."
mimine,"5,0",13 octobre 2017,"Ma mère l'a acheté, je l'ai trouvé tellement bien que j'en ai voulu un pareil
SUPER puissant , lavable, léger  ...un vrai plaisir
bon pas de bouton de vitesse... mais on ouvre et ferme le clapet d'air au niveau de la poignée, pas gênant on s'habitue vite"
Vandenbossche Thomas,"5,0",15 septembre 2017,"Produits conforme à mes attentes, je me suis décidé grâce à tous les commentaires ! Et je ne suis pas déçu ! Super puissant, très silencieux !!!très pratique avec tout ses accessoires ! Et je trouve clairement le prix correct par rapport à la puissance ! Compact très léger ! Je l adore !!!"
Client d'Amazon,"5,0",7 mars 2017,Aspirateur aspirant vraiment très très bien. Les 2 brosses du sol au top et les brosses pour les endroits plus petit
couppez,"2,0",8 novembre 2017,"Je suis déçu de mon achat, cet aspirateur fait un bruit de sifflement épouvantable, il n'aspire pas très bien, il est léger, ce qui peut être un avantage mais l'inconvénient c'est qu'il bascule facilement et se retrouve sur le coté si on n'y prend pas garde.
La marque pourtant autrefois réputée à bien perdue de sa réputation. je vais le garder pour les balcons extérieurs et acheter un appareil puissant et silencieux."
Higgins,"5,0",13 février 2017,"Contrairement à ce qui est dit précédemment pour réguler l'aspiration, il suffit d'utiliser le régulateur de débit qui est sur le manche, comme pour beaucoup d'aspirateurs...
Excellent produit, aspirateur puissant et léger qui peut être porté à la main sans difficultés."
Manon Balletti,"4,0",3 novembre 2017,"Bel objet, maniable, léger, compact. Montage des éléments et mise en fonction rapide. Sans sac, le réservoir est a vider 1 fois par mois en même temps qu'il faut nettoyer le filtre. Celui-ci est à remplacer tous les ans. C'est ce qui est inscrit sur la notice  et nous n'en sommes pas encore là, donc je ne me prononcerai pas là-dessus. J'avais un Rowenta X-trem Power avant, j'ai repris cette marque toujours classée en tête des essais UFC Que Choisir, mais je trouve que cet appareil est presque trop puissant: le suceur a tendance à coller au lino ou au plancher, ce qui rend la manipulation un peu difficile, cependant, on peut régler la puissance avec le variateur mécanique sur la crosse. Je pense qu' à l'usage  je finirai par m'habituer à son fonctionnement ..."
Razshal,"5,0",17 décembre 2017,"Pour l'utilisation que j'en ai j'en suis très satisfait, il est très puissant, c'est même perturbant au début quand on passe d'un vieil aspirateur à ce cyclone de constater qu'il ne reste vraiment rien au sol et qu'il n'y a pas besoin de passer 5 fois que que tout soit aspiré.
Je l'utilise principalement sur parquet et carrelage, comme indiqué dans la description c'est parfait pour les sols durs, je nettoie un tapis avec aussi ça fait le job. Étant sensible à la poussière le filtre est un atout, c'est facilement lavable en plus.
Petit plus qui fait plaisir, la brosse est intégrée au manche, du coup on peu passer en mode brosse en 1 seconde sans avoir à aller la chercher dans un tiroir ! Super pratique pour moi qui fait la poussière régulièrement."
Hervé LETEUIL,"5,0",28 février 2018,"Très bon rapport qualité / prix pour cet aspirateur sans sac made in france;
Grand adepte de la marque Rowenta, cet aspirateur tient largement ses promesses.
Super léger, maniable, et doté d'une poignée pour une bonne prise en main dans les escaliers par exemple, l' aspiration est impressionnante sur le parquet et sol dur. Légèrement moins performant sur tapis mais reste somme toute performant.
Son point faible : un peu bruyant.
Fil d'alimentation suffisamment long pour rayonner librement dans les pièces de la maison."
olivier schnering,"4,0",11 novembre 2017,aspirateur pour l'instant qui  donne satisfaction pour un prix raisonnable dans cette catégorie.Bonne puissance d'aspiration.Made in france à recommander.Aspirateur sans sac qui demande un soin particulier sur les filtres pour ne pas alterer ses performances.
Client d'Amazon,"5,0",30 août 2017,"Hyper léger !!! Mais surtout hyper puissant !!! Surtout pour tapis, carrelage et tapis  La puisse est top
Par contre je le déconseille pour les sols en pvc, ou alors vaut mieux qu'il soit bien accrocher car il est tellement puissant que tu ne peux pas le décoller du sol
Tres content de mon achat"
jocaille,"2,0",16 janvier 2018,"l'aspiration reste mediocre, tres décu pour le prix.il reste néanmoins pas tres bruyant c'est juste son point fort.je ne le conseil pas"
Davy,"5,0",11 janvier 2018,il est parfait assez silencieux et surtout puissant. c'est mon premier aspirateur sans sac et j'avais peur des déperdition de puissance avec le temps mais a ma grande surprise il est toujours aussi efficace qu'a son premier jours et ça fait maintenant plusieurs mois que je l'ai.
sylvain alves,"1,0",8 juillet 2018,"A première vu tout va bien...
première utilisation et le petit autocollant rouge se décolle au bout de 2 m2 aspiré...
La photo est parlante..."
ulrich demilly,"2,0",30 novembre 2017,"Au départ, satisfait de mon achat , au bout de 2 mois la prise fonctionne par alternance il faut bouger le cordon au niveau de l' aspirateur car le contact rotatif ne se fait pas bien, désagréable et très gênant pour nettoyer ma maison . Concernant la garantie au bout d'un mois sur Amazon ils ferment les retours marchandise alors que dans le commerce ma garantie est d'un an"
Nuno N.,"2,0",17 février 2017,dommage perte de puissance au bout de 2.5 mois de utilisation que dois-je faire il peut avoir un retour du produit prévu ??
LUIS PADRON GIL,"1,0",6 août 2018,Un bruit insupportable de la deuxième utilisation!!
LEROUX,"5,0",3 août 2017,"vraiment bien,bonne aspiration léger et très maniable.
pour l'instant aussi bien que mon dyson, a voir dans le temps après."
Scad,"5,0",24 octobre 2017,Rien à redire sur la qualité de cet aspirateur. Il est vraiment puissant et très léger. Très satisfait de cet achat.
Flo',"5,0",21 novembre 2017,"En remplacement de notre vieux Philips qui aura fait son temps, nous avons accueilli avec plaisir ce nouveau venu très agréable à prendre en main.
Deux embouts spéciaux parquet et moquette très efficaces.
Se monte et se démonte facilement tout en restant relativement compact ; on le range dans notre canapé d'angle.
Le puissance est largement suffisante pour un ménage d'appartement."
murielle,"2,0",30 octobre 2017,"Absolument déçue par cet aspirateur. Déçue de la qualité, par tout. Aspire trop fort sur certains sols et difficile de réduire l'aspiration. Réalisé dans un plastique peu résistant. que dire de la brosse ?! un gadget par rapport à mon aspirateur précédent."
Client d'Amazon,"5,0",20 octobre 2017,Très heureuse de mon achat je cherché un aspirateur qui aspire vraiment et la je suis sous le charme de celui ci
Client d'Amazon,"4,0",10 décembre 2017,Bon produit.... aspire très bien aussi bien sur le carrelage que le sur le tapis il ne fait pas beaucoup de bruit.
Florie LECHAPT,"3,0",25 mars 2018,"Capacité d’aspiration moyenne.
Brad très court pour moi et je fais 175cm.
Niveau sonore fort mais pas gênant pour moi.
En revanche pas de possibilité de régler la puissance. Il n’y en a qu’une."
Schrantz A.,"1,0",17 mai 2017,"produit de qualité moyenne, le bouton de réglage d'intensité d'aspiration s'est cassé lorsque mon manche est tombé!!
8 mois et déjà une énorme perte d'aspiration!"
BOUQUIN YANN,"3,0",23 septembre 2017,"Semble fragile avec tout ce plastique, puissance impressionnante du coup on ne peut pas trop utiliser la brosse standard sur la moquette (au risque de tordre ou casser quelque chose ) - nickel pour carrelage et parquet"
venturin,"2,0",23 février 2018,"attention, donne l'impression de ressembler a un bon gros aspirateur rowenta, mais en réalité pas du tout,  je suis tres déçu, je pensais avoir fais une bonne affaire avec le prix, mais c'est un aspirateur d'adolescent, pour un petit appartement, mais pas pour une maison de 200m2"
bibi,"5,0",31 mars 2018,"L'aspirateur est top et super puissant ! Tellement puissant que ça me fait mal au dos à la fin de mon ménage car je dois parfois soulever le bras de l'aspirateur pour aller ailleurs (je n'ai pas beaucoup de forces aux bras).
Ça fait décoller mon parquet à certains endroits. Lol
Je suis ravie d'avoir acheter cet appareil qui me donne satisfaction et je le recommande car il est petit, léger et ne prend pas trop de place. Youpiiii ...!!!!"
HENRION,"5,0",7 septembre 2017,""" Je suis très satisfait de mon achat.Cet aspirateur  est étonnant pour la puissance et la qualité de l'aspiration,rien ne lui résiste.Seul petite critique
il faut souvent vider le réservoir qui aurait pu être plus conséquent.""
Maintenant,il faut voir sur la durée ,s'il tient quelques années je suis content.Cet appareil a été acheté et choisi suite à la consultation des commentaires des clients Amazon.Donc merçi à tous."""
Client d'Amazon,"4,0",29 avril 2017,Je suis très satisfait de mon achat. Je trouve le aspirateur un peu fragile mais nous verrons sa durabilité. Contente!
theo,"1,0",9 janvier 2018,"cet aspirateur aspire très tres  bien ,trop bien la brosse reste coller au sol (solution acheter brosse parquet ) pour les sols lisse précision ,donc a part la bonne aspiration que de défauts 1ER , ,  .le manche et trop court résultat mal au reins au dos plutôt.2eme le tuyau et trop court l'  aspirateur  se retourne constamment,le nettoyage du bac ,on en met partout lorsque l'on vide celui ci car la poussière fine se colle a tous les joints ,le manche télescopique lui coincé a la deuxième utilisation super il faut le remplacé ,voila donc a part une bonne aspiration,il y a beaucoup trop de points négatifs,le made in France et vraiment mal pensé;enfin si il s'agit bien de made in France car certaines pièces sont RPC ;j'ai contacter le service clients rowenta seb ect... qui est de bien mauvaise foi et carrément incompétent.................................acheter français ?"
Catherine HUBERT,"3,0",7 mars 2017,"cet aspirateur correspond à mes attentes. il est peu bruyant. le bac de vidage est pratique à sortir. le design est sympa. très forte aspiration, il est très bien et je le recommande"
Vanessa,"4,0",17 octobre 2017,"Reçu aujourd’hui, il est léger maniable et plutôt silencieux. Le seul hic, tellement puissant que j’ai du mal à décoller la brosse du carrelage !! Compliqué donc de passer l’aspirateur ... dommage que l’on ne puisse pas régler la puissance."
DESPEYROUX V.,"4,0",20 octobre 2017,"Satisfaite de mon achat, livré avec 2 brosses et 1 suceur. Livraison rapide, il aspire vraiment bien, voir trop, il faut jouer avec l'appel d'air pour éviter que la brosse reste collée au sol, surtout sur les tapis à poils longs. Je mets 4 étoiles pour l'absence du variateur de puissance."
Gilles T.,"4,0",25 mars 2019,"très surprise par la force d'aspiration, il est léger et sert pour tous l'habitat de 60m2"
Dépense man,"4,0",10 mars 2019,Petit aspirateur que j'ai offert à Noël pour virer un aspirateur à sac!
Anne G.,"3,0",2 janvier 2017,"Silencieux mais,le câble ne rentre pas toujours facilement dans son compartiment. Plutôt satisfait dans l'ensemble, malgré tout, mais impression de fragilité.Pas sur qu'il tienne 32 ans comme celui dont je viens de me séparer."
Bibi 54,"5,0",4 mai 2019,Bien.
Fiora,"1,0",8 février 2018,"Gros problème sur ce produit ! Après 3 utilisations, il ne fonctionne plus ! J'ai essayé de le brancher sur d'autres prises et rien n'y fait !"
xavier,"5,0",16 décembre 2018,"Très bon rapport qualité prix, petit, compact mais costaud. Utilisation intensive suite déménagement. Il se porte a merveille. Il faut néanmoins penser à le vider souvent (Petite taille oblige)"
Cédric,"5,0",8 novembre 2018,"Bon aspirateur complet,puissant,fonctionnel sur tout les Sols avec plusieurs buses dont l’une est très efficace sur canapé en tissus.Il contient suffisamment de câble d’alimentation."
Azaurius,"4,0",2 mai 2018,"Je suis satisfait par l’aspiration de cet aspirateur (il faut utiliser la réglette d’arrivée d’air du manche pour limiter l’effet de succion qui peut être trop présent sur les carrelages par exemple).
Un détail qui m’a plu, le câble d’alimentation est très souple, il ne prend donc pas le pli de l’enrouleur et c’est vraiment très pratique de ne pas avoir le câble tout tirbouchonné !
Le nettoyage et vidage du bac est très simple et les différents filtres sont lavables à l’eau, adieu les aspirateur encrassé qui se mettent à faire forcer le moteur au bout de quelques temps...
Point négatif que je n’ai lu dans aucun autre commentaires : le manche du balais !
Il n’est VRAIMENT pas de bonne qualité, la partie coudée du manche par lequel on tient le balais est de très mauvaise facture (il se plie quand on passe l’aspirateur sur des surface qui accrochent le balais - comme des tapis ou moquettes). Cela donne une impression de produit bas de gamme, c’est vraiment très dommage, je suis convaincu que mon aspirateur ne durera pas au vu de la mauvaise qualité des plastiques du manche... À tel point que j’ai essayé de récupérer le balais de mon ancien aspirateur avant de le jeter, mais forcément ce n’était pas compatible.
Je recommande quand même cet aspirateur qui fait son boulot avec un excellent pouvoir d’aspiration, mais ne vous faites pas d’illusions, au vu de la qualité du manche, n’imaginez pas avoir en main un aspirateur de grande qualité qui vous durera des années !"
bernard,"4,0",25 octobre 2017,"Aspiration formidable même un peu trop, il suffit de régler l'entrée d'air. Par contre plastique de très bas de gamme, je m'en contente compte tenu du prix. Rapport Q/P: bien."
Une amazone,"1,0",5 août 2018,"Aspirateur petit et puissant, trop puissant même au debut. Il a fait un super travail sur la moquette! Par contre, la brosse soit disant adaptable n’est en fait pas du tout adaptée à la puissance de l’appareil, et il colle beaucoup trop les carrelages et paquets. La conséquence principale etant qu’il peut facilement rayer les parquets bois et les endommager sur la durée.
Par ailleurs, je me suis posé des questions tout de suite sur la duree de vie du produit, au vu de la qualité des plastiques qui me semble assez cheap. Finalement, aujourd’hui au bout de trois mois, l’aspirateur (pourtant propre et ayant eu une utilisation normale) n’aspire presque plus rien. Toute la puissance du début s’est complètement envolée, et il faut repasser plusieurs fois pour de simples miettes. Déception totale!"
Phil,"5,0",26 juillet 2018,"Franchement très sceptique vu le prix ou je l'ai acheté, il n'a rien à envier au grand.
Filaire certes, mais au moins il n'aura jamais de problème de batterie.
Très compacte, très léger il se balade partout à la maison sur ses roues.
La puissance d'aspiration est comment dire, WOW !!!!
Bien penser à régler avec le petit variateur du manche sinon vous aurez beaucoup de mal à le passer.
En comparant avec un dyson V6 ou V7, puissance, filtration et même consommation sont idem.
On peut y aller les yeux fermés"
ZMOZ,"1,0",2 septembre 2018,"Après deux mois d'utilisation décevante ,nous confirmons les commentaires précédents : manque de puissance,
dès  que le filtre est un peu sale cela n' aspire carrément plus
pour les tapis décevant
Au bout de deux mois il y a un sifflement perçant au niveau du moteur ( tester a nu sans le tuyeau et le flitre)..... bref NUL SURTOUT NE PAS ACHETER......nous pensions qu'une marque sera une garantie de qualité  mais non !!!!
N'investissez pas sur ce modèle là !!!!!"
LTVT,"3,0",12 novembre 2018,"Je suis satisfaite de mon achat car comme on le souhaite tous lorsqu'on utilise un aspirateur, c'est qu'il aspire. Alors sur ce point pas de déception.  A mon sens, il aspire presque trop ! Cela rend le ménage difficile et fatiguant car il colle trop au sol. Il faut ouvrir en grand le petit  volet sur le manche (je ne sais pas comment ça s'appelle) pour aténuer un peu l'aspiration.
Du coup je ne me sert que de la brosse à parquet qui à mon sens est plus maniable et tout aussi efficace (je n'ai ni moquette ni tapis). La brosse pour les canapés et autres est très bien et très efficace (poils d'animaux). Beaucoup d'accessoires plus ou moins utiles mais ils sont là. Entretien de nettoyage très facile. Autres points negatifs, l'aspirateur est très (trop) léger. C'est bien quand on le porte dans les escaliers, mais il a tendance à se renverser si on tire trop fort. Le fils éléctrique est à mon sens trop court. J'ai une petite maison (80 m²) et je suis obligée de débrancher plusieurs fois pour passer dans toutes les pieces. Mais sinon il aspire très bien et c'est ce que l'on demande à un aspirateur."
justine ,"3,0",12 août 2018,"Aspire trés bien même TROP FORT, aspiration vraiment sportive et enceinte de 6 mois je peine à faire ma maison compléte (80m2) pour le coup ça muscle les bras... Par contre au vu des commentaires j avais peur pour l entretien de mon tapis Shaggy et super, c'est limite la où c'est le plus agréable. Qualité qui ne m'a pas l'air robuste tout est en plastique donc je pense qu'il vaut mieux faire attention une chute pourrait lui être fatale. Niveau place pour le rangement ce n'est pas non plus son point fort il est pour le coup encombrant et aucun rangement pour les accessoires.
Bref je trouve le prix assez élevée pour le coup, rowenta vos prix sont à revoir..."
tutu,"2,0",17 mars 2019,"Grosse déception.... Les 1er mois, comme beaucoup de gens le décrivent, dans les retours, l'aspirateur aspire avec trop de puissance. Puis, au bout de quelques mois (environ 6 mois) la puissance diminue. C'est à dire qu'avec un embout ou même juste la brossette prolongeant le tube d'aspiration, il est difficile d'obtenir un bon résultat de nettoyage. Imaginez vous aspirer votre appartement avec seulement un tube de quelques cm d'ouverture... Autant dire que le ménage devient une contrainte 😅
À raison de 2 utilisations par semaine pour un 35m2 et 1 nettoyage des filtres toutes les 2 semaines, je trouve la qualité de cet objet assez juste, voir même décevant. Je l'ai acheté en juillet 2018 et là en mars 2019, je consulte déjà des sites pour en acheter un autre... Je vais essayer d'attendre encore un peu, histoire de l'utiliser au moins 1 an.
Mes 2 autres aspirateurs étaient des Hoover et ils ont tenus un peu plus de 5 ans tout les deux. Je pense revenir vers cette marque finalement."
Anonymous 4 U,"4,0",28 août 2018,"Mon ancien aspirateur a pris l'âme il y a une semaine. Je voulais changer de marque entre Rowenta ou Dirt Devil pour un prix qui ne dépasse pas les 100€. A la réception et testé juste après le déballage du carton.
J'adore, beau, léger, peu brouillant, c oonsomme peu, le câble est fin et assez long pour faire toute la pièce, les accessoires assez complet, brosse dure, brosse carrelage, mini brosse hyper efficace pour nettoyer mon clavier PC et le plus celui qui est intégré à la fourche, on bloque on débloque, ça éviter de changer si on a un meuble à passer."
romarin,"5,0",5 avril 2018,"Reçu impeccable et dans les délais. Emballage extra. Aspirateur conforme aux descriptions  facile à démonter pour nettoyer le compartiment poussière . divers embouts fournis. facile à mettre et à enlever. Rien à redire . Aspiration correcte. Prix très compétitif par rapport à ceux affichés pour ce modèle dans des  magasins aux marques très connues, A recommander"
Stéphanie,"4,0",2 décembre 2018,"Je prends enfin le temps de donner mon avis... après 10 années de bon et loyaux services, mon Rowenta Delta Silence Force 2000 m'a lâché.Je me suis donc rabattu sur le ""moins cher"", avec une bonne note. Alors, il est très léger, mais le tuyau d'aspiration est assez raide et moins long de +ou- 10 cm que le dernier, ce qui peux être gênant. Je mesure 1.70M. Heureusement, j' avais gardé le tuyau de mon ancien aspirateur avec sa tête triangulaire, que je venais de changer! Les bagues noires qui relient le tuyau à l'aspi son compatibles. J'ai donc installé mon ""vieux"" tuyau (voir photo) et cela à tout changé... Fiabilité de mouvement et surtout plus besoin de laisser ouvert la petite ventilation sur le manche pour que cela glisse. J'avais lu un commentaire qui disait que le balais était impossible à déplacer s'il n'était pas ouvert. VRAIS, mais je pense que la partie raclette y est pour quelque chose. Sinon il est très bien pour son prix. ah, j'allais oublier, oui il fait du bruit mais je pense que cela vient du faite qu'il est sans sac. Un dernier conseil, faites comme moi et achetez rapidement un deuxième kit de filtre, car il doit être lavé et même sur un radiateur il lui faut 24h pour sécher, donc si comme moi vous en avez besoin chaque jour... Voilà j'ai tout dis, j'espère que cela vous aura servis."
Victor Coulon,"5,0",12 juin 2018,"Après avoir passé plusieurs heures à comparer de nombreux modèles, mon choix s’est porté sur ce Rowenta.
L’appareil est compact et le prix est vraiment honnête.
À l’utilisation il remplit tout ce que j’attendais d’un aspirateur. L’aspiration est très puissante. Elle peut se régler en ouvrant plus ou moins la molette d’air sur le manche.
Pour vider et nettoyer le réservoir, c’est très simple.
L’aspirateur est facilement manipulable et transportable.
Je recommande vivement.
PS : je ne prends pas assez souvent le temps d'écrire des commentaires mais là c'est top !"
Soto Stephanie,"3,0",16 septembre 2018,"Livraison reçue dans les temps. Le carton était un peu écrasé dans un coin mais le produit n'a pas été abîmé. Déçue par la mauvaise qualité du plastique dont est fait l'aspirateur. Ce produit aspire trop fort, il aurait fallu intégrer un variateur de puissance, vu le prix cela aurait était nécessaire. Il est léger et maniable, cordon assez long pour mon usage. Facile à nettoyer. A voir après une utilisation dans le temps."
Client d'Amazon,"5,0",29 décembre 2017,"Très léger mais super puissant. J'ai attendu après plusieurs utilisation  pour me faire un avis...car ayant eu un aspirateur de la même marque, J'ai préféré celui ci de par sa légèreté, car j'ai eu un accident dernièrement et cela me va très bien. Et il aspire nettement mieux que l'autre qui coûte plus cher que lui"
RAY,"5,0",21 septembre 2018,"contrairement à ce que disent certains commentaires, cet aspirateur n'est pas très bruyant. Comme tous les aspirateurs sans sac, il faut veiller à le vider souvent et à le nettoyer (un des filtres est lavable à l'eau) et le système d'ouverture est très facile, de même que la mise en oeuvre générale du produit. Comme disent certains, il aspire tellement qu'il ""colle"" au sol (il n'y a pas de réglage de régime d'aspiration) mais le moins qu'on puisse dire c'est qu'il fait son boulot. Pour le prix, je recommande."
alpes,"4,0",6 septembre 2018,"Article révolutionné reçu tardivement et incomplet malgré une description ""Très bon état - emballage endommagé"".
L'aspirateur est performant en terme d'aspiration et facile d'entretien.  Idéal pour une utilisation quotidienne. Il est garanti réparable 10 ans.
A voir sur du long terme.
Un bémol : très peu d'accessoires livrés avec (une seule tête d'aspiration) ce qui fait grimpé sur prix si l'on veut en acquérir d'autres.  Dommage !"
"Bonjour, j'ai vu que vous avez acheté Debout Isis, sauriez vous me donner la taille? Merci d'avance, mon mail est fb340034@skynet.be","1,0",13 août 2018,"Bonsoir, j'ai acheté Détails de commandeCommandé le 25 décembre 2017 (1 article)
Rowenta RO3753EA Compact Power Cyclonic Aspirateur Traîneau (2000w Puissance - 750w de consommation)
Rowenta
Vendu par : Amazon EU S.a.r.L., Je l'ai très peu utilisé et le moteur a soudainement brûle et émis plein de fumée, donc moteur foutu,il n'aspire plus! Quelle arrangement me proposez-vous?
Merci d'avance et bien à vous."
P.L,"2,0",1 septembre 2018,"Je l'ai trouvé de prime abord très puissant, très malléable, très facile d'utilisation. Et dans le second temps, il est tellement léger qu'à chaque virage, il se retourne et aujourd'hui, retour à la case départ, il n'aspire quasiment plus, malgré des nettoyages réguliers des filtres."
