user,rating,date,review
Thomas SUCHON,"5,0",1 février 2019,"Habitué des Xperia Compact, j'avais été très déçu par le Xperia XZ mais Sony repart dans le bon sens avec le Xperia XZ2 Compact.
Après 3 semaines d'utilisation, voici mon avis sur ce téléphone :
Les points positifs :
- Le nouveau format d'écran (21/9) permet de bénéficier d'un plus grand écran sans rendre difficile l'usage à un main.
- Léger et compact, il rentre facilement dans la poche et tiens parfaitement dans la main
- Le rendu des photos est vraiment excellent, même avec une faible luminosité.
- L'autonomie est correcte et on peut terminer la journée sans problème.
Les points négatifs :
-  L'emplacement du lecteur d'empreintes digitales, qui est moins pratique que précédemment car il faut souvent plier le doigt pour l'atteindre
- L'absence de prise jack 3.5mm remplacé par un adaptateur USB type C qui ne permet pas de charger le téléphone en écoutant de la musique
- Le chargeur inclus avec le téléphone ne permet pas d'utiliser la fonctionnalité Quick Charge (charge très rapide) alors que le téléphone la supporte
- Les nombreuses applications installées (AVG notamment) par défaut qu'il n'est pas possible de désinstaller depuis le téléphone et qui nécessite de passer par adb pour les supprimer"
AXD,"2,0",14 mars 2019,"Cet achat onéreux est très décevant ; je ne connaissais pas la marque. Hormis le fait de la taille - raison essentielle de mon choix souffrant d'un handicap aux mains ne me permettant pas de pouvoir tenir les grands téléphones - l'utilisation journalière est franchement complexe, à l'opposé de celle dont je disposais sur mon précédent mobile beaucoup plus évidente, d'où la notation.
J'utilise beaucoup les SMS professionnellement et avec cet appareil deux points très négatifs :
1.Soucieuse de mon orthographe et de ma syntaxe, contrairement à mon précédent Samsung, ici la relecture de vérification est quasi impossible puisque seules trois lignes sont visibles ce qui oblige à sans cesse remonter ou descendre en faisant très attention de ne pas envoyer prématurément le SMS ;
2. Avec le XPERIA Z2 Compact, il faut obligatoirement désigner un destinataire avant le texte et, pour un envoi groupé, la seule astuce que j'ai trouvée est celle du ""copié-collé"", ce qui n'est pas du tout pratique!
Et plein de petits désagréments d'utilisation de cet ordre très déroutants.
Le logiciel d'aide n'autorise pas le questionnement direct puisque orienté dès le départ (questionnaire fermé ce que je déteste vraiment), il faut donc être très renseigné ce qui n'est pas mon cas. Heureusement, les interlocuteurs du SAV de la marque sont d'une très grande réactivité, aimables et patients, mais je ne peux décemment pas sans cesse les appeler.
Puisque mon opérateur ne proposait pas cet appareil dans ses forfaits, j'ai donc dû l'acquérir directement.
Après m'être renseignée auprès de la presse spécialisée (à laquelle du reste je me suis trop fiée), j'ai fort heureusement bénéficié d'un prix promotionnel sur Amazon (merci Amazon que j'apprécie tant), mais cela représente quand même un coût ; je vais donc devoir attendre l'amortissement de mon XPERIA.Z2 Compact avant l'achat d'un nouvel appareil qui ne sera certainement pas de cette marque ;  sagement, je reviendrai probablement à un Samsung d'une utilisation bien plus fluide en ce qui me concerne !"
dadabegr,"5,0",26 avril 2018,"Connaissant Sony pour la qualité de ses photosj'ai choisi ce smartphone pour ses performances photo et video. Filmer en ralenti deviens un jeu d'enfant, et les résultats sont spectaculaires."
Haristoy,"5,0",17 avril 2018,"Pour l'instant, j'adore. Ce téléphone est archi puissant, pour des dimensions enfin raisonnable. Je n'ai pas cet impression d'avoir une planche de surf entre les mains, il est facilement maniable a une main (65mm de largeur). Je trouve le capteur d'empreinte bien placé, assez facile a trouver, surtout avec une coque. L'écran est très bon, l'autonomie est correcte, quoique que moindre par rapport aux versions précédentes (qui été réputées pour être très endurantes à ce niveau). En version noire je le trouve très classe."
Bertrand,"5,0",20 juin 2018,"Tout est dans le titre.
Un seul regret, mon ancien Z3Compact était plus petit ce qui était plus agréable.
Cependant, l'évolution technologique se fait tellement sentir que l'utilisation du téléphone est un plaisir."
Client d'Amazon,"4,0",1 août 2018,"5 pouces = rare. Il manque un port jack pour faciliter l'utilisation des écouteurs, kit mains libres..."
Anthony B.,"5,0",30 mars 2019,"Je cherchais un téléphone aux dimensions réduites, sans faire de compromis sur les composants internes, je n'ai pas été déçu ! L'écran est de bonne qualité, l'appareil photo délivre de très bon clichés... Le lecteur d'empreinte est fiable et bien pratique. Plutôt pastèque que métal, mais la qualité de construction est là. Pour avoir eu quelques téléphones plus low-cost, on sent la différence... et depuis 3 mois que je l'ai les mises à jours sont régulières, ce qui n'est pas le cas avec d'autres marques... Petit bémol, comme d'autres constructeurs Sony a ici abandonné la prise jack (mais fourni un adaptateur usb-c vers jack, qui ne vous permettra pas de rechercher votre tel en même temps, en voiture par exemple...).
Cet appareil correspond parfaitement à mes attentes !"
Jean Pierre Delmur,"5,0",16 avril 2019,"Pas facile à trouver un smartphone qui ne soit pas un monument, surtout si on ne joue pas ou qu'on ne regarde pas de films. Ce petit Sony prend la suite d'un Z5 compact qui a eu un malaise sur du carrelage. ça me va bien. Bonnes images brutes dont on peut contrôler le bruit en basses lumières une fois importées dans un logiciel genre LR ou PS, on ne subit pas le lissage logiciel du smartphone. Autonomie très bonne.
Quant au son, un régal, surtout au casque."
Client d'Amazon,"5,0",3 mai 2018,De la bombe. Je passe d un iPhone 8 et d un HTC U11 et je ne le regrette pas. Ça ne à plus rien à voir avec les anciens compact ! Écran superbe et rapidité. Bravo Sony 👍
Cyrile,"5,0",2 décembre 2018,"Enfin un petit smartphone, il n'a quasi aucun conçurent à l'heure des écran géant qui ne tienne pas en poche
Autonomie correcte, joli écran. Bonne prise en main même s'il est un peu epais
Une protection d'écran aurait été la bienvenue car c'est une vraie plaie d'en trouver une correcte pour ce teL"
Aurionou,"5,0",27 mai 2018,"+
Ca téléphone et ca envoie des SMS!!
utilisation a 1main, ca deviens rare de nos jours
Un bon remplacent pour mon Xperia Z1 qui se faisait vieux
-
Protection d'écran pas facile a trouver
j'aurais préféré le lecteur d'emprunte sur le bouton power CF la gamme X et XZ1
Pris en près commande donc casque VR ou PS4 offerte par Sony du coup ce fut un avantage pour moi qui rêvais de me l'offrir"
Ifergan,"5,0",10 avril 2018,Enfin un telephone de bonne qualite avec processeur rapide et surtout efficace avec les usages du quotidien pour les gens
Bruno L.,"5,0",21 décembre 2018,"Super smartphone à tous les points de vue : finitions, solidité, esthétique, compacité, prise en mains, puissance. Les deux seuls bémols : le poids (mais on s'habitue) et la difficulté à bidouiller (root, ROM alternatives style LineageOS : les DRM Sony risquent de rendre l'appareil photo inutilisable, ce qui serait dommage). La conséquence, c'est pas d'antipub efficace et le fait d'être tributaire de Sony pour les mises à jour. Pour l'instant, on est passé à Pie, mais dans 3 ans ?"
TDYL,"4,0",15 janvier 2019,"Ce téléphone est un excellent choix après un I-phone, la qualité des photos et top. bien plus lumineux que ma précédente pomme. la gestion de la batterie est optimale. la taille est suffisante pour une utilisation de video et jeux tout en pouvant tenir dans la poche avant du pantalon. les seuls bémols, OK Google est moins performant que Siri pour le déclenchement d'Apps, et la compatibilité avec le système téléphonique de ma voiture. mais pour le dernier, je ne suis pas sur que ce ne soit pas du à l'âge du véhicule."
Eric,"5,0",20 décembre 2018,"La qualité Sony est au rendez-vous à tous les niveaux des composants à la fabrication. Le modèle compact est très agréable en main et se faufile dans toutes les poches avec aisance. Le lecteur d'empreintes est très réactif et très sécurisant. Tout le descriptif du téléphone est vrai que ce soit au niveau de la photo, de la vidéo, la qualité des enceintes ainsi que la définition de l'écran. L'autonomie de la batterie est très correcte. C'est un vrai bonheur d'avoir ce téléphone en compagnon de tous les jours. Merci aussi à Amazon pour avoir été au top dans les délais de livraison."
KCO Pro,"5,0",5 avril 2019,"Génial ! C'est exactement le smartphone que je voulais : puissant, petit format, tient bien en main, écran clair et précis, photos de qualité...
Juste 2 surprises :
1. J'ai dû formatter ma carte mini-SD pour qu'elle fonctionne avec le téléphone.
2. le format de l'écran est plus allongé que les formats habituels, du coup le format des photos aussi... mais on s'habitue très vite.
Sinon, ravi de cet achat !"
Julien P.,"5,0",12 avril 2019,"Voilà un téléphone très performant niveau CPU, RAM, et batterie.
Et surtout, PETIT !! Marre de ces planches de surfs de plus de 5pouces!"
dref64,"5,0",15 mai 2018,"Excellent telephone android de Sony, plus compact que les autres haut de gamme meme si plus grand que le Z5 compact précédent, tout aussi puissant qu'un autre haut de gamme. Je reste fidèle à Sony"
CC,"5,0",5 août 2018,"Utilisation pro et perso (dual sim), reception parfaite, rapide et fluide, très bonne photo. Un look un peu ""rétro"" qui sort de la mode des modèles XXL - c'est sympa. Bonne tenue en main et gabarit adapté aux poches. Pas de souci pour le poids, certains exagèrent un peu. SONY conserve son rang de leader."
Angie,"5,0",30 décembre 2018,"Vraiment un bon téléphone de qualité
Dommage qu'il soit si cher et aussi épais (mais ça permet une bonne prise en main"
AlexandreP,"5,0",9 avril 2019,"Simple petit et efficace, belles photos en plein jour et pas trop mal lorsque c est en intérieur. J adore sa taille qui permet de tout faire à une main et qui rentre dans toutes les poches. Super"
Metzler Geoffrey ,"5,0",11 mars 2019,"Très bon smartphone compact, top à tous les niveau photo comprise,tombe très bien dans la main, juste un peu épais sur la version compact"
V.,"4,0",1 novembre 2018,"Bonne tenue en main, design satisfaisant. Puissant."
Anne,"3,0",3 septembre 2018,"Bonne taille (pas trop grand), mais assez épais (12 mm vs 7-8 mm I-Phone) et assez lourd. A considérer lors de l'achat.
Performances semblent très bonnes."
Lionel,"4,0",20 décembre 2018,"Très bon produit sincèrement. Il reste dans la ligné des précédent Xperia compact. Il reste très bon dans les performance. Autant en réactivité qu'en qualité d'image et prise photo.
Seul bémol, il suit la tendance. Il prend quelques mm de plus à chaque nouveau Compact que Sony sort. Dommage."
Bulin,"5,0",3 février 2019,"Bon smartphone, compacte, fiable, sombre ! Un smartphone aussi puissant et efficace que les smartphone haute gamme pour un format plus compact et un prix raisonnable ! Utilisation depuis plus d'un moins aucun soucis !"
Romain,"5,0",27 août 2018,"Acheté pour ma femme car elle recherche des ""petits"" smartphone sous Android, il est juste parfait même si son épaisseur est un peu prononcée. Elle utilisait déjà un modèle compact dans la série des Sony. Celui-ci est idéal en photo avec une belle réactivité. Pour le reste à voir sur le long terme."
Seb,"5,0",10 mars 2019,"Excellent smartphone, superbe écran, fluidité impressionnante, jolies photos, un peu lourd mais c'est un détail et puis ça donne une impression de solidité plutôt appréciable !! Juste l autonomie aurait pu etre meilleure !!
Très satisfait de mon achat !!"
Pierre Antoine,"4,0",26 juin 2018,"Compact avec une grande qualité photo, audio, et rapidité de navigation très agréable, ce XZ2 est une réussite. Un seul bémol, son épaisseur et son poids, mais la forme participe à une bonne stabilité de prise en main."
david,"4,0",27 décembre 2018,Excellent téléphone. Performance au rendez vous. Taille raisonnable loin des standards hors norme du moment. Un peu épais effectivement un effort aurait pu étre fait a ce niveau mais bon la prise en main n'en est que meilleure.
SK,"4,0",3 décembre 2018,"bonne prise en main, telephone un peu lourd, c'est la concession a faire pour avoir un compact. mais le poids n'est pas penalisant. enfin, le site amazon indique une batterie a 3 180mAh alors que le site officiel indique 2 780 je crois....à verifier"
Client d'Amazon,"5,0",16 février 2019,"Rien à dire, il est top. Après 9 mois d'utilisation, j'en suis super content. Pas de bugs, mis à jour sous le dernier android Pie. Je conseille sony du coup."
Client d'Amazon,"5,0",8 août 2018,Ce smartphone est fidèle aux critiques positives qui sont énoncées par tous organismes du secteur. Que du bon en tout point avec en plus une taille qui est pour moi des plus appréciable pour un produit nomade.
ED,"5,0",10 juillet 2018,"Pour le moment au bout de quelques jours d'utilisation très content de ce téléphone. Charge vite, batterie tient longtemps, photos de bonne qualité. A voir pour la suite..."
Client d'Amazon,"5,0",24 mai 2018,"Tout simplement topissime !
Tout est super génial
.... Et de très grande qualité
Vive Sony 😀😀😀😀😆
Je recommande à 2000%"
Michel Molinié,"5,0",6 octobre 2018,"Classique, excellente réception des signaux, bon partage de connexion, bien en main, identification pratique et très facile d'utilisation."
Client d'Amazon,"5,0",25 mars 2019,"Super contente de ce téléphone, petit et instintif, il remplace mon Z5 compact."
Claudine T,"5,0",30 novembre 2018,"Assez facile a utiliser, la camera est vraiment très bonne, je suis très satisfaite de mon achat"
XAVIER,"4,0",26 juillet 2018,"Enfin un produit pouvant rivaliser avec les smartphones haut gamme (convivialité, écran ...).
Je recommande ce produit avec son prix attractif."
WhiteBerry,"5,0",15 août 2018,"Pour un usage pro et perso.
C'est un smartphone haut de gamme compact, qui rentre dans une poche de pantalon sans nous gêner et tient bien une main."
VG,"5,0",11 décembre 2018,Plus de 15 ans de fidélité à la marque et jamais déçu. Le format compact est juste top.
HL,"4,0",15 décembre 2018,"Reçu sous 3 jours, produit conforme à la description
Je recommande sans reserve"
Client d'Amazon,"4,0",21 décembre 2018,Utilisation perso et pro
"""gaiachen""","5,0",9 janvier 2019,mais lourd
Michaël Sapart,"5,0",13 juin 2018,"Un super beau smartphone, il faut prendre l'étui sony avec. Très bonne qualité"
The_WhiteWolff,"5,0",8 septembre 2018,"Super, livre avant la date. En parfait état, aucun problème."
bruno,"5,0",25 janvier 2019,rein  a dire
Davyduk,"5,0",26 juin 2018,"Très bon tel, taille adéquate !"
Thevenard,"5,0",3 mars 2019,Conforme à mes attentes
alves sandrine,"5,0",4 mars 2019,il est juste magnifique
Sergio Pinto,"5,0",28 septembre 2018,Très bon téléphone
captainsanders,"5,0",15 avril 2018,"Il s'agit du seul smartphone Android avec des puissances haut de gamme, mais avec une taille raisonnable et permettant son utilisation avec une main. Ayant eu un Z5 compact avant, je confirme que cet appareil reste très confortable à utiliser, un peu moins léger, mais son écran est bien meilleur. Je l'utilise aussi souvent avec Android Auto, et je constate effectivement une parfaite fluidité, rendant l’expérience plus agréable qu’auparavant.
Bref, un excellent choix pour les possesseurs d'anciens modèles Z compact et pour toute autre personne à la recherche d'un smartphone puissant et pas trop grand."
MJ,"4,0",10 avril 2018,"Pas mal du tout. Une belle progression dans la gamme des compacts Sony. Une alternative dans le monde des smartphone monstrueusement grands.
Ecran excellent et réactif, pas tjrs le cas chez Sony.
La coque en noir est sensible aux rayures, donc coque impérative.
Véloce, très très véloce. Je viens d'un Oneplus 5T revendu quand le XZ2 compact est passé en précommande après un passage sur le XZ1 que j'avais moyennement apprécié (finitions correctes sans plus).
Bon le hic quand même... j'ai dû faire appel à Amazon pour un échange car mon exemplaire a un gros souci de qualité sonore. Le HP inférieur vibre et grésille! De la folie! Appels en HP, musique ou notifications sont affreux d'un point de vue acoustique à cause de ce défaut. Mise à jour logiciel et reboot n'y ont rien changé..."
Jean Valjean,"1,0",1 juin 2018,"Appareil de haut de gamme. Rapide, mais un peu lourd .
En revanche, gros soucis avec l'appareil photo qui se bloque systématiquement.
La batterie a une autonomie très limitée. En usage professionnel, 2 charges  par jour pour pouvoir terminer la journée.
Dommage.
Je reprend la suite de mon commentaire. j'ai renvoyé le Sony au SAS d'Amazon. Après plus de 3 semaines de recherches infructueuses dans le labyrinthe des stocks d'Amazon, mon colis reste introuvable et toujours aucun remboursement. Le système Amazon montre ses limites. Je commence à croire qu'il faut les fuir!!!!"
waide99,"5,0",23 avril 2018,"Téléphone puissant, avec une autonomie plutôt bonne. Et surtout des dimensions qui permettent enfin de trancher avec la course aux téléphone toujours plus grand.
Ecran impressionnant et réactif, capteur d'empreinte réactif, 5 étoiles!"
Pablo Marcos,"5,0",14 juin 2018,"Je cherchais un téléphone comme celui-ci depuis des années. Pour moi, il réunit trois caractéristiques fondamentales qui le rendent unique. La taille est très contenue. Pour les jours qui courent est un luxe d'avoir un téléphone portable assez performant qui tient dans la paume de votre main. À l'intérieur, vous avez le meilleur processeur et une capacité de stockage impressionnante. Et l'extra, le plus, il permet d'introduire une deuxième carte SIM qui marche très bien."
Client d'Amazon,"3,0",12 juin 2018,"Dommage, pas de double capteur photo et un écran grossier"
MisterBlue,"5,0",8 mai 2018,"Si vous êtes portés sur les «Phablets» et les gros téléphones, passez votre route. On est ici sur du compact. J'ai posé un stylo à côté du téléphone sur une de mes photos pour que vous puissiez vous faire une idée. Ce XZ2 compact a l'avantage de se glisser facilement dans une poche tout en embarquant le meilleur des techno actuelles. Un processeur Octacore , 4GB de Ram , 64GB de mémoire de stockage sur de l'Android 8. C'est du petit format mais définitivement costaud. Depuis plusieurs jours j'essaye de de l’essouffler avec des applications gourmandes mais il ne semble pas donner de signes de faiblesses. C'est pour moi le gros gros point fort de l'appareil.
Le design est classique et pas franchement tape à l'oeil. Les finitions et l'assemblage  me semblent nickel. Attention par contre c'est un vrai aimant à trace de doigt et la coque arrière marque assez vite je trouve. Je sais que beaucoup se plaignent de l'emplacement du capteur d'empreinte. J'ai un Zenphone avec capteur avant et un Umi avec capteur arrière plus haut. Là c'est un peu plus central. Par expérience, je sais que c'est juste un coup à prendre. Le capteur est au passage redoutable. Je n'ai pas eu un seul échec sur la reconnaissance de mon doigt. En parlant de la coque arrière, elle est légèrement bombé. Le téléphone reste quand même stable une fois posé sur une table
L'écran  au format  18:9 est agréable. Après il faut que la taille vous convienne. Autant sur un usage  très nomade, c'est un gros avantage de ne pas avoir à se trimballer un machin énorme qui ne rentre dans aucune poche. Autant si vous êtes du genre soirée couette/smartphone, c'est un poil petit. Bref on ne peut pas tout avoir .Je précise que la réactivité est au rendez vous. Après, vu la taille,  c'est pas pour les gros doigts  Toujours au rayon tout va bien, l'appareil photo est assez emballant. J'adore le bouton dédié à l'APN. La qualité des clichés est vraiment très bonne. Clairement l'un des meilleurs APN que j'ai vu.
Niveau connectique, la bonne nouvelle c'est l'USB C et la fin de galère pour brancher le smartphone. La prise marche dans un sens comme dans l'autre. Pas de risque d’abîmer le connecteur. Par contre point négatif, il n'y a pas de prise audio jack. Un adaptateur USB C vers Jack  est cependant fourni. Mais pour le coup, vous ne pourrez charger le smartphone et utiliser un casque en même temps. C'est le seul truc qui me chiffonne. Je ne veux pas enlever une étoile pour ça , mais on va dire que ma note est  de 4,5 étoiles.
J'ai aimé :
- C'est du Sony
- Un smartphone vraiment puissant
- Android 8
- Appareil photo d'excellente qualité
- excellente finition et prise en main
J'ai pas aimé :
- Absence de prise casque jack (mais Adaptateur fourni)"
skwan,"5,0",7 avril 2018,"Précommander le 1er avril pour l'offre sony (a voir dans 3 semaine), la précommande étais super,  une fois envoyer j'ai eu une réduction de la commande du prix initiale passer de 599 a 539€, Sinan ce smartphone pour l'instant rien a dire très fluide et très bon pour la prise en main avec sa forme dos arrondi. Livraison bien prévu pour le 6 comme convenu ( Et avec prime c'est pas trop souvent le cas..)"
Seibel Arnaud,"5,0",16 octobre 2018,"les critiques professionnelles sont unanimes pour dire qu'il s'agit d'un excellent smartphone et je confirme qu'à l'usage, il est parfait.
la double nano-sim est juste le top du top pour les professionnels .
Le capteur à l'arrière ne me dérange absolument pas.
C'est un téléphone que je recommande, j'en suis pleinement satisfait.
Petit regret pour la prise jack disparut quand même"
Client Amazon,"5,0",23 juillet 2018,"Ce smartphone est ultra rapide et compact, l'écran lumineux avec un bon rendu, la prise en main excellente.
Le son stéréo est bon et l'appareil photo est dans la bonne moyenne et offre une rapidité de mise au point correcte
L'autonomie avoisine les 2 jours en usage modéré, la sensibilité réseau excellente permet de capter en zone difficile.
Une fonction intelligente de gestion de batterie permet d'analyser les habitudes et de proposer une charge ultra lente durant la nuit destinée à améliorer la longévité de la batterie, il est néanmoins possible d'utiliser une charge normale ou rapide. Attention, le chargeur fourni est un standard non compatible quick charge ce qui allonge le temps de recharge du téléphone même en mode avion.
Le capteur d'emprunte est réactif
Le téléphone répond parfaitement même avec des jeux gourmands en ressource.
Très content d'avoir changer mon Z3 compact avec ce nouveau modèle sony"
mc'gregory,"1,0",9 juin 2018,"le téléphone est trop petit et trop lourd; Je le savais mais le téléphone perd continuellement la ligne avec tous les opérateurs que j'ai essayés: telecom, vodafone, iliad, le téléphone ne peut pas être utilisé; ça coûte aussi beaucoup et c'est le pire téléphone que j'ai jamais eu: j'ai essayé de le changer mais je n'ai pas été contacté par amazon france même si j'ai posé la question"
romain,"3,0",1 décembre 2018,"Smartphone de 5 pouces aussi encombrant qu'un huawei honor Samsung etc.. de 6 pouces ( voir plus ) sans bordures...
Incroyable ces 2 grandes bandes noires en haut et en bas et aussi l'épaisseur du téléphone, c'est un vrai pavé.
Pas d'écran oled..
Pour le prix il y a largement mieux et même bien mieux pour moins cher"
marchand,"5,0",14 octobre 2018,"Quel smartphone fabuleux ! Finition au top, taille idéal avec un écran de 5 pouces,ultra rapide,écran magnifique, merci Sony de faire encore un téléphone compact haut de gamme ! Du bonheurs n'hésitez pas si vous cherchez un smartphone pas trop grand il n'y a pas mieu."
jeromeg,"4,0",23 mai 2018,"Si vous n'aimez pas les smartphones qui déforment vos poches, ce XZ2 Compact pourrait bien répondre à votre besoin. Sony a (encore) fait du bon travail.
Les points forts :
- La taille (pas trop grand et donc utilisable à une seule main)
- La qualité de l'écran (c'est du Sony !)
- La puissance (tout tourne très bien, y compris les jeux, même un peu gourmands)
- La qualité photo (c'est su Sony encore un fois et ça se voit, au sens propre)
Les points faibles :
- La résolution élevée, fait que les textes peuvent paraître petits (en particulier pour les sites web non optimisés pour mobile, ce qui devient rare il est vrai)
- La batterie qui se décharge assez vite, même avec une utilisation basique, on tient 1 journée et moins en cas d'usage intensif
Conclusion : un excellent smartphone si vous avez besoin de puissance dans un format compact (et que vous avez tout le temps un moyen de charge sous la main). C'est vraiment la batterie un peu faiblarde qui m'empêche de mettre 5 étoiles. Je m'arrêterai donc à 4."
Jean-Luc BRIOIS,"5,0",18 février 2019,"Acheté pour remplacer un Z5 compact en fin de vie.
Exactement la taille que je recherchai et super réactif.
La gestion de la double SIM est parfaite pour une utilisation perso et pro."
Poyutimo,"5,0",15 janvier 2019,"Ce smartphone est excellent, il est puissant et son format compact est très appréciable. Vous pouvez l'acheter les yeux fermés."
Christophe,"5,0",26 mars 2019,Le dernier smartphone a petit écran avec une prestation plus que complète. Le must pour les voyageurs.
Client d'Amazon,"4,0",23 mars 2019,Sa petite taille
Client d'Amazon,"4,0",30 décembre 2018,téléphone au top. ultra fluide
