user,rating,date,review
inadmissible,"1,0",22 mai 2018,"Ce téléphone est mis en avant par Google pour son programme Andoid One (cf site web Anroid One).
Google a fait une mise à jour début mai de l'OS -> résultat plus de 4G avec le réseau Orange/Sosh.
Nokia est au courant du problème qui devrait (ou pas) être fixé par la mise à jours de Juin.
Donc 1 mois sans 4G... visiblement rien ne presse pour Google (en charge des mises à jours).
Google a donc pousser une mise à jours sur les terminaux des clients sans l'avoir testé à minima (la 4G est tout de même une fonction de base) avec le réseau Orange (un opérateur important). Bien sûr aucun message d'excuse de la part de Google ni même d'information sur la résolution du problème et son échéance.
Là, le programme Android One de Google en prend un bon coup pour son image !
Petit rappel d'un des slogans du site Anrdoid One:
""Android, pur et simple
Avec Android One, vous bénéficiez instantanément de la meilleure version d'Android disponible, pour que votre téléphone soit toujours à la hauteur de vos attentes.""
... ce doit être du second degré.
Update : nous sommes le 5 juillet, toujours pas de correctif"
Prodigious,"4,0",8 mai 2018,"■ MISE A JOUR 23 / 06 / 2018
- Le Nokia a enfin effectué sa mise à jour. Je suis passé de la version 8.0 à la version 8.1.0 de juin directement début juin. Certains ont eu des mises à jour dès avril et certains seulement en mai. Le mien a attendu le mois de juin.
- L'interface camera a été améliorée, elle est devenue plus agréable à utiliser contrairement à sa version initiale.
- Apparition d'un thème sombre mais seulement pour la barre de notifications (choix automatique selon l'arrière plan et non disponible si utilisation d'un launcher tiers).
- La charge rapide a disparue lorsque le téléphone est branché et allumé. Elle est cependant toujours là lorsque le téléphone est éteint. Cette restriction est peut être dû à la constatation des utilisateurs d'une forte augmentation de la température lors de la charge rapide quand elle était encore disponible téléphone allumé.
■ Avant propos
Le présent commentaire concerne l'Amazon edition (Nokia 7 plus dual SIM noir + film protecteur). Cette édition n'est plus dispo et désormais se trouve en vente ici une édition mono sim. Ce commentaire pourra tout de même vous aider à vous faire une idée du téléphone en lui-même et vous trouverez actuellement les versions dual sim sur Amazon grâce aux ASIN suivants :
- B07B65SGKJ (dual sim blanc).
- B07B68N35M (dual sim noir)
■ Amazon Edition (plus disponible)
La particularité de cette édition est qu’elle est fourni en plus avec un film de protection écran. Ce n’est pas du verre trempé et à en croire ce qui est écrit c’est mieux qu’un simple film. C’est en fait un plastique assez épais mais souple. A noter, le sticker à retirer après pose tenait tellement, qu’il a soulevé le film, m’obligeant à effectuer une nouvelle pose.
Autre point, cette édition Amazon fait l’objet régulièrement de réductions de prix. Acheté à 368 euros un week-end quand l’édition standard restait à 399 euros.
■ Design
Son aspect noir mat avec finition cuivré fait son effet. Le smartphone se distingue sur ce point par rapport à la grande majorité des smartphones. Après, si l’on veut le protéger avec la coque silicone ou autre, forcément, le bel habillage ne se voit plus. Comme souvent les capteurs dépassent mais cette proéminence se résout avec une coque.
■ Ecran
L’écran 6 pouces (ratio 18:9) est de bonne facture. Certes, ce n’est pas de l’AMOLED, mais la dalle IPS délivre des couleurs vives et des noirs profonds. En veille, l’heure et les notifications ressortent bien tout en laissant le reste noir. C’est vraiment agréable à l’oeil. Un peu semblable à une liseuse.
■ Photo / Vidéo
C’est vraiment bon, surtout quand on sait qu’on a dans les mains un smartphone milieu de gamme (il manque un capteur doté OIS pour prétendre à du haut de gamme). On retrouve Nokia sur ce point après les échecs photos des Nokia 3, 5 et 6.
L’EIS est bienvenue mais est malheureusement dépendante de la qualité vidéo. Toujours activée, la stabilisation n’est pas disponible en 4K. C’est un peu dommage de ne pas avoir le choix même si l’EIS est un plus, on a tendance à penser qu’elle à un prix en terme de qualité.
L’interface n’est pas des plus agréable.
- Une incohérence : le passage photo/vidéo se fait par slide. Mais un menu déroulant contient aussi un bouton photo/video qui vous propose la photo quand vous êtes déjà en photo et la vidéo quand vous êtes déjà en vidéo...
- Un bug textuel : si le téléphone est en français, à chaque début d’enregistrement d’une vidéo le message “Audio OZO est désactivé” apparaîtra, même s’il est bien activé. Si la langue est en anglais, c’est l’inverse qui se produit avec “Audio OZO is enable” même si vous l’aviez désactivé. OZO, c’est cette technologie de 3 micros permettant un son plus immersif.
- 2 façons d’accéder au mode pro : via le menu déroulant ou en slidant le bouton de prise de vues.
A l’instar de la lentille téléphoto, la caméra frontale permet aussi le mode portrait (bokeh). C’est assez réussi, mais les cheveux restent trop complexe pour l’algorithme logiciel pour être totalement réussi.
Niveau couleur, on a tendance à les trouver naturelles quand on photographie des paysages. Mais s’il s’agit d’objet, on trouve alors les couleurs un peu ternes.
Il est possible de contrôler la vitesse d’obturation ce qui est utile pour les photos de nuit. le mode HDR ne m’a pas convaincu et il est préférable de passer en mode pro pour avoir un meilleur résultat du cliché.
A noter que l'autofocus en mode auto n'en fait qu'à sa tête. Vous pouvez pendant 2 secondes mettre le focus sur un élément mais si vous ne photographiez pas dans les 2 secondes le focus se réajuste. La solution est de passer en mode pro pour affiner précisément la mise au point en déplaçant le curseur.
■ Son (mise à jour 25 / 06 / 2018)
Munie d’un seul haut parleur, le son n’est pourtant pas mauvais. Il tire vers le grave, ce qui a pour conséquence au moins de ne pas balancer des sonneries stridente. En sortie jack ou  bluetooth, aucun problème. Cependant, en bluetooth, j’ai relevé une nette différence entre 2 crans de volume (où le niveau sonore monte beaucoup plus). Ce problème se règle en désactivant le volume absolu dans les options développeurs (accès au menu développeur dans tapant 7 fois sur le numéro de build). Les appels voix n’ont montré aucun défaut.
■ Puissance
Avec un Snapdragon 660 et 4Go RAM, les jeux actuels tourneront sans problème (ex PUBG mobile). On peut juste noter de tout petit lags par-ci par-là, mais rien d’alarmant. Le téléphone ne chauffe pas ou très peu.
Benchmark Antutu : 140 311 points
CPU=66067
GPU=30733
UX=3650
■ Autonomie
Très bonne autonomie. Vous pouvez facilement faire 2 jours en faisant tourner quelques vidéos, jeux, Maps et en naviguant sur internet. Les utilisateurs les plus gourmands ne passeront pas plus de 1.5 jour d’autonomie tandis que les plus sages passeront très facilement les 2 jours.
■ Android One (ancienne version, voir mise à jour au début du commentaire)
Si votre unique intérêt pour le Nokia 7 Plus est son label Android One, passez votre chemin. En effet, si Android One nous assure des mises à jour régulières, à ce jour le téléphone tourne toujours sous Oreo 8.0 en date de février 2018. Néanmoins, vous pourriez faire partie des chanceux qui auront le droit à une mise à jour Oreo 8.1. Mais un rapide tour sur divers forum, ainsi que le forum officiel Nokia témoigne d’un nombre de plus en plus important d’utilisateur attendant vainement le patch de sécurité d’avril alors que nous sommes déjà en mai. Android One est à ce jour, en Europe, une promesse non tenue.
■ Divers
- Le téléphone semble teès sensible niveau tactile. Il m'est arrivé (si l'option réveil de l'écran par double tap est activé) que l'écran s'allume alors qu'il était tenu en main. Au cours d'un appel en kit main libre, téléphone en poche a activé la mise en attente.
- Le capteur d'empreinte ne fonctionnera pas si vos doigts sont moites (ce qui peut arriver en pleine chaleur)
(+) Pour
Livré avec coque silicone
Bonne autonomie
Qualité photo/vidéo
Android pur
Bonne accroche GPS
(-) Contre
Batterie inamovible (si seulement il était étanche on pourrait comprendre)
Bugs/lacunes dans la fonction photo/video
Capteur empreinte capricieux (rare)
Un petit like m'encourage à faire des commentaires aussi complet ^-^"
Seb16s,"5,0",7 mai 2018,"A la base, ce qui m'a poussé vers ce mobile est l'expérience Android One que je recherchais vraiment, puisqu'elle garantit une interface Android stock sans surcouche et des mises à jours régulières et durables.
Je donnerais un avis plus détaillés plus tard, mais après une semaine et demi, il en ressort déjà des points positifs :
+ Très bonne finition et qualité des matériaux
+ Interface fluide et efficace
+ Grand écran lumineux
+ Photos très correctes et zoom x2 appréciable
+ Batterie de 3800 mAh assurant une très bonne autonomie et bonne tenue en veille
+ Chauffe peu
+ Double SIM ou microSD
+ Prise jack
+ Bonne réception et qualité du son et des conversations
Quelques points négatifs cependant :
- Pas de diode de notification (mais l'écran s'allume brièvement, ou lors de la prise en main de l'appareil)
- Pas d'étanchéité
- Un peu grand (158 mm), il faut oublier les poches de jean
Mais je lui octroie 5 étoiles pour le moment, pour le prix proposé, il ne présente aucun point faible rédhibitoire.
EDIT du 19/05 : Attention, la MaJ 2.22 avec patch sécurité du mois de mai créé des problèmes de réception en 4G sur le réseau Sosh/Orange, vérifié sur des forums. En attendant un correctif de la part de Nokia, je recommande à ceux qui peuvent encore de ne pas l'installer !
EDIT du 08/06 : le bug semble corrigé, la 4G chez Sosh est à nouveau fonctionnelle. Ne plus tenir compte des commentaires négatifs sur ce sujet. Par ailleurs, cela n'enlève en rien les autres qualités du produit et ne justifie pas une ""mauvaise note""."
XF06,"1,0",6 février 2019,"Concernant la fiche technique et le rapport qualité prix, ça pourrait aller s'il n'y avait pas un problème majeur avec ce tel que Nokia (HMD), informé depuis décembre 2018 ne résout pas:
La connexion Wifi ne fonctionne pas!!
Il faut systématiquement redémarrer le téléphone pour espérer se connecter à un wifi et encore ça ne fonctionne pas à tous les coups.
Si c'est votre wifi chez vous, mettez l'adresse IP ""en dur"" dans le téléphone (quand vous renseignez les infos de votre wifi) et là ça fonctionne. Bien entendu, il faut qu'elle corresponde ""au réseau"" qu'il y a dans votre box ou routeur. (Pour la technique et la config wifi, tuto sur le net ;-) ).
Si vous vous connectez à des wifi public (resto, aéroport...), là ou l'attribution d'adresse IP se fait par un serveur DHCP (il la donne à votre tel et vous ne pouvez pas intervenir) ça ne fonctionnera pas.
Le tel verra bien le wifi et tentera de s'y connecter sans succès, ça tournera en boucle.
Peu importe le wifi, sa sécurité, la bande (2.4Ghz ou  5Ghz).
Bref, ça ne fonctionnera pas!!
(Une adresse IP est un élément essentiel pour se connecter sur un réseau, un élément parmi d'autre mais sans elle pas de net).
Et pas de wifi= pas de grosse maj et autres choses qui nécessitent le wifi et refuse la 4G.
Ce bug touche tous les Nokia 7 +, j'en ai testé deux et les problèmes sont remontés sur différents forums dont celui de Nokia qui dit s'occuper du problème depuis décembre 2018...
A se demander si le problème ne serait pas matériel plutôt que lié à Android lui-même?
Un tel temps de réaction de la part d'un constructeur est inadmissible et cache peut-être quelque chose.
Sur Android 8 et 9, le wifi ne fonctionne pas. Pas sûr que le Nokia 7 + voit Android 10 malgré les annonces, le tel est dans sa deuxième année de version Android, il est donc presque ""obsolète.
Dommage pour de l'Android One...
Si Nokia (HMD) ne sort pas un ""patch"", ce tel restera donc buggé.
Son successeur le Nokia 8.1 dispose d'une grosse encoche qui masque une partie des notifications en haut, un peu dommage de copier bêtement ce que tous abandonnent maintenant. Voilà la réactivité de cette marque.
A 300€, il n'y a pas vraiment d'alternative rapport qualité/prix/performance."
biboy25,"4,0",6 juillet 2018,"Ayant l'habitude d'avoir des smartphone HDG, je trouve que cette appareil est d'un excellent rapport qualité/prix et qu'il est le meilleure téléphone dans sa catégorie (évidemment cela n'engage que moi lol ). Oui c'est un appareil moyenne gamme mais il fait ce qu'on lui demande et il est largement suffisant pour l'utilisation que j'en fais (tout sauf les jeux). Il est fluide, il a une bonne accroche réseau, une l'autonomie excellente, on regrettera la stabilisation optique et la led de notification. Fonctionne sous Androidone donc des mises à jour régulières et les derniers patch de sécurité. On aime ou l'on aime pas l'interface pur android lol. 141000 points sous Antutu."
Stretoo,"3,0",30 mai 2019,"Lassé d’un Samsung dont la surface trop glissante et à l’écran trop fragile en ont vite fait un téléphone prématurément vieilli, je me suis décidé pour ce Nokia 7 Plus. Mon choix a été dicté par les caractéristiques suivantes : un écran Corning Gorilla 3, d’une solidité remarquable, la prise USB C, 64 go de mémoire, la possibilité de monter un micro SD card de 256 go, et surtout la qualité attendue des photos avec les optiques Zeiss. A l’usage ce téléphone se montre tout à fait convainquant et mériterait 5 étoiles pour son rapport qualité / prix. Ce ne sera cependant pas la notation que je laisserai car, sans être mauvaise, la qualité des photos est une grosse déception. Elle n’est pas au niveau de ce que j’attendais des optiques Zeiss mises en avant : manque de définition des clichés et, en extérieur, une dominante peu naturelle du vert. Enfin, ce reproche s’adresse à tous les constructeurs, pourrait-on avoir un écran utilisable en extérieur ? Il me semble qu’il est légitime de s’attendre à pouvoir utiliser son écran en plein jour sans que ce dernier ne devienne pratiquement illisible.  En conclusion : l’optique Zeiss n’apporte rien de plus à cet appareil si ce n’est un argumentaire marketing surfait pour finalement des photos de qualité (très) moyenne à mon goût. Au plan des points positifs : c’est un smartphone solide et agréable à utiliser avec une excellente réception 4G, une lecture d’empreinte redoutablement efficace (largement supérieure à celle de mon Samsung) et une très bonne ergonomie. L’autonomie est tout à fait satisfaisante avec une batterie de 3800 mAh. Peut-être qu’une future mise-à-jour améliorera la fonctionnalité photo…ça ne serait pas du luxe. Je réviserai éventuellement ma notation à ce moment là."
jweikert,"4,0",3 janvier 2019,"Très beau téléphone portable. Solide et bien construit. le son lorsque vous regardez des vidéos est très bon sur le haut-parleur. Il ne dispose pas de charge sans fil et d’un écran Oled. Je le souhaite. Il a le système Android le plus récent, Android 9 qui est génial! J'aime la longue vie de ce téléphone cellulaire. C'est un peu lourd et gros à tenir. Va prendre le temps de s'y habituer. Si vous ne pouvez pas vous permettre un téléphone cellulaire phare, je recommande celui-ci. J'aime la nostalgie d'avoir à nouveau un Nokia. J'adore la vieille sonnerie."
elwind,"5,0",1 février 2019,"Suite casse d'un samsung S8, j'ai acheté ce Nokia 7 plus. Et bien franchement c'est tout bon.
L'écran est grand et lumineux. Certes cela ne vaut pas celui des smartphones haut de gamme mais finalement cela convient.
Android One est parfait pour se débarrasser des surcouches constructeurs. Les mises à jour sont faites dans les temps (Android 9.0 et dernier patch de sécurité).
Le capteur d'empreinte est mieux placé que sur mon S8. L'appareil photo est bon, et permet beaucoup de réglage en mode manuel (pour ceux que ça intéresse).
Pour un usage jeux vidéo 1H30/jour + vidéos netflix c'est parfait pour le prix.
Petit + : vendu avec une coque de protection.
Petit - : Les écouteurs sont à jeter par contre."
Myriam,"5,0",27 août 2018,"Excellent smartphone, je voulais un androïd , le prix reste attractif, il correspond à tout ce que j'en attendais.
La batterie tiens plus longtemps que les smartphones que j'avais auparavant. La taille est parfaite. Au point qu'il a remplacé ma tablette.
Bravo Nokia."
Slolelo,"5,0",2 avril 2019,"J'ai beaucoup aimé ce smartphone, bien qu'il soit à mes yeux un peu trop grand. Le revêtement type céramique est très qualitatif, la photo est géniale, l'autonomie plutôt bonne, dans la moyenne de ce type de smartphone (en milieu d'après midi je le branche). Il est sous Android stock, donc les mises à jour de sécurité arrivent bien plus rapidement que sur un téléphone comportant une sur couche opérateur ou fabricant."
DOM13,"5,0",24 février 2019,"Appareil bon dans tous les domaines , très bien fini et simplement beau .
Pas de surcouche inutile puisque Android 9 se suffit à lui-même et l'assurance de mises à jour rapide avec Android one .
Dimensions de l'appareil encore raisonnable .
Au prix où il était en décembre/janvier ( - de 300 €) on ne pouvait pas passer à côté.
Bravo Nokia, c'est la bonne voie surtout pas d'erreur n'en changez pas même si l'expérience (Samsung puis Huawei) montre que le succès conduit à des engins énormes tant en taille qu'en prix ."
r,"5,0",15 mai 2018,"téléphone qui vaut son prix , 2 semaines que je l'ai et j'en suis content.
il peut y avoir des bugs , mais c'est dû à oreo 8.1, le téléphone en lui-même est vraiment bon."
Bastien.G,"5,0",21 février 2019,"Tres bon mobile au rapport qualité prix imbattable. Ma batterie tiens 2 jours et un peut plus. En utilisation ultra abusive je tiens 1 jour et demis.
La qualité photo, pour cette gamme de prix et top sans non plus remplacé un reflex."
talon bertil,"5,0",8 avril 2019,"Compatible toutes bandes 4g françaises (dont celle de Free).
Super appareil photo.
Logiciel Android pur en version one.
Bonne capacité de stockage interne extensible par sd.
Pas de surchauffe en usage intense.
Batterie 1 journée de 9h en usage intensif."
