user,rating,date,review
david vieira,"5,0",20 mai 2019,"très complet et performant  : il y a toutes les applications qu on a besoin et même celles qu on n utilisera jamais , facile à prendre en main ni trop grand ni trop petit  , on choisit  la langue on met la carte Sim , une mise à jour rapide et c est parti !
bonne capacité de stockage , qualité photos et vidéos au rendez vous . c  est sur qu il y a mieux .... mais c est nettement plus cher alors pour le prix il ne faut pas hésiter . le huawei P20 lite fait un carton
juste un petit bémol j ai reçu ce téléphone avec une notice qui n était pas en français , mais bon qui regarde les notices de nos jours ? et puis si besoin il y a internet ...
je le recommande vivement"
DAGUERRE Doriana,"5,0",15 mars 2019,"Super téléphone, je suis passer d'un IPhone 6S à ce téléphone le Huawei P20 Lite en rose et franchement je ne regrette pas. Il a plus de mémoire, il a une bonne prise en main, puis j'ai l'impression d'avoir L'iPhone 10 tellement le design est ressemblant à L'iPhone 10.
J'aime vraiment ce nouveau téléphone que j'ai maintenant depuis 1 mois."
Dubost David,"1,0",8 avril 2019,"apres seulement quelques mois d'utilisation la votre de protection de l'appareil photo s'est détachée laissant les capteurs à nue qui sont pleins de poussieres.
Le SAV n'est pas tres accueillant et on se fait limite insulter, cela fait deux fois que je suis en contact avec eux mais il ne semblent pas tres préoccupés par mon problème.
Je déconseille l'achat de ce télephone et meme de la marque au vue du Sav"
Mimy80,"4,0",6 février 2019,"Portable très bien, fluide, mais batterie qui ne tien pas longtemps (je le recharge tous les 2 jours) reconnaissance faciale qui ne reconnaît pas desfoi, fait de belles photos, mon conjoint a le P20 Pro, et moi le P20 Lite, le sien est mieux c'est normal, portable que je recommande, mieux qu'une autre marque et surtout moins cher !"
LoDor,"5,0",7 mai 2019,"Je suis trop contente. J'ai vite changé mon téléphone (qui m'a lâché du jour au lendemain) par celui-ci dont je suis plus que satisfaite. Très bonne taille (pas trop grand) un très bonne qualité des photos et de l'image. Ram efficace, rapide, pour le moment je n'ai rien à dire. À part prendre un coque rapidement car il a l'air fragile à l'avant (écran) et à l'arrière.- j'ai pris une coque en silicone, ça fais très bien l'affaire."
Client d'Amazon,"5,0",8 février 2019,"C’est un téléphone qui ne fonctionne pas sur le réseau bouygues et SFR, j’ai appelé huawei on me dit que c’est un produit à destination du marché chinois.
Je l’ai renvoyé et on m’a relivré un autre identique destiné au marché européen dans les temps sans problèmes particulié."
Client d'Amazon,"5,0",31 mai 2019,"Livraison rapide. Article arrivé en très bon état. L'emballage est de qualité. Les composants du tél sont complets : chargeur, écouteurs, câble USB... Modèle confirme à ce qui est attendu. J'ai recommandé pour ma fille après avoir commandé pour mes deux frères !"
Client d'Amazon,"5,0",6 avril 2019,Téléphone arriver rapidement aucune choses à signalé pour le moment pas de problème très beau écran très fluide le seul truc c'est qu'il n'y a pas de coque dans la boîte livrée avec alors que habituellement si mais bon heureusement pour moi que j'en est commandée une. Sinon tout va bien pour ma part pas de mauvaise surprise comme j'ai vue dans les commentaires
MANCEAU,"3,0",8 juin 2019,"Le produit est arrivé en temps et en heure en parfait état, c'est un bon point par contre ne veut pas du réseau wifi de la Box Bouygues. Après avoir branché débranché la box, renter le code wifi en majuscule ou en minuscule, éteindre rallumer le portable rien n'y fait pour capter le wifi...Je crois que beaucoup de gens sont dans le même cas alors s'il y a une solution je suis preneur, Merci d'avance"
José Bibione,"5,0",27 avril 2019,Excellent produit
 KARO,"5,0",11 avril 2019,"bonjour
ravie de mon achat, par contre……… mauvaise surprise pour le paiement……..au lieu de me prélever en 4 fois comme ma demande, très étonnée de voir sur mon relevé que l'on m'a prélévé la totalité!!!!!!!!
CA"
Virginie,"5,0",24 janvier 2019,"Ce fut mon cadeau de Noël, il est sympa, intuitif, léger
J'aime beaucoup mon nouveau téléphone.
J'ai mis qu'une étoile sur la reconnaissance facile car j'ai jamais réussit à le faire fonctionner, ni l'empreinte digitale d'ailleurs... Dommage"
Nicolas,"1,0",8 juin 2019,"J'ai commandé ce téléphone vendu comme neuf
Un peu surpris de retrouver dans le téléphone une vidéo datant du mois de mai alors que j'ai reçu le téléphone hier (7 juin)
De plus le chargeur ne fonctionne pas !
Pour couronner le tout impossible de se connecter au wifi, message d'erreur à chaque fois : ""Délai de connexion expiré. La connexion à échoué""
A éviter, SAV plus que limite. J'ai fait une demande par chat, après avoir été baladé d'interlocuteur en interlocuteur sans réponse j'ai envoyé un mail. La personne ne comprenait pas ma demande !"
Nabylla,"5,0",18 avril 2019,"J'avais déjà un Huawei donc ça ne me change pas bcp , mais c'est une première de commander un téléphone sur un site autre que les opérateurs et je suis très contente , c'est mon premier jour d'utilisation mais il m'a l'air nickel .
Commande un dimanche reçu le mercredi , emballage très simple mais apparemment suffisant."
barbedette,"5,0",5 mai 2019,"Acquis depuis quelques semaine seulement suis très content de mon acquisition. Pour l'instant fonctionne correctement, très réactif, écran pas salissant et ce nettoie facilement. A voir dans quelques mois s'il fonctionne aussi bien."
Angelique,"3,0",6 mars 2019,Acheté pour remplacé mon note 4 perdu 😢... Qualité photo moyenne qualité sonore moyenne... Déçue par ce téléphone même si certains  aspects sont sympa: personnalisation du clavier lecteur empreinte et reconnaissance facial.
JoMannx,"5,0",31 janvier 2019,"Avec ses 4 go de ram, ses 64 go de stockage, un format réduit pour un 5,84 pouces et un poids minimal, ce smartphone me convient parfaitement. Il remplace un P8 lite 2017 qui était déjà bien mais avec trop peu de mémoire. Actuel, rapide et performant, je ne regrette pas mon achat."
Cazzy,"5,0",27 avril 2019,"Une livraison rapide (un colis un peu light vu le telephone à livrer) et une excellente surprise lors de l'utilisation de ce nouveau smartphone.
Qualité de l'écran, empreinte digitale super pratique, rapidité d'exécution, tout est top
Je recommande vivement ce produit"
beenoix,"4,0",5 juin 2019,"Design super digne d'un iPhone X
Très réactif
Photos de bonne qualité avec une bonne luminosité
Par contre, câble USB changeait quasiment immédiatement et je n'ai pas eu les écouteurs dans la boîte"
CHARLES Jean Claude,"5,0",2 juin 2019,excellent produit même si l'évolution future est incertaine pour les mises à jour des applications
Océane Hindryckx,"5,0",28 février 2019,"Je suis plus que satisfaite. Acheté en dépannage mais Huawei vient de méfaire changer d'avis moi qui suis u'e adepte de Samsung. Je viens d'y trouver mon bonheur au point de vue de la qualité d'image.
Juste un bémol sur la batterie qui je trouve se décharge trop vite à mon goût."
poupybodi,"4,0",1 juin 2019,"Modèle choisi pour remplacer un Huawei P9 Lite. Qualité globale en hausse, capacité de stockage parfaite. Juste une petite déception : l'appareil photo, malgré le rajout de nouveaux effets, ne me semble pas vraiment en réel progrès par rapport au P9. Mais globalement, ça reste du bon matériel avec un très bon rapport qualité/prix/prestations."
christian adam,"5,0",6 janvier 2019,Super téléphone malgré sa batterie de dimension plutôt légère à une autonomie de 48 heures ce qui n'est pas mal photos de qualité les films nickel petit problème de réglage au niveau de la messagerie rien de méchant pour changer les couleurs et le vibreur en alarme hormis ça tout va bien
Client d'Amazon,"5,0",10 novembre 2018,Utilisatrice du p10 lite qui n à aucun défaut.... J ai pris le p20 lite en bleu pour mon Noël. Le bleu est magnifique. La nouvelle forme du téléphone est plus élégante. Pas de défaut pour moi. Je recommande à 100%
Mina,"5,0",14 mai 2019,"Conforme et très bon smartphone, photos top"
Client d'Amazon,"5,0",8 mars 2019,"Je suis vraiment satisfaite! Recommandé par un ami alors que je voulais m'acheter le Samsung S9 (ce qui coûtait relativement plus cher), je me retrouve avec la même qualité que ce dernier, pour un prix très raisonnable! Rien à redire sur la qualités des photos/vidéos, c'est vraiment génial. Il est vraiment très fluide et l'écran est très beau, et j'ai pu récupérer toute mes données de mon ancien téléphone en un rien de temps! N'hésitez surtout pas!"
florian,"4,0",25 décembre 2018,"très bon Smartphone
facile a utiliser et de qualité
prend de très belle photos
je le recommande"
lisan,"5,0",6 janvier 2019,Un très bon téléphone androïde que je recommande vivement très facile d’utilisation mais pour quand même pas pour personne âge un difficile au début très beau et fonctionnel et fait de très belles photos
Seysu,"5,0",31 décembre 2018,"Alors, la génial ! J'étais surpris du téléphone il est vraiment génial très facile à apprendre il y a une reconnaissance facile très développé j'ai rien d'autre à ajouter que c'est un téléphone parfait ! Juste pour les grands amateurs de photo / vidéo c'est pas toptop"
ALD,"5,0",4 janvier 2019,"Très bon smartphone. Largement suffisant.
Photo correct
Autonomie correct
Recharge rapide
Ma femme est ravie... Moi aussi"
Mymy27670,"5,0",9 décembre 2018,"Produit neuf
Téléphone très réactif
Léger. Utilisation très facile
Je suis ravie moi qui passe d'un Samsung s6 à ce Huawei p20 lite"
MAELYS ,"5,0",26 mai 2019,"Fluide, rapide, un effort à été fait sur la luminosité, on peut s'en servir dehors avec du soleil, photos de bonne qualité même dans l'obscurité, super tel, pour le prix il n'y a pas plus performant"
sof,"5,0",3 mars 2019,"Tout ce que j'attendais d'un portable 📱 voire plus... Fini les Samsung je reste sur la marque Huawei
Je recommande vivement, n'hésitez surtout pas.."
morel Martine,"4,0",12 mars 2019,"Très bon produit, avec un prix tout à fait intéressant par rapport à Samsung ou iPhone
Compatible avec le réseau français, de très belles photos, facile pour moi qui suit pas toujours très doué avec les portables
Je recommande pas du tout déçue
Arrivé un jour avant"
Cestaurel,"5,0",30 juillet 2018,Ce téléphone est super que ce soit niveau qualité ou niveau batterie. Rien à dire je le recommande
N'Oriane,"4,0",27 avril 2019,"Téléphone bien arrivé, il est vraiment beau. Je le trouve fluide, bonne connexion, facile d'utilisation, bonne photos.
2 bémols : il ne fonctionne pas avec le chargeur universel ; lors de la première utilisation il a pas mal chauffer en haut. Maintenant il chauffe beaucoup moins mais toujours un peu. Cette chaleur risque d'abîmer les composants dans le temps, donc à voir sur longue durée."
Lo,"4,0",22 mars 2019,"Téléphone de bonne facture, écran agréable, réactivité très correcte (pas de ralentissement du système, capteur digital rapide), emplacements microSD et mini jack très appréciables, charge rapide, bon design. Beaucoup de qualités mais... appareil photo vraiment médiocre, les couleurs sont tristement ternes, le bruit est important, c'est vraiment sur l'appareil photo qu'on comprend qu'on n'a pas acheté du haut de gamme. Pour le reste, c'est un très bon téléphone."
gaubert,"5,0",5 mai 2019,"Très bonne transaction. Arrive en bon état. Je vous envoi rapide. Bon rapport qualité. Seul bémol, je m'attendais à une qualité de photo beaucoup mieux que le p8."
Vitali,"4,0",7 juin 2019,"l'appareil photo (nickel),C'est un smartphone d'un excellent rapport qualité/prix.
Offert à mon épouse en remplacement de son redmi, elle est ravie.
Portable très bien, fluide, mais batterie qui ne tien pas longtemps (je le recharge tous les 2 jours)."
franck cerato,"5,0",30 avril 2019,"Téléphone pour mon fils de 13 ans.
Un peu grand mais de très bonne facture.
Il est très content depuis 1 semaine."
fouquet armel,"5,0",14 avril 2019,"Pas de souci le téléphone convient à la version française
Il fonctionne très bien et conforme à mes attentes
Apparemment garantie 2 ans selon la personne à qui je l'ai acheté
En espérant que je n'ai pas besoin de faire appel à lui"
Client d'Amazon,"5,0",3 mars 2019,"Enfin un excellent téléphone qui ne ressemble pas à une cabine téléphonique avec son format raisonnable qui tient bien dans la main et qui ne prend pas trop de place dans la poche. De plus Huawei est une des seules marque qui peut envoyer des groupés sans aucun problème (70 personnes différentes d'un coup) j'ai tester Samsung, Sony et Asus impossible Aves ces marques. Il fait de très belles photos. Je recommande ce téléphone."
Jen Kéo Guyom,"5,0",24 mars 2019,Très bon produit rapport qualité prix au top. Je suis vraiment très satisfaite de cette marque alors que j'avais des réticences.
Client d'Amazon,"5,0",11 mai 2019,"Le téléphone est conforme à sa description. Agréable à manipuler, performant, avec une batterie qui tient la journée sans problème. Bonne qualité des photos.
Seul bémol : l'identification de l'appelant ne marche pas pour les numéros enregistrés au format international"
Olive,"5,0",17 janvier 2019,"Je suis satisfaite, l'espace de stockage, la qualité photo, le design et la facilité d'utilisation.
Je voulais le rose pour des raisons esthétique mais il était un peu plus cher. Je me suis contentée du noir et je ne suis pas déçue."
Nyny,"1,0",18 avril 2019,"Vraiment déçu ! Produit reçu avec boîte déjà ouvert ! Inadmissible pour le prix. Après première utilisation, il présente déjà des beug.. On voit qu'il a sûrement été reconditionné. Je ne recommande pas du tout ! À fuire de toutes urgence !!!!!!!"
Adeline ,"5,0",24 juillet 2018,"Je l'adore, ce téléphone est parfait. Je les commandé vendredi en prime il est arrivé aujourd'hui avec colis privé dans un bonne état. Je recommande fortement ce téléphone. Très bon rapport qualité prix."
Matt972,"5,0",9 mai 2019,"Livraison dans les temps.
Le téléphone est arrivé dans sa boîte emballé avec tous les accessoires
Le téléphone fonctionne très bien."
Client d'Amazon,"5,0",4 novembre 2018,"J'adore ce téléphone facile à configurer.
De bonne qualité avec un bon prix.
À recommander"
CHRIS,"5,0",19 mai 2019,"Remplacement de mon P10 par ce P20 Lite
Prise en main facile, transfére de mes données impeccable.
La première chose qui saute aux yeux c'est la qualité
de la résolution de l'écran nettement supérieure au P10.
Pour le reste c'est juste une bonne évolution
du P10 LITE qui était déjà un petit bonheur pour son prix"
guerin,"5,0",9 janvier 2019,"Tout à fait satisfaite de mon achat. Facile d'utilisation, appareil photo nickel, toute les options sont très facile à appliquer. Je recommande ce téléphone."
Roussel,"5,0",27 avril 2019,"Pour l'instant très satisfait, très fluide, fonctionnement impeccable, taille idéale pour sac à main !"
Yéro S.,"2,0",14 mai 2019,"J'ai reçu mon téléphone avec une petite fissure derrière mais je me suis dit c'est pas grave, je vais pas le retourner à cause de ça. Mais ce que j'ai pas aimé sur ce portable est qu'il est trop lisse, il glisser facilement dans tes mains et tombe. C'est ce qui m'est arrivé, il est tombé une seule fois et s'est cassé alors que je l'ai eu il y'a juste un mois.
Je suis dégouté 😞"
Ymel74,"4,0",5 novembre 2018,"L'appareil est compacte et léger. Fonctionne correctement. Bonne fluidité. Le seul point négatif a mon gout c'est la surcouche Huawei. Android pur est si agréable, pourquoi en rajouter !"
Cricri,"4,0",12 mars 2019,"Très bon produit, reçu rapidement et bien emballé..... Mon problème, je n'ai pas fait attention qu'il fallait une nano sim....
Sinon, moi qui ait toujours eu des Samsung je dois faire attention aux touches... Et les enfants ne peuvent plus me le prendre en cachette sans l'empreinte de mon index...
Je ne regrette pas mon achat et recommande le vendeur."
Alain R.,"4,0",26 avril 2019,"Très content de la capacité de stockage par rapport à la gamme lite de ce tel
Mise en service rapide
Possibilité d'installer une 2eme carte SIM ou une carte SD pour augmenter la mémoire de stockage.
Reconnaissance par empreinte digitale ou faciale.
Appareil photo très satisfaisant pour une utilisation courante
Je recommande pour une utilisation courante."
corinne,"5,0",2 mars 2019,Facile a utilisé très bon smartphone les autres marques .Je possède un S9 et franchement rien de plus
Mrt.Dusky,"4,0",14 février 2019,Se portable est très bien il a une grande capacité de mémoire mais après 6 à 8 mois la charge commandé à défaillir dommage
Peggy Monia,"5,0",3 juin 2019,Appareil très fluide et une prise en main parfaite. Je le conseille sans hésiter '
Mc@th,"5,0",8 mai 2019,"Livraison 3 jours avant la date prévu !
Prise en main facile ! 😋
Je passe d un P8 à un P20 c est au top !
Avec l app Phone Clone j ai pu transférer d un appareil à l autre sans rien perdre !
Convivial. Ludique. 👍👍
Le moins = déçu des dimensions de l écran !
Pas assez large 😞"
Client d'Amazon,"5,0",15 janvier 2019,Très bon produit tout à fait ce que j'attendais prix et livraison très rapide et sérieux je vous le recommande vivement
aissatou  soumah,"5,0",24 mars 2019,Jadoeeeeee 😍😍 rien a dire que wowww 😍😍 j'ai pas encore tester la reconnaissance faciale mais j'adoreeee 👌
CAMPFORT,"4,0",15 décembre 2018,"Utilisatrice modérée, supporte les Gilets Jaunes, bon appareil, comparable au Samsung, affichage de belle qualité, système android à l'instar de Samsung, photos de très bonne qualité, simple d'utilisation, prix en promo avec package de protection."
Client d'Amazon,"5,0",8 janvier 2019,"J'adore ce téléphone il est enfin à moi, et pour le prix franchement c'est très recommandable !
Plus besoin de déboursé des sommes folles pour le même rendu de qualité avec ce Huawei p20 Lite !"
Catherine DENAT,"5,0",18 mars 2019,"C'est mon fils qui l'a mis en route. Et je m'en sers quotidiennement, il est facile d'usage, fait de super photos, pratique et fiable. Moi qui ne connaissais pas cette marque et m'en méfiais un peu je le conseille à tout le monde !!!! Voilà très contente de mon achat."
Septsault,"5,0",19 mai 2019,"Quelle bonne surprise ! Ce produit m'avait été recommandé par un ami. Il est très bien. Réactif, avec une très bonne autonomie, une  capacité de stockage extra, je ne peux que le recommander."
Phil.g,"1,0",15 janvier 2019,"Au départ plutôt très content du Huawei p20 lite, mais 3 mois après déçu ! En cause l'empreinte digitale ne fonctionne plus. Après plusieurs tentatives infructueuses de réinstallation de celle-ci je suis très mécontent."
flayer,"5,0",1 février 2019,"Le P20 lite est super pour le prix, je le recommande il remplace mon Samsung S8, il est pas loin d'être équivalent, juste attention sur les photos dans les endroits sombre."
marina mura,"3,0",26 décembre 2018,Le téléphone en soit il est très bien mais je m'attendais à mieux parce que ça fait 15 jours que je l'ai et il commence à bugger déjà
 Amandine,"5,0",4 janvier 2019,"Bonjour, j'ai acheter ce smartphone le 2 janvier je vient de le recevoir. Je suis impressionné par la taille de l'écran, très rapide d'utilisation. La qualité d'image est génial. Niveau batterie il  y as l'air de bien tenir.
Comparé à mon Samsung A5 je peut dire que Huawei a mis la barre haute.
Je le conseils vivement.
Merci à Amazon.com pour l'envoie rapide."
Fred95,"5,0",27 décembre 2018,"Rapide, beau, écran très lisible, les photos sont correctes, il est beaucoup mieux que mon vieux Lumia 830 😊 Pour le moment, je ne vois pas de grands défauts !"
Affriat,"1,0",22 février 2019,Téléphone sympa mais souffre d'un problème dès que je l'ai reçu le capteur de gravité et d'autres capteur ne fonctionne pas donc je ne peux pas avoir la boussole ni avoir le changement d'orientation
Stephane Braun,"5,0",18 mai 2019,"Super smartphone, bonne qualité, léger, maniable, fonctionnel,... je l'adore"
kokanpatte,"5,0",6 mai 2019,"Superbe téléphone rien à dire mais l'écran aurait été meilleure amoled
Si non un turie"
CLAUDE MAURICE,"5,0",4 juin 2019,je ne connaissais pas la marque mais après avoir acheté ce télephone j'ai adopté huawei
Lio,"5,0",27 avril 2019,Facile d'utilisation et rapport qualité prix excellent
Client d'Amazon,"5,0",5 juin 2019,"Usage standard téléphonie, sms/mms, e-mail, photos/vidéo et navigation Internet en Europe.
Appareil confortable avec fonction de récupération configuration d'un modèle précédent réalisée à 80%"
Maréchal F.,"5,0",19 avril 2019,"J'aime beaucoup ce téléphone, il est léger, d'un visuel très sobre , je viens à peine  de le régler, ce n'est pas trop compliqué ( j'ai 75 ans ) !!!!"
boulette,"1,0",31 janvier 2019,Le mobile envoyé n'est pas un Huwaie mais un mobile d'une marque inconnue
morel,"5,0",11 décembre 2018,"Je suis très satisfaite de mon téléphone, léger, beau, agréable à manipuler. La batterie tient très bien ( elle est neuve dc bon normal), l’esthétique du téléphone est vraiment sympa, les applications aussi. Photo / vidéo super qualité. Je recommande ce téléphone !"
Tifaine S.,"5,0",29 avril 2019,"Le meilleur téléphone pour le prix. Qualité photo excellente, bonne mémoire, reconnaissance facile enfin toutes les fonctionnalités d'un téléphone à 800euros alors qu'il n'en vaut que 200."
Alexandre T.,"5,0",12 janvier 2019,"Après 1 mois d'utilisation, le ressentit général est assez positif, bonne autonomie."
Christophe,"5,0",27 octobre 2018,"Reconnaissance faciale empreinte digitale
Mot de passe
Look très simpa
Je ne regrette pas mon achat"
philosophe,"5,0",26 avril 2019,"un très bon appareil,de très belles photos,et surtout petit prix!"
Amazon Customer,"5,0",12 mai 2019,"J'ai été totalement convaincu par ce téléphone, non seulement son design est juste d'une pure beauté mais en plus son utilisation est simple et les photos. Oohlallala elles sont justes splendide avec ça même plus besoin de faire des retouches."
Rb,"5,0",9 février 2019,"C'est un téléphone avec un grand potentiel pour le prix.
J'apprécie : le design la légèreté la qualité de l'écran et l'appareil photo.
Le seul petit point négatif : la batterie. (pour une utilisation modérée elle tiendra toute la journée)"
mac2b,"3,0",31 janvier 2019,Tres bon telephone mais attention il n’y a pas de notice en français
Abbans,"5,0",21 mars 2019,"Pour l'heure, que des félicitations..."
Aurel078,"1,0",5 décembre 2018,"Bonjour,
Très déçu du téléphone, il est impossible de mettre le téléphone en mode paysage. La rotation automatique ne fonctionne pas. C'est dommage car sinon le téléphone a l'air bien..."
Client d'Amazon,"2,0",22 janvier 2019,"J'ai acheté ce téléphone pour mon anniversaire. L'option Rotation automatique ne fonctionne pas. Je l'ai remarqué pas tout de suite car je n'utilise pas cet option souvent. En outre, la batterie ne tiens pas long temps. Je suis obliqué de la recharger une fois par jour au moins. Je suis bien deçu de mon achat!"
Marie,"5,0",25 avril 2019,"Huawei p20 lite Conforme à la description, léger, fin"
Client d'Amazon,"5,0",21 avril 2019,Le téléphone semble être de bonne qualité. Belles photos et très bonne réactivité du téléphone lors de son utilisation sur internet. Le téléphone était neuf (étiquettes au niveau de la boite). Belle couleur à l'arrière.
Bisoumat,"5,0",12 avril 2019,Très beau produit fonctionne très bien.
patrick k,"5,0",20 février 2019,Bon smartphone à petit prix aucun bug depuis son utilisation mémoire suffisante
Sandrine ,"5,0",9 avril 2019,"Très beau téléphone, reçu en 1 semaine environ il remplace mon honor 9 lite et pour le moment j'en suis très contente, un petit point négatif au debut quand on fait les reglages le clavier ne restait pas en place mais après avoir cherché et fait quelques reglages sur switkey plus aucun soucis"
nathalie,"5,0",24 décembre 2018,Fonctionne super bien. Reçu dans les temps. Coque et film protecteur fourni avec le téléphone. Alors que c’etait pas marqué.
Client Amazon,"5,0",13 avril 2019,"Excellent téléphone, ne rame pas, lecteur d'empreinte très pratique pour déverrouiller rapidement l'appareil.
Charge très bonne grâce à la technologie USB C."
Benjamin,"5,0",24 janvier 2019,acheter pour ma compagne celle-ci est totalement conquise les couleurs de l'écran sont juste magnifique et une utilisation très simple comme toujours chez Huawei cela fait maintenant des années que j'achète toujours leur téléphone qui sont toujours top.
Sophie67,"5,0",12 avril 2019,"Un magnifique téléphone, fonctionnel et efficace.
Livraison rapide et très bien emballé."
Client d'Amazon,"4,0",9 février 2019,Appareil très agréable à utiliser très malléable des couleurs magnifique petit bémol se décharge rapidement
zigliara beatrix,"5,0",9 avril 2019,"super téléphone portable, très performant,se décharge lentement et  se recharge vite. Très bon appareil photo !"
Florence,"5,0",15 mai 2019,Trop beau et très pratique facile d'utilisation avec un méga stokage de mémoire trop bien
Laurent.B,"5,0",17 janvier 2019,"Livraison rapide.
Très bon téléphone, l'un des meilleurs dans sa gamme de prix"
pascal steyt,"5,0",18 avril 2019,Par fait a mon attentes
Client d'Amazon,"5,0",26 mai 2019,Smartphone très fonctionnel et de qualité pour le moment
