user,rating,date,review
Babillebabou,"4,0",18 décembre 2018,"Très bon smarphone, la finition est impeccable pour le prix. Au premier démarrage, il y a une grand nombre de mise à jour, environ 2go (Android Pie v9).
+
Ecran lumineux, le mien est équipé d'une dalle novatek-07 mais malgré cela je n'ai pas constaté de tendance verdâtre en haut et bas de l'écran, le pb a peut être été corrigé avec un nouveau firmware
Très réactif pour l'ensemble des applis, pas testé les jeux je ne joue pas
Programme Android One, on a un Android sans surcouche, c'est du bonheur
prise jack écouteur
emplacement carte SD ou deuxième sim
-
Pas de réglage approfondi de l'écran
La taille peut être pour certaines personnes
Je ne ferai pas de commentaire sur l'appareil photo, pas eu le temps de tester pour le moment.
Livré avec une coque transparente, alim & câble usb-c et écouteur"
BARBS,"5,0",23 septembre 2018,"Et quel retour de Nokia!
Téléphone sobre et très élégant. Excellente qualité technique (affichage superbe, processeur rapide, appareil double objectif Zeiss aux photos époustouflantes, vidéo et audio à la hauteur, etc.). Grand écran. Batterie longue durée, autonomie 2j malgré un usage fréquent. Clavier confortable. Correction/suggestion linguistique au point. Coque transparente fournie, impeccable.
Et petit détail appréciable, enfin un téléphone qui échappe à l'hérésie dominante des bords d'écran arrondis, pas si pratiques et disgracieux.
Seul petit regret, la couleur de la pastille de notification des applications, vert, ce qui n'offre pas assez de contrastes avec les couleurs des applis. Le rouge conviendrait mieux bien évidemment. J'écrirai à Nokia pour leur proposer une mise à jour du système dans ce sens."
jefferson,"5,0",6 mai 2018,très très bon produit facile d'utilisation performant rien a dire mon ancien téléphone qui avez couter le double ne lui arrive pas à la cheville
rambolit1,"2,0",9 mars 2019,"Bonjour, au retour de Nokia je me suis dit que ce smartphone serais comme les anciens, mais j'ai vite déchanté, soucis avec le wifi maison ou il faut redémarrer le téléphone pour le capter. La recharge qui est pris en compte quand le téléphone et redémarrer,  les touches de contrôle qui se bloque toute seule, obliger de redémarrer le téléphone, pour ma pars je le renvoie chez amazon au bout de 2 semaines d'utilisation. Je ne le conseille vraiment pas"
Woody44,"4,0",11 février 2019,"Je voulais un smartphone sans surcouche ni applis constructeur/fournisseur qui alourdisse l'os. C'est chose faite avec ce Nokia. Fiable, autonomie parfaite.
Je lui enleve une etoile pour 2 raisons:
-Le réglage du son n'est pas pratique. Pas de possibilités de reglé le volume de la sonnerie sans passé par les parametres, on peut juste mettre en silencieux ou activer la sonnerie. Pas pratique quand on navigue entre le mode exterieur et interieur.
Autre chose concernant le son. La notification qui dit que le telephone est branché sur secteur est toujours à fond. Pas moyen de trouver où baisser ce reglage.
-Le bouton de veille sur le coté semble avoir un defaut, il faut appuyer fermement pour que cela fonctionne. Avec l'habitude, on s'y fait mais avec la renommé du constructeur, on ne s'attend pas à ce genre de defaut.
En tout cas, je conseil ce telephone, et mon prochain sera son successeur... (quand celui-ci aura rendu l'ame ;) )"
MDM,"5,0",9 septembre 2018,"Solide, pratique avec android one pour éviter toute fioritures et surcouches inutiles. Un bon retour de la marque Nokia avec tout ce qui a fait son succès. Vraiment très heureux de ce téléphone. Son écran est superbe, il réagit vite et son autonomie est conséquente. Que du bonheur pour un prix raisonnable au regard du marché actuel."
Nico1986,"5,0",4 décembre 2018,"J'ai acheté ce smartphone en remplacement d'un ancien Nokia vieillissant et je n'en suis pas déçu. Il est superbe et d'une qualité irréprochable. Le son et les photos sont de très bonne qualité et il capte très bien, je me sers aussi d'un smartphone Sony dernier modèle pour mon travail et j'avoue que le Nokia capte bien mieux et a une meilleure autonomie. Son rapport qualité prix est excellent. N'hésitez pas acquérir se petit bijou il ne vous décevra pas."
Olivier,"2,0",29 décembre 2018,"Très emballé à la réception, après quelques mois d'utilisation et diverses MAJ d'OS, me voilà bien déçu de ce téléphone.
L'écran freeze, seul moyen de reprendre contrôle sur le téléphone, verrouiller/déverrouiller le téléphone. Le problème a l'air de revenir très souvent chez beaucoup d'utilisateur depuis une MAJ.
Le téléphone a des ralentissements (en consultation simple internet), le logiciel pour la prise de photo est nul en mode pro (on ne voit pas en direct à l'écran les modifications apportées à l'ouverture de l'obturateur par exemple).
Je m'attendais à un milieu de gamme sympathique et j'ai l'impression d'avoir une entrée de gamme laborieuse entre les mains.
3 points positifs cependant : la batterie vraiment excellente, le design et le bel écran.
J'aurai su, j'aurai rajouter quelques euros et me serait tourné vers un P20. Dommage."
Olivier Rhein,"5,0",3 mars 2019,"Smartphone complet, étanche, avec une carte SD et un jack audio...
Les photos et les videos sont franchement pas mal (mon précédent téléphone était un Samsung S7).
La fonction zoom optique x2 est top.
Et puis pas de surcouche sur l'OS, c'est l'android tout droit sorti de chez google dans les dernières versions. Tres content de mon achat."
RR JS,"2,0",11 décembre 2018,"acheté en mai 2018,NOKIA 7 plus LTE 64 GB dual white, malgré plusieurs essais de réglages  photos toujours d'une apparence verdâtre,mon ancien nokia 5  était 10 fois mieux en photo,
agenda/calendrier, impossible d'arriver à faire des rappels (anniversaires etc..RDV, et annoncent écrites sur portable, trés déçue, ai repris le nouveau nokia 7 (plus performant ?!!!!!!) mais trop de changement et pas mieux"
Valentin Burgraeve,"5,0",18 novembre 2018,"Très bon smartphone sans surcouche ni app degeulassses préinstallées, il est puissant de ouf avec son Snap 660 on se croirait avec un 8xx. Foncez !"
Client d'Amazon,"5,0",11 décembre 2018,j'ai étudié de nombreux articles sur un téléphone avec android one afin d'avoir un durée de vie optimale avec des mises à jours garanties et j'ai trouvé ce téléphone Nokia qui est équipé comme un samsumg ou un iphone et qui vaut le tiers du prix.... à méditer
Amazon Customer,"5,0",20 décembre 2018,Très bon smartphone Android one. Bel écran de grande taille. Bonne capacité de stockage. Bien construit. Pèse son poids. Bonne autonomie. Respire la qualité. J'espère que ce ne sera pas qu'une impression.
Xavier,"4,0",1 février 2019,Le portable est parfait en revanche il n'a pas la double SIM mais uniquement un emplacement simple SIM + carte Micro-SD.
mathilde b.,"5,0",1 août 2018,"Parlerait correspond aux attentes , coque et film dans la boîte
Tiens bien la charge, agréable en main"
Client d'Amazon,"5,0",2 décembre 2018,"Après avoir été un fan de Windows phone, première expérience Android avec un Nokia sans surcouche. Simplement génial. Je ai trouvé un launcher qui permet de avoir le interface Windows et la, j ai le meilleur des deux systèmes. Simplement bluffant."
FREREBEAU Julien,"5,0",27 septembre 2018,"Ma femme a un Samsung s9 qui fait le sans fautes. Plus raisonnable j'ai choisi ce Nokia. Hormis les photos où l'on voit quand même une petite différence, pour le reste franchement c'est du pareil au même. Je dirai même plus, Android one est nettement plus agréable. Très bon produit, qualité de finition Nokia qui plus est."
florian descollonges,"4,0",9 mars 2019,"J'avais Lumia 640 au début j'ai eu un peu de mal a l'utiliser et maintenant c'est impeccable.
Attention il faut une carte sim nano."
Client d'Amazon,"4,0",23 février 2019,"Très bon téléphone ! Venant d'un Honor j'avais un peur d'être perturbé par le côté très simpliste et pas personnalisable de Androïd Stock et finalement je m'y fais bien. Il fait des photos de bonne qualité, la batterie est vraiment bonne et le téléphone ne souffre d'aucun ralentissement."
hamon,"5,0",3 avril 2019,"Surement un des meilleurs smartphones actuels dans cette tranche de prix. Aucun regrets et aucuns soucis rencontrés à ce jours avec ce téléphone. simple, fluide, réactif et tout à fait performant. Les mises a jour android se font chaque mois ce qui est un plus en terme de sécurité."
PierrotBlack,"5,0",25 avril 2019,Super portable sans surcouche. Très réactif. Beau design. Aucun ralentissement. Pas de défaut majeur.
Nado44,"5,0",18 décembre 2018,Mon époux ne voit que par lui.
Linor,"5,0",30 décembre 2018,"Livré avant l'heure, correspond à la description, pas de mauvaise surprise. Le tactile est fluide, belle luminosité.
Après... il faut l'utiliser plus longuement pour en savoir plus !"
Poncet,"5,0",20 septembre 2018,Très bon téléphone. Bonne réactivité. Écran très lumineux. Batterie durant 2 jours sans problèmes.
Gggarth,"3,0",30 janvier 2019,"Le téléphone est étonnamment bien pour le prix, mais je l'ai reçu avec une rayure en bas de l'écran..."
Yvan De Raeymaeker,"5,0",21 novembre 2018,Produit de qualité qui répond a mes attentes . Pour le moment je suis très satisfait . Dommage pour la led de notification qui est tout simplement absente . ( Mais ça je le savait ...)
Philou,"5,0",25 mai 2019,"Après un an d utilisation, j en suis très satisfait. Android one permet d avoir toujours les dernières mises à jour.
Les photos sont de bonnes qualités et la batterie tient sans problème une journée voire 2 selon l utilisation."
Marie-Line,"5,0",14 décembre 2018,Enchantée par ce téléphone que j'ai déjà depuis plusieurs mois ! il est parfait et son grand écran permet de bien visionner photos et vidéos ! je recommande
Client d'Amazon,"2,0",14 décembre 2018,Pour la vie de tous les jours et mon travail
Zouz,"4,0",19 avril 2019,"Satisfait de ce modèle avec dual sim qui profite des dernières mises à jour.
La lampe torche a une couleur qui tire légèrement sur le orange et attention au niveau de la prise de rechargement qui a un jeu et semble fragile."
Philippe BIRCHENALL,"5,0",11 décembre 2018,"Tellement content de retrouver NOKIA pour ce smartphone que je ne lui trouve que des qualités , mais c'est justifié !!!!"
Silip,"4,0",23 septembre 2018,Parfois l'écran est difficile à voir en plein soleil mais ce smartphone est très bon. Android pur = un vrai plaisir
berthelet,"5,0",29 décembre 2018,Pas de soucis pour la commande. J'ai bien reçu la version TA 046 de ce téléphone qui possède la bande B28 à 700mhz (je suis chez Free mobile). Il faut faire attention aux importations car tous les modèles de 7 plus n'ont pas cette bande.
TELOU,"4,0",4 février 2019,Franchement bon rapport qualité prix c'est quand même du Nokia avec super objectif photo mais la prise de chargement est une vraie catastrophe fragilité avérée usage de 6 mois pour le téléphone précédent.
Anna,"5,0",8 janvier 2019,"Jusque là, tout se passe extrêmement bien. Ce téléphone me satisfait totalement. Il faut dire que je n'en avais pas acheté depuis plus de 4 ans. Il est rapide et a une esthétique sympa. Je recommande."
wetz,"4,0",28 novembre 2018,Bien
Petit,"5,0",6 février 2019,"fluidité impeccable, belles photos, bon son, bonne réception 4g... pour cette catégorie de prix c'est le meilleur que j'ai eu..."
Christophe Leconte,"5,0",22 novembre 2018,"Le téléphone est rapide.
La mise à jour d'Android se fait rapidement."
Client d'Amazon,"5,0",2 mars 2019,Super contente. Je recommande.
Spo,"4,0",24 novembre 2018,L'écran ne répond pas de temps en temps pendant des longues secondes.
Mr. Gregory Gonzalez,"5,0",8 novembre 2018,"La batterie tient bien, aucun problème à signaler."
Amoujou abdellah,"5,0",9 mai 2019,Très satisfait de la qualité et même du prix je recommande
Client d'Amazon,"5,0",27 janvier 2019,Usage quotidien. Simple à utiliser.
Therese A.,"5,0",7 avril 2019,"Produit excellent, mais police de caractères ne convient pas à un quelqu'un qui a un problème de vue."
Client d'Amazon,"5,0",16 février 2019,"Très bon smartphone, correspond à mes attentes."
Bastet62,"5,0",9 juin 2019,Autonomie incroyable
pujos.bernard,"5,0",26 mars 2019,Super  téléphone
Tiphaine Bihoreau,"5,0",3 mars 2019,Je recommande.
hugo ,"5,0",19 février 2019,Super produit
Modou,"5,0",6 mai 2019,Satisfait
Da P.,"4,0",28 février 2019,Bien
inadmissible,"1,0",31 mai 2018,"Ce téléphone est mis en avant par Google pour son programme Andoid One (cf site web Anroid One).
Google a fait une mise à jour début mai de l'OS -> résultat plus de 4G avec le réseau Orange/Sosh.
Nokia est au courant du problème qui devrait (ou pas) être fixé par la mise à jours de Juin.
Donc 1 mois sans 4G... visiblement rien ne presse pour Google (en charge des mises à jours).
Google a donc pousser une mise à jours sur les terminaux des clients sans l'avoir testé à minima (la 4G est tout de même une fonction de base) avec le réseau Orange (un opérateur important). Bien sûr aucun message d'excuse de la part de Google ni même d'information sur la résolution du problème et son échéance.
Là, le programme Android One de Google en prend un bon coup pour son image !
Petit rappel d'un des slogans du site Anrdoid One:
""Android, pur et simple
Avec Android One, vous bénéficiez instantanément de la meilleure version d'Android disponible, pour que votre téléphone soit toujours à la hauteur de vos attentes.""
... ce doit être du second degré.
Update : nous sommes en juin, toujours pas de correctif"
Client d'Amazon,"5,0",29 avril 2018,"Beaucoup de qualités pour très peu de défauts:
- appareil très réactif, sans aucun bug ni lags quels que soient les usages
- écran magnifique : ce n'était pas gagné car c'est de l'IPS et pas de l'OLED, mais sa luminosité et sa brillance m'ont convaincu (je ne jure que par l'OLED)
- très bonne autonomie, et en plus, la recharge est ultra rapide (>1% par minute de charge)
- le design est agréable et lui donne une vraie identité à part des autres appareils du marché
- la partie photo est très bonne, les clichés sont de qualité
- le rapport qualité prix est bon
- Android Oreo sans surcouche... Moi qui vient de chez Samsung, je suis conquis. Et en plus la promesse de mises à jour rapide et fréquentes.
- capteur d'empreinte parfaitement placé et efficace.
- très bonne accroche des réseaux que ce soit mobile ou wifi. Parfaite stabilité. Il capte d'ailleurs partout, et mieux que mon ancien appareil (le réseau à mon domicile est un peu problématique)
Au rayon des défauts:
- je n'aime pas la disposition des boutons volume et marche arrêt. J'aurai préféré qu'ils soient inversés
- un stabilisateur photo aurait été bienvenu pour éviter les photos floues
- pas de batterie amovible... Pourquoi les constructeurs s'obstinent t'ils à ne pas permettre son remplacement facile ?
- taux d'occupation de l'écran: un peu faible pour un appareil de 2018. Surtout que la bande inférieure ne sert à rien (aucunes touches sensitives)
- taille de l'écran: elle est un peu juste pour moi avec 6 pouces.
Au final, je l'utilise depuis 15 jours (je l'ai acheté à sa sortie) et il a remplacé ma Galaxy tab S2 8 pouces que j'utilisais en smartphone. Passé le temps d'adaptation lié à la taille de l'écran, je suis conquis. Je ne veux plus jamais de surcouche constructeur sur Android. Je ne suis plus non plus aussi catégorique sur l'IPS VS OLED.
Pour un appareil de ce prix, il offre des prestations proches du haut de gamme. Pas besoin de payer plus cher, avec l'assurance de la qualité d'une grande marque (même si Nokia appartient à HMD qui est une marque chinoise).
Conclusion: foncez, vous ne regretterez pas votre achat."
Client d'Amazon,"4,0",18 mai 2018,"Je viens d'un Nokia Lumia 735 sous windows 10 mobile. Et quel bonheur d'avoir enfin un téléphone avec des applications et surtout, qui ne lag ou ne crash pas tout le temps. Le suivi des mises à jour est parfait puisque je viens d'avoir la mise à jour de sécurité de mai d'Android 8.1 (actuellement le 18 mai)
La prise en main est excellente, j'adore Android one sans aucune surcouche, et la partie photo est excellente pour le prix. Le Quick Charge 3.0 me change le vie puisque le téléphone charge en une 1h en mode avion et en 1h30 avec les données mobiles d'activées. Je tiens facilement une journée entière en usage assez intensif (musique en Bluetooth, données mobile activées tout le temps et partge de connexion le soir pendant quelques heures).
Le capteur d'empreinte est réactif et le son des hauts-parleurs est bon même si pas excellent non plus. L'accroche réseau est bonne et les débit en 4g+ sont très bons puisque je suis monté au maximum à 202 Mb/s.
Le seul inconvénient est que je me sens un peu fliqué car depuis que je suis passé à Android, je trouve beaucoup de pub cyblée et je reçcoit beaucoup plus de courriers indésirables. Et je regrette égalemment l'absence d'écran Oled même si le LCD est ici très bon.
Mais sinon, pour quelqu'un qui cherche un excellent milieu de gamme, je le conseil vivement"
Dheilly Alain,"3,0",24 mai 2018,Pour ma part dans l'ensemble Bon téléphone mais le problème des que je peux mettre qu'une carte sim et une carte sd je comprends pas car lorsque l'on lie la notice on vous fait voir que vous pouvez en mettre deux mais regardez bien la photo que je joint avec car ses le support sim qu'il y a à l'intérieur.qui peut m'expliquer le problème car là il y a soucis dites moi si ses pareil pour vous merci pour vos réponses.
Richard,"5,0",14 juin 2018,"Bonjour
Si comme moi vous avez des intermittences 3G,3G+,4G, et pas de réseau, avec sosh orange et Nokia 7 Plus, et ce malgré la mise à jour de mai et juin, je vous invite à entièrement sauvegarder ,puis réinitialiser totalement le mobile
Et ""O"" joie, la 4G+ fonctionne à nouveau avec les opérateurs sus cités.
Cordialement
Richard"
el pato te mato,"5,0",17 avril 2018,"Je cherche depuis un moment le remplaçant de mon nexus5x et même si j'ai la capacité d'acheter un big one, non, rien ne me convenait. Pour faire simple c'est une tuerie, incroyable, franchement fluide, mise à jour vers oreo 8.1 à l'allumage. Pour faire une comparaison avec le nexus5x : il le laisse par terre... rien à dire. Bref Nokia is back. Le cerclage en cuivre alors je dis bravo ! Il est lourd, il tient bien en mains, pas plus gros que le nexus5x. Android pure !!! alors avec nos amis chinois je garantis pas une back door dedans mais l'objet est magnifique. Petite touche sympa, un étui de protection se cache dans le compartiment accessoires. Sinon niveau performance, rien à reprocher il est puissant et agile :D Regarder des vidéos est un plaisir. GPS réactif, APN 6.75/10, superbe accroche en 4G. Merci Amazon.fr pour la protection d'écran offerte."
Thierrix,"5,0",8 septembre 2018,"smartphone remarquable
wot else ??"
Client d'Amazon,"2,0",23 octobre 2018,"Acheté chez Proximus il y a un mois.
Ce Nokia 7 Plus fait d'excellentes photos (zoom optique X2 : excellent). La batterie tient longtemps.
MAIS...
La reconnaissance faciale est présente sur ce Nokia 7 Plus. Le programme enregistre correctement le visage. Mais à  l'activation du smartphone, l'appareil ne se déverrouille pas avec la reconnaissance faciale. La reconnaissance faciale ne fonctionne tout simplement pas! Problème signalé au support Nokia depuis mars 2018! Problème toujours non-résolu, même après la mise à jour vers Android 9 !!!
Pas de gestes de navigation (""gestures""), pas de reconnaissance faciale... L'écran qui se fige parfois ou reste sans réaction, le jack audio qui ne reconnaît pas certains écouteurs, pas de stabilisation en 4K, bootloader verrouillé...
Pour 399€, je m'attendais à mieux ! Surtout d'une marque telle que Nokia.
C'est mon premier et dernier Nokia.
Je retourne vers Xiaomi : au moins chez eux tout fonctionne et pour beaucoup beaucoup moins cher !"
Ben지,"5,0",27 juin 2018,"J'ai acquis ce smartphone via un opérateur ""quelconque"" 📱
Ce téléphone est épuré avec son dos en métal effet céramique, le toucher est doux. Autour du téléphone se trouve une bande en cuivre très élégante qui fait ""classe"", voire sobre et élégante. On retrouve une prise jack en haut (bien que ça aurait été bien en bas à côté du port usb c) le portable est léger pour ma part, comparé à mon Iphone 6s plus. Ce qui m'a fait donné envie de prendre ce téléphone c'est bien sûr son dos qui se salit moins vite qu'un dos en verre, car j'hésitais avec le A8 de samsung. De plus on retrouve un scanner d'empreintes qui est très rapide *-*
Le point fort du portable est son écran qui est juste sublime, dont les détails sont parfaits pour cette gamme de téléphone. Avec son écran, les jeux, vidéo, et autres utilisation sont un bonheur :3
Je ne connais pas grand chose en ce qui concerne la puissance 😅, mais tout ce que je peux dire c'est qu'il est puissant, et cela fait 2 semaines que je l'ai et zéro latence. Et concernant la photo, il fait son boulot, les photos sont belles sans surcouche. Le logiciel de même est parfait, et les mises à jours sont régulier, mais...
J'oublie, faites attention à l'écran, il peut rayer rapidement si vous ne mettez pas de verre trempé, ou de film protecteur.
<<<< préparez-vous au mises à jours dès le premier allumage de téléphone elles viennent les une après les autres environ 8 ou 9>>>>
Je conseille ce téléphone si vous êtes maniaque des tâches de doigts 😂 si vous voulez des mises à jours régulières, avoir un grand écran ou si vous êtes un fan ou un utilisateur/trice qui aime Nokia !! :')"
Laurent,"4,0",28 juin 2018,"J'ai acheté ce téléphone en remplacement de mon Nexus 6P tombé en panne (achat chez Darty).
Ce que j'aime :
- Système Android One : une garantie de recevoir rapidement les mise à jour rapide de sécurité mais également celle de l'OS (en ce moment la Beta 2 d'android P est testée, et est disponible sur le site Nokia)
- Un écran de bonne qualité bien adapté à l'usage
- Un appareil photo au gout du jour
- Des performances plus raisonnables pour un usage normal.
- Une durée d'utilisation de la batterie pouvant dépasser un jour et demi
- Prise USB type C
- Prise Jack 3,5 mm
-présence quasiment de tous les capteurs en dehors du capteur Barométrique.
Ce qui manque :
- Recharge par induction
- Recharge Rapide
- Ecran Oled (?) mais là je suis plus mesuré au vu de la qualité de l'écran d'origine.
Les spécifications et le prix en font un appareil de milieu de gamme mais ses finitions le démarque de la meute de téléphone que l'on trouve dans cette gamme de prix"
introid,"4,0",23 mai 2018,"Bonjour,
le smartphone est très bon particulièrement dans cette gamme de prix, je le trouve relativement fluide, bien fini (revêtement mat au dos avec cerclage cuivré) il n'a pas trop chauffé lors de mes essaies (MAJ OTA directement sous Android Oreo 8.1, surf internet, youtube, etc...), l'écran IPS est agréable (mais il y a mieux niveau angle de vue), je ne suis pas certains de sa capacité lumineuse en extérieur par beau temps (premiers essais convaincants malgré tout) par contre il se montre agréable en séance nocturne, l'APN (appareil photo) parait aussi très bon en bonnes conditions lumineuse (l'application mériterait d'être plus intuitive par contre) et moins à l'aise en faible luminosité (classique dans cette gamme), aucun des objectifs ne possèdent la stabilisation optique mais électronique avec utilisation du gyroscope, le résultat se montre convaincant. L'autonomie parait également très bonne et l'appareil ne s'est jamais montré chaud ou brûlant.
Par contre je ne le trouve pas si agréable que cela en main car ses arrêtes sont en angle droit donc pas très confortable.
Le détecteur d'empreinte est très rapide, le son puissant et très clair même si seulement mono.
Bref c'est un très bon appareil dans cette gamme de prix (prix officiel de lancement de 399 euros) mais attention la concurrence est très rude avec les Asus Zenphone 5 et Honor 10...
Parfois j'ai choisi ce Nokia 7 Plus me direz-vous? Parce que je souhaitais avoir un téléphone Android à jour (je possède un iPhone7 sous IOS évidemment et c'est le top niveau suivi et MAJ) et à même de recevoir les MAJ Android/sécurité très rapidement, et avec Android One c'est le cas! De plus le fait qu'il soit dépourvu d'une surcouche logicielle lui demande moins de ressources matérielles et donc son couple processeur Snapdragon 660 et GPU Adreno 512 se montre très convaincant et à même d'affronter de nombreuses situations exigeantes. Le dernier point, je souhaitais une prise jack et idéalement un appareil sans encoche que beaucoup finalement masque, autant ne pas l'avoir...
Dans mon cas une grosse déception, j'ai reçu un appareil MONO SIM (modèle TA-1055) et non DOUBLE SIM (modèle TA-1046), c'est la raison pour laquelle je dois malheureusement le retourner... :( pour le commander à nouveau en double SIM.
Dans tous les cas je ne peux que vous recommander cet appareil qui en plus à la possibilité de recevoir de suite la Beta d'Android P, enfin un bon suivi sous Android hors Nexus/Pixel, cela fait très plaisir!
Cordialement"
ERIC,"5,0",15 février 2019,"Je l'ai acheté pour ma femme ;en noir cerclé de cuivre il est très élégant !  il n'est pas du tout trop grand c'est parfait.
je vais certainement me prendre le même."
LuC,"4,0",13 décembre 2018,"Android one parfait
Rapport qualité prix parfait"
