user,rating,date,review
Client d'Amazon,"5,0",3 janvier 2019,super aspirateur qui rend bien les taches sur carrelage facile... certe une force de succion quand même assez forte mais sinon rien à redire content de mon achat.
fernand,"5,0",2 octobre 2018,"Très bon produit, dommage que l'on ne puisse pas régler la puissance mais cela n'a pas une grande importance"
Client d'Amazon,"4,0",31 août 2018,"Cet aspirateur maniable est puissant, je suis oblige d'utiliser la fonction de limitation pour son utilisation. Tres beau modele et bon desing."
Ladet Christophe,"4,0",17 décembre 2018,"Léger, assez puissant pour le prix, avec une bonne aspiration. Peu d'ustensiles et de piètre qualité. Bon rapport qualité prix"
Pellegrini Aline,"5,0",1 avril 2019,"Très bon aspirateur même un peu trop puissant, mais j'ai collé 2 petits feutres dessous, et là, c'est top."
Client d'Amazone,"5,0",10 mars 2019,très bon produit
PERRET SEVERINE,"5,0",7 juin 2018,"Une aspiration tres forte. Aspirateur silencieux.
Le fil est long bref cet aspirateur me change la vie !!! Je le recommande car excellent rapport qualité prix."
Client Kindle,"5,0",14 décembre 2018,"Pour moi il est parfait, seulement 3 accessoires mais pas besoin de plus, j'avais peur du bruit mais finalement aucunes gènes... Rapport qualité prix, juste top
Je recommande !"
peroux,"5,0",8 septembre 2018,"Très satisfaite de mon achat à ce jour (1mois d utilisation). Manche très long donc hyper pratique pour les personnes grandes. Aucun rejet de poussières ce qui était un gros souci quand on a des animaux.
Ravie 😄😄"
Airfrog,"5,0",16 juin 2018,"Facile à monter. Aspire très fort. Se faufile partout.
Bac aisé à vider.
Très content de mon achat. A suivre dans le temps !"
Audrey,"4,0",31 octobre 2018,"Pour l'instant il aspire bien. Il à été livré un jour avant la date, bien emballé, plusieurs embouts livré avec et c'est très pratique. La puissance d'aspiration est correct, la poussière tremble quand je sors mon aspirateur."
lachkar alain,"5,0",25 août 2018,"Pour l'instant je ne suis pas déçu, il aspire très bien, je suis obligé de régler la puissance sinon il reste aspiré au sol"
Alboui,"5,0",24 mars 2019,vraiment au top merci encore
emma caffot,"5,0",16 mars 2019,"Parfait de A à Z. Maniable, hyper efficace, jamais mon tapis ni mes sols n'ont été aussi vite propres sans le moindre effort. Il est bruyant mais autant qu'un aspirateur traditionnel, donc ça ne me dérange pas."
K.ro mlg,"4,0",24 août 2018,Je trouve qu’il aspire très bien on est même obligé de réduire l’aspiration. Peut être un peu Bruillant mais ce n’est pas non plus insupportable ! Moi qui n’aime pas le bruit je le supporte très bien. J’en suis très contente.
BeniBoy,"5,0",1 février 2019,"Ça nettoie très bien, et c'est super puissant."
Vincent M,"4,0",12 novembre 2018,"Bon aspirateur, très puissant. Il faut voir si il tient sur le long terme!"
isnard danièle,"5,0",7 février 2019,Tres tres bien et pratique je le recommande fortement
Oumyasmine,"4,0",9 octobre 2018,"Aspirateur leger et bien conçu, idéal dans un appartement.
Attention, en revanche, tous les accessoires ne sont pas fournis...."
mimi,"4,0",27 octobre 2017,très très efficace elle aspire trop bien et pas trop bruyante le seul bémol y'a pas un bouton pour réglé la vitesse d'aspiration. ...
Lilou14,"5,0",10 mars 2018,"Super aspirateur très léger et ne fait pas trop de bruit
Il aspire très fort il faut ouvrir le loquet sur la poignée pour régler l'aspiration
Le filtre ce nettoye à l'eau"
DERAIL Daniel,"4,0",27 octobre 2017,Super petit aspirateur facile maniable pas top cher bonne puissance .Bien èstétique d'un fonctionnement facile à la portée de toutes les bourses.
francis cuneaz,"5,0",22 mars 2018,et bien comme certain commentaires le décrivent l'aspiration est très puissante .facile d'utilisation compact .non très bon rapport qualité prix
Choupi,"5,0",4 décembre 2018,"Petit mais puissant, cet aspirateur ma fortement étonné lorsque je l'ai mis en marche !!
très bon rapport qualité prix, très léger, design et aspire très bien"
DUBAN,"5,0",14 avril 2019,"Peu bruyant.
Simple d'utilisation.
Aspiration très forte.
Ne possède pas de variateur de puissance d'aspiration."
Vincent et Caroline,"5,0",13 décembre 2017,"Très bon aspirateur, excellent rapport qualité prix, par rapport a d'autres je le trouve pas bruyant.la puissance d'aspiration est bluffante."
MICKAEL SMADJA,"5,0",7 mai 2019,"Je suis content du produit, c’est un très bon rapport qualité prix"
fabrice GUEREMY,"5,0",12 mai 2018,"Aspire à en décrocher le parquet,  très esthétique,  maniable et fil assez long...
Pas déçu,  bon achat
Je recommande pour les possesseurs de chats"
Client d'Amazon,"5,0",2 décembre 2018,C’esr Ce qu’on cherche
Dutour,"4,0",18 août 2018,Cet aspirateur aspire très bien mais il fait tout de même un peu trop de bruit. Il n'est pas aussi silencieux que souhaité.
gwenaelle gresset,"5,0",13 janvier 2019,Très utile et aspire très bien les sols dur et moquette ! Assez léger et se retourne facilement le seule hic
HiT,"5,0",26 novembre 2018,Très bon aspirateur léger compacte excellente puissance à voire dans le temps
stéphanie marin,"5,0",12 décembre 2018,"Très bonne aspiration, facile a nettoyer"
laurie briache,"5,0",26 août 2018,"Très maniable, léger et surtout une TRES bonne aspiration!! ( limité difficile de le decoler du sol! Lol"
FRANCOIS,"3,0",3 janvier 2019,"Très léger, très bonne aspiration. Par contre le carton est arrivé éventré avec une suspicion de pièces manquantes."
Client d'Amazon,"5,0",8 mars 2019,Le top du top !!!!!
Client d'Amazon,"5,0",11 décembre 2018,Bonjour ça fais1 mois que je l ai il est parfait il aspire très bien très puissant il très facile d'entretien très maniable un peu bruyant mais pour le moment parfait
verbeke olivier,"5,0",17 décembre 2018,Super aspirateur très puissant.  3 semaines d'utilisation et aucun reproche à faire
Chris,"3,0",22 mars 2019,"Plastique moyen, tuyau télescopique génial, assez silencieux, brosse camelote"
Jérôme Mougin,"5,0",10 mai 2019,Très bon aspirateur qui aspire bien sur la moquette.
Marin Laurence,"5,0",7 juillet 2018,"Je suis très satisfaite de cet aspirateur, petit ,léger et puissant. Le bac est pratique à enlever et vider. A voir la solidité avec le temps"
Client d'Amazon,"5,0",5 juin 2019,Il aspire vraiment bien et la petite brosse permet de faire la poussière (sur la tête de lit par ex) sans abimer le cuir. Rapport qualité-prix top et en plus il se nettoie très facilement
Catherine FROLIGER,"5,0",16 mars 2019,Très contente de cet aspirateur conforme à ce que je recherchais
SIDRE,"5,0",1 avril 2019,"Ravie de cet achat, léger, aspire bien et ne fait pas trop de bruit"
Lhote Esther,"4,0",25 novembre 2018,Bon produit bon rapport qualité prix léger et se vide facilement seul petit inconvénient la puissance non réglable qui est plutot puissante donc sur les tapis moquette il reste coller.
Client d'Amazon,"5,0",28 septembre 2018,"Yes bon aspirateur ! Pas si bruyant que ça et léger. Son câble est assez long pour la maison de 90m2
Je recommande les yeux fermés"
Client d'Amazon,"5,0",28 février 2019,"J'adore cet aspirateur !
Je recommande, asipir très bien, très léger et ne fait pas beaucoup de bruit !"
servane lemasson,"5,0",9 mai 2019,Satisfaite de mon achat correspond à mes attentes
Nada,"5,0",10 février 2019,"Fonctionne très bien pour le moment. Très bonne aspiration, pourvu que ça dure !"
J_Rostain,"5,0",3 juin 2019,"Très bon rapport qualité/prix.
Léger, maniable, puissance d'aspiration très correcte (mon sol est en jonc de mer et je suis très satisfaire de son état après aspiration)."
Denis Vallienne,"5,0",6 juin 2019,"Conforme, un peu bruyant mais nous sert pour un garage."
oceana,"5,0",10 mai 2019,Mais que je suis contente !!!! d'avoir acheté ce produit !!!!!!!!! Il est FORMIDABLE !!!!!
Leterrier D.,"5,0",25 janvier 2019,Il est parfait ! Une super aspiration ! Je le recommande +++++++ j’en suis très contente !
Ports,"5,0",15 août 2018,je doit faire attention. car il et aussi fort que aspire le parquet lol
Serge,"4,0",4 octobre 2018,Pour une maison de 100 m2 avec 2 chats et un chien à poils longs. Aspire très bien même un peu trop car je suis obligé d'ouvrir le petit clapet sur le tuyau afin de réduire l'aspiration.
cost,"4,0",25 juin 2018,"Bon rapport qualité prix, maniable&puissant un peu plus de bruyant que sur un modèle à variateur."
Client d'Amazon,"4,0",31 août 2018,"Mon ménage. J aime son long fil, sa magnabilite par contre le  manque de réglage pour la puissance est un problème trop d aspiration et donc difficile à décoller du sol"
alain quarrez,"4,0",19 février 2019,"Il manque un variateur de puissance car suivant les sols différents il faut jouer avec la poignet.
Il manqueun peu de longueur de fil."
anais collet,"4,0",25 février 2019,"Bon appareil. Aspire bien, la brosse pour parquet est parquet. Contrairement à ce qu’in Avait lu il n’est pas très lourd (par rapport aux autres). Très bonne aspiration"
TracyLDSilva,"5,0",19 mars 2019,"Aspirateur de qualité, aspire très bien, bruit acceptable."
Titia,"5,0",21 avril 2018,"Merci à tous ceux  qui ont laissé 1 commentaire sur cet aspirateur car c'est ce qui m'a convaincu et je suis ravie de mon achat: efficace, léger
Rien à redire"
Adeline Kohl,"4,0",8 avril 2019,"Bon rapport qualité-prix
2 filtres à nettoyer on verra au fur et à mesure du temps si c'est pratique.
Excellente aspiration!!! Accessoires très pratiques!"
yohann helle,"5,0",16 janvier 2019,"Très puissant et compact, il respire la qualité Rowenta, c'est parfait pour mon utilisation je le recommande sans aucune hésitation."
Clj 34,"5,0",31 mars 2019,"bonne puissance, léger et maniable"
Client d'Amazon,"5,0",15 mai 2017,Très bonne qualité pour le prix de cette aspirateur et le prix est vraiment raisonnable. Avec des accessoires . Je le conseil.
BUREL MK,"3,0",28 mars 2019,Après utilisation le nettoyage de l'aspirateur n'est pas pratique.
Fellah ,"1,0",6 juin 2019,Utiliser  deux  fois. Les filtres  sont  mort. Et le aspirateur  à  grille  il marche  plus
Julie,"5,0",1 février 2018,Super jadore correspond bien a mes attente facile de nettoyage tres silencieux designe jolie je recommande a tous tres bien
LEFRANCOIS graziella,"5,0",16 mars 2018,"Aspirateur vraiment très bien!!
aspire vraiment fort et avec plusieurs embout!!! formidable et la couleur vraiment très belle
Je vous le recommande vivement."
NOE,"5,0",9 mai 2019,Très léger maniable et puissant. Je m'ai acheté pour ma mère qui est âgée et c'est parfait.
Bernard,"3,0",28 février 2019,"Bon aspirateur, forte aspiration mais attention fil très court, je suis obliger de rajouter une rallonge. Prévu pour un «  petit » appartement  pas une maison !"
Client d'Amazon,"5,0",16 mai 2018,Cette aspirateur et un très  bon produit il et silencieux et il a un bonne puissance d'aspiration c'est agréable pour travaillée
agnès,"5,0",8 août 2018,"Article léger, facile d'utilisation. Produit conforme à la description du vendeur. je recommande."
laurent coussemacker,"5,0",27 décembre 2018,qualité prix très correcte aspiration un peu compliqué sur du parquet pas de réglage pour l aspiration
Client d'Amazon,"4,0",17 août 2017,"Satisfaite de mon achat
Il est pratique, maniable et léger
Je recommande pour le petit prix qu'il a coûté. Top !"
Bilj,"5,0",12 mai 2019,"Parfait rien à dire, correspond à nos attentes"
rg,"5,0",20 décembre 2018,"je n'ai pas d'action chez ROWENTA, je vous assure qu'à ce prix et une puissance pareil (silencieux en plus) c'est rarissime. Ceci dit à voir dans la durée."
chriss63,"5,0",21 décembre 2018,"Aspiration puissante léger à manoeuvrer, tres bon."
sallé dianka,"4,0",16 février 2017,"Très contente de mon achat elle aspire très bien ,silencieux mais par contre j'ai eu des problèmes avec le tube télescopique j'ai dû le changer 2 fois en 8mois ."
Client d'Amazon,"5,0",10 janvier 2019,Ras
peillot sandrine,"5,0",22 mai 2019,Pas trop bruyant il aspire très bien fait son travail je recommande
PIQUET,"5,0",1 mars 2019,"Très pratique, léger, agréable à manipuler, t très puissant pour sa taille !!! très contente de mon achat."
Client d'Amazon,"4,0",14 décembre 2018,Aspire très bien juste à voir par le temps
Client d'Amazon,"4,0",17 septembre 2018,"Bon appareil, bon niveau d’aspiration, assez silencieux, mais nous nous attendions à pouvoir faire varier l’aspiration."
Sandra,"5,0",31 mai 2019,"Je recommande cet aspirateur . Bonne aspiration autant sur les tapis que sur le parquet, très maniable. Très satisfaite de mon achat."
HOMM77,"4,0",22 avril 2019,Très bien pour des surfaces lisses mais aussi pour les tapis. Tres bon rapport qualité prix
Client d'Amazon,"5,0",8 janvier 2018,EXCELLENT RAPPORT QUALITE PRIX. MANIABLE LEGER PUISSANT. SE VIDE EN UN CLIN D.OEIL. APPRECIE LES PETITS ACCESSOIRES POUR FAUTEILS ET TENTURES
DSHS30,"5,0",17 avril 2019,"Aspire très bien léger silencieux facile à vider, je suis satisfaite. Seul petit bémol la courbure du manche un peu spécial e mais on s'y habitue."
Thomas R;,"3,0",17 novembre 2018,"Cet aspirateur fait son travail mais rien de plus. Compte tenu du prix, il ne faut pas s'attendre à ce qu'il soit facile à manipuler."
H-elo,"5,0",10 juin 2019,"Je suis sincèrement conquise par cet aspirateur et le recommande vivement , rapport qualité /prix 👌"
liber,"4,0",12 août 2018,Utiliser hier des son arriver pas de soucis fonctionne tres bien
Émilie Le Noay,"5,0",30 mars 2018,"Presque trop puissant ! Si vous n’avez que des sols lisses, vous pouvez prendre la puissance en dessous. Pour ceux qui ont des tapis et moquettes il sera parfait par contre !"
Lecomte,"5,0",21 décembre 2018,"Aspirateur léger, simple d’utilisation et très pratique et aspire vraiment bien, je suis très contente de mon achat"
jean-michel ignaczak,"5,0",25 novembre 2018,utilisé pour  toute la maison aspiration puissante très silencieux de nombreux accessoires je le recommande fermememnt
Ela,"5,0",19 mai 2019,Enchanté par cet aspirateur moins de bruit + de puissance. Adopté!
Biba,"4,0",27 mai 2018,Aspire beaucoup trop dommage qu on ne puisse regler le degre d aspiration et attention aux risques de rayures sur le parquet
BEN ABDELKADER Emir,"5,0",5 mai 2018,"Enfin un bon aspirateur. Rowenta est une marque en qui faire confiance. Il aspire très bien, les différents embouts sont pratiques. A voir sur la durée ! :)"
romero,"5,0",5 février 2019,"Très léger, petit, magnable le câble est assez long bon produit pour le prix"
Josi,"5,0",17 novembre 2018,"Cet aspirateur fait très bien son job, léger. Je ne trouve pas bruillant, bon rapport qualité-prix !"
maria escaleira,"5,0",2 septembre 2018,Très satisfaite de mon achat. Bonne force d'aspiration très compacte et leger
Client d'Amazon,"5,0",29 avril 2019,Aspire très bien mais un peu trop bruyant mais je le recommande vraiment !
bounab,"4,0",5 juillet 2018,"trés bon produit puissant et efficace et tres leger, beaucoup d'accessoires en option , facile d'entretien et ideal pour une grande maison"
Client d'Amazon,"4,0",28 février 2019,Usage au quotidien pratique car léger.Réservoir un peu petit qui oblige à vider souvent
urbain d,"4,0",15 janvier 2019,bon aspirateur!
Erwan,"5,0",30 mars 2019,"Je n ai pas regretté d avoir acheter cet aspirateur, il est facile d utilisation pour un bon rapport qualité prix il est au top"
catherine,"4,0",5 mars 2019,"offert a mon fils qui viens de prendre un petit logement
pour l'instant très satisfait a voir dans le temps"
remy jacqueline,"4,0",5 mars 2019,Il est beau ...efficace et j'en avais besoin
Kevin,"4,0",1 février 2019,Tellement puissant qu'il se colle au sol ^^
menthe basilic,"5,0",5 mars 2019,Erreur sur mon commentaire. J'ai renvoyé cet article car il s'arrêtait sans arrêt
Client d'Amazon,"4,0",26 novembre 2018,"Utilisation intérieure de l'appartement ,rien a redire ,facile à diriger et léger,pas trop bruyant ,aspire bien"
Client d'Amazon,"4,0",16 août 2018,satisfaisante
nuixa,"5,0",15 avril 2019,Très beau design léger maniable seul bémol la puissance n est réglable qu au niveau de l aspiration contente de cet achat
Maximilien Breny,"5,0",21 mars 2018,Très bon aspirateur. Correspond à mes attentes. Dommage cependant que l'on ne puisse pas choisir la puissance d'aspiration mais cela n'est pas rédhibitoire
Franz,"5,0",19 juin 2018,Peu cher et pratique. Bonne aspiration.
Amelimran,"5,0",26 mars 2019,"tres contente de cet aspirateur, aspire tres bien et on peut regler l'aspiration garce a la trape d'aire sur le manche"
GC,"5,0",14 mars 2018,Produit de qualité. Puissant et ergonomique : on sent la puissance de l appareil. Après le 1e essai j en suis totalement satisfait. Je recommande.
Client d'Amazon,"5,0",2 août 2018,Trop contente super et livrée rapidement avec Prime
borne,"5,0",26 mars 2019,Agréablement surprise .très beau et efficace je ne regrette pas  mon achat.
David GIANG,"5,0",1 avril 2018,"Très bon aspirateur, pas trop bruyant, puissant et efficace. Le fil est grand et pzrmet une large zone d'action. Nice !"
Client d'Amazon,"5,0",4 février 2019,Très bon aspirateur bonne puissance pas trop bruyant
alexis,"5,0",11 janvier 2018,"Très bon rien à redire pour le moment bonne aspiration, facile à vider et nettoyer, legé avec un look sympa."
Isalam,"3,0",4 avril 2019,"La puissance d'aspiration est correcte, les accessoires ressemblent plus à des jouets! A voir sur le long terme."
AKGUL,"3,0",12 avril 2019,Bien
loiseau,"5,0",29 avril 2019,pour le vehicule c est parfait et les petit coins de la maison trés maniable . je conseil fortement ce produit
patrick ruffier,"4,0",6 décembre 2018,Bon produit pas cher le seul problème fait pas mal de bruit
Raul,"4,0",29 décembre 2018,Très  content avec ce achat. Facile utilisation. L'aspirateur  a une bonne potence.
Luis PACHECO,"4,0",1 janvier 2019,Aspirateur puissant mais réglage de la puissance d’aspiration assez simpliste.
Enimie,"4,0",15 mars 2019,"Il est vraiment génial, pour aspirer il aspire. Il est puissant."
Sandra,"5,0",26 avril 2019,Enfin un bon aspirateur capable d'aspirer correctement il est très puissant.
cricri,"4,0",10 juin 2019,"aspiration un peu difficile à moduler,très léger,mais bascule facilement,bon rapport qualité-prix sinon"
Corinne,"1,0",14 décembre 2018,Très bien bon
Client d'Amazon,"5,0",25 mai 2019,Très bien
Client d'Amazon,"5,0",11 juin 2019,"Bon rapport qualité/prix. Je recommande fortement pour ceux qui ont un petit budget, cet aspi est top!"
Laetitia,"4,0",3 juin 2019,Très bien
speedwill,"5,0",31 août 2018,aspire très la moquette ... Je suis satisfait de mon achat
zouzou721,"4,0",4 juin 2019,"bon rapport qualité prix
bonne aspiration
nettoyage facile"
colin y,"5,0",7 janvier 2019,"Acheté 2 aspirateurs
.Cadeau de Noel pour ma fille et belle fille
SUPER"
CHRISTIANE,"4,0",11 juin 2019,je pense aspirer les cheveux du voisin du dessous....
Audrey,"5,0",6 septembre 2018,"Super aspirateur très puissant et léger.
Je recommande"
Client d'Amazon,"5,0",30 juillet 2018,"Léger, super aspiration, il fait le job ! Accessoires pratiques !!!"
Sonia,"5,0",5 septembre 2018,"Je ne regrette pas, mon meilleur ami pour mon ménage"
marie,"5,0",23 décembre 2018,Impeccable j'en suis très contente.
Vincent 50,"4,0",13 avril 2019,Très très bon rapport qualité/prix.
roselier,"5,0",31 octobre 2018,Vraiment puissant
Kéké,"5,0",15 novembre 2018,Aspi super pratique léger et puissant
Mama,"4,0",24 mars 2019,Très bien
fragneau,"4,0",30 mars 2019,Aspirateur puissant et efficace
jpbwaga,"5,0",13 novembre 2018,Puissant facile d'emploi il y aurait 50cm de tuyau en plus il serait parfait.
Quiros Serena,"5,0",28 février 2018,"Super à utiliser notamment pour les personnes ayant des animaux. Ni trop lourd ni trop léger, et vraiment très peu bruyant"
michelle briere,"4,0",13 septembre 2018,Satisfait du produit mais l'aspirateur reste un peu bruyant à l'utilisation
Eve,"5,0",27 janvier 2019,Compact idéal pour mon petit appartement peu encombrant
Client d'Amazon,"4,0",23 mai 2019,Très bien pour les sols durs
elsa,"4,0",6 février 2019,très contente de mon achat
laura jannin,"5,0",23 juillet 2018,Très bon produit ne fait pas beaucoup de bruit et aspire très bien rien à dire super
GUEZOUI F,"5,0",1 juin 2019,Pour rangée mes vêtements dans les sacs sous vides
kreuder marie-louise,"5,0",7 mars 2019,"appareil léger, maniable et efficace"
Client d'Amazon,"5,0",11 juin 2019,Je suis très contente de mon achat !
Client d'Amazon,"5,0",23 août 2018,"Pratique, leger, aspiration peut être très forte."
Busette,"5,0",30 juin 2018,Aspire du feu de dieu. Ravie. Bon rapport qualité prix. Livré au top.
schaefer,"5,0",17 novembre 2018,"Assez silencieux pour un sans sac
Aspire fort, très léger. Très content"
rativeau,"5,0",11 juillet 2018,"Très bon produit, lavable et aspire vraiment super bien les tapis et moquettes"
bab,"5,0",23 janvier 2019,Très bon produit
vincent g,"5,0",8 août 2018,Silencieux pas cher puissante aspiration super produit de la bonne qualité
dakhlaoui,"4,0",4 novembre 2018,Pour le moment sa vas très bien performant pour une utilisation cotidienne
gerard,"5,0",24 octobre 2018,"Aspirateur silencieux.
Nettoye à la perfection .
Rien à redire ."
Thierry ,"4,0",29 avril 2019,Produit très efficace.
juquel,"3,0",21 janvier 2019,Bien mais inutile pour les tapis...
Client d'Amazon,"4,0",28 mai 2019,Partique
cottart,"5,0",11 novembre 2018,Aspire très bien ravi de mon achat
berthelot,"5,0",24 juin 2018,"Aspirateur au top
Très bonne puissance et peu de bruit"
Nadège,"5,0",18 août 2018,"Bon aspirateur, jamais déçu par cette marque !"
J.C DELBOS,"5,0",28 mars 2019,Conforme à ce qu'on peut attendre
Florence Jourdan,"5,0",31 janvier 2019,Très léger et pratique à vider.
o_hung,"4,0",28 novembre 2018,Bon aspirateur assez puissant
Client d'Amazon,"5,0",8 juin 2018,Excellent produit
Client d'Amazon,"5,0",11 juin 2019,Aspirateur puissant et fiable
Daudruy M.,"3,0",13 septembre 2018,Je suis déçu l'aspiration n'est  pas top les petite bande rouge son décollé
Alexo,"5,0",3 septembre 2018,"Rien à redire , petit , léger , efficace."
Client d'Amazon,"4,0",7 décembre 2018,Conforme à mes attentes:puissant-léger-pas trop buyant
Sissi 9240,"5,0",24 janvier 2019,Très bon produit très léger aspiration excellente
Ombeline ,"5,0",27 avril 2019,Aspirateur qui fait sont job bon rapport qualité prix
Guy D.,"5,0",28 mai 2019,Bon produit
Jobard ,"4,0",3 mars 2019,Bon produit
rojouan philippe,"4,0",1 février 2019,pas facile à ranger mais usage correct
solene paul,"5,0",18 août 2018,L'aspirateur et nickel et tres léger
Client d'Amazon,"5,0",4 juin 2019,Bon rapport qualité prix
aspi,"5,0",9 juin 2019,très pratique car léger a porter pour les escaliers
esteban,"4,0",19 octobre 2018,Parfait
Virginie Gimmillaro,"4,0",20 août 2018,Il aspire super bien ...
Client d'Amazon,"5,0",26 septembre 2018,produits 100 % conforme a mes attentes
soavi,"5,0",24 août 2018,Super produit....très contente....et puissant....
Kevin M.,"5,0",9 juin 2019,"Très bon aspirateur, puissant et assez silencieux"
De Ghey,"5,0",26 décembre 2018,Pas exceptionnel mais fait le taff
Alex,"4,0",1 juin 2019,Beau produit pas trop bruyant belle puissance !
chiaruch,"5,0",2 octobre 2018,Parfait
Jacques,"4,0",15 février 2019,J’ai fait un cadeau
GUILLOU Emmanuelle,"5,0",1 juin 2019,excellent achat je recommande cet aspirateur
Client d'Amazon,"5,0",27 juillet 2018,Puissant et simple d’urilisation! Parfait!
leroy,"4,0",14 février 2019,Bon rapport qualité prix
Clo,"4,0",8 avril 2019,Bon rapport qualité prix
julien,"5,0",18 février 2019,"Léger et  puissant, très satisfait"
nathalie cohen,"2,0",26 avril 2019,extrêmement bruyant.
Marine Fauconnier,"5,0",8 mars 2019,Très bon produit
Benjamin Voogd,"5,0",5 novembre 2018,"Puissant, je recommande"
Omri33,"5,0",7 février 2018,"Si vous voulez un aspirateur puissant et qui colle au sol tellement il l'est : prenez le!!!
j'en suis plus que ravie! Ne connaissant que des aspirateurs sans aspirations celui ci me change déjà la vie! Mes sols: tapis, carrelages et parquet sont tous nickels sans poussière!
Un énorme avantage avec cet aspirateur c'est le manche hyper flexible il peut être étiré et permet de ne pas du tout se baisser!
Il n'est pas très lourd et son fil est assez long pour faire tout le bas de ma maison sans le débrancher !
Vraiment plus que ravie de cet achat !"
colin,"5,0",11 novembre 2018,parfait
Pinte Patrick,"5,0",10 juin 2019,"Léger, silencieux et puissant"
daniel vandenbosch,"4,0",28 février 2019,Très silencieux
Vitale,"5,0",5 juin 2019,Nettoyage appartement 100m2
Inconnue,"5,0",21 mai 2019,"Pratique à porter, maniable"
Aurelia,"5,0",16 avril 2019,Bon produit
Client d'Amazon,"5,0",14 avril 2019,Bon rapport qualité prix
Client d'Amazon,"3,0",22 septembre 2018,Passage 1  fois par semaine
Client d'Amazon,"5,0",18 mars 2019,"aspirer l'appartement,"
ratin,"5,0",28 août 2018,TRES BIEN
Aiguier,"5,0",13 mai 2019,Très bonne aspiration
Legrand,"5,0",7 février 2019,Très bon produit!
Client d'Amazon,"1,0",2 juin 2019,Nul
Philc10,"5,0",24 décembre 2018,Je recommande cette aspirateur .
Client d'Amazon,"5,0",25 novembre 2018,Top
K,"5,0",18 janvier 2019,Exellent.
PATRICK BASILE,"4,0",14 février 2019,Bruyant
Véronique Mercier,"5,0",19 février 2019,Parfait
scoubidou,"5,0",21 octobre 2018,très bon matériel
Hyska L.,"5,0",19 novembre 2018,Super
causse,"4,0",9 juin 2019,RAS
Benoît T.,"1,0",16 février 2018,"Bonjour petit problème lorsque je l'ai branché la prise a sauté créant un arc de cercle électrique, l'appareil a grillé.....  je 'ai pas eu de nouvelle de la part du vendeur"
