user,rating,date,review
Anaïs Rheims,"2,0",3 décembre 2018,"Le téléphone est très bien, mais je l'ai reçu avec la partie arrière fendue de l'appareil photo jusqu'au bas droit. Tout neuf est déjà abimé...."
Client d'Amazon,"3,0",8 mai 2019,Telephone
Dumont,"5,0",21 avril 2019,Très bon produit à recommander
Limop,"5,0",16 octobre 2018,Mon conjoint est très satisfait de cet article ce téléphone est vraiment bien léger grand comme on le souhaite comparé au prix du commerce il vaut vraiment le coup
liberale sebastien,"5,0",12 mai 2019,Produit conforme à la description juste des souci pour passer de ios à Android mais bon produit pas encore tout essayé comme la reconnaissance faciale
Client d'Amazon,"5,0",17 décembre 2018,"Il correspond aux commentaires.
Prise en main relativement facile
Belles photos le jour par contre la nuit je ne suis pas satisfaite du résultat : pas trop eu le temps de régler. J'avais mis le flash automatique ??? pas terrible à revoir."
SoFyyy,"5,0",6 juin 2019,Envoi extrêmement rapide et conforme à ce que j'ai demandé
Client Amazon,"3,0",10 février 2019,"Le téléphone plait beaucoup à mon ado. Seulement, la boite était ouverte, les deux collants de sécurité coupés très proprement donc je me demande si le téléphone est vraiment neuf. Le vendeur nie que le paquet était ouvert... C est pas très sympa."
Manu,"3,0",18 avril 2019,"J'ai 2 questions.
1 Es ce normal qu'il arrive avec  un verre trempé collé sur l'écran ayant acheté le même a mon épouse chez Darty se n'était pas le cas d'où la question est til vraiment neuf?
2 Modèle européen je doute vu que sur le porte Sim c ecrit en chinois ?"
Laetitia,"5,0",14 mai 2019,"Super ! Je ne regrette pas du tout mon achat, recharge très rapide. Autonomie très importante"
charlxtte.l,"5,0",12 janvier 2019,"Je l'utilise depuis début décembre, prise en main très pratique, le capteur d'empreinte digitale à l'arrière est un plus non négligeable. Rien à redire
Et esthétiquement je le trouve très élégant avec la coque arrière en verre"
Nikola,"4,0",25 avril 2019,"Excellent rapport qualité prix
Fonctionne parfaitement, est très réactif et intuitif.
Un Android simple d'utilisation."
geronimi stephane,"5,0",9 mai 2019,Super produit
Amaz,"5,0",19 février 2019,"Agréablement surpris  par rapport au prix que je l'ai eu , il est juste parfait, j'avais un Sumsung S7 avant, clairement il n' y a pas photo, Espace de stockage, qualité d'images, facilités d'utilisation, rapidité, Autonomie... bref ce téléphone n'a rien à envier à des  samsung et Iphone ,"
Moreel C.,"2,0",2 janvier 2019,"Téléphone très capricieux , avec une rotation de l écran qui ne fonctionne pas malgres plusieurs reboot  , a envoyer longuement en garantie ..."
Pilch Tomasz,"5,0",28 avril 2019,"Je possède déjà ce téléphone, cet achat Amazon était pour un cadeau.
Très bon téléphone pour un super prix."
Client d'Amazon,"5,0",24 février 2019,Très bien
Marie-pierre LOUPY,"5,0",29 janvier 2019,Très beau téléphone léger et facile de utilisation
Client d'Amazon,"5,0",26 janvier 2019,"Très bon rapport qualité prix
Très facile d utilisation
Bonne autonomie"
Lorenzo,"5,0",2 février 2019,Portable très fonctionnel satisfait de mon achat
CF,"3,0",25 avril 2019,"appareil photo très performant, qualité d'écoute très bonne, réception de qualité selon l'opérateur :-(
juste un regret sur la batterie qui n'est pas assez performante. moins d'une journée pour un appareil neuf."
Marjo,"5,0",20 février 2019,"Conforme à mes attentes, la qualité de l'écran est super, les photos très belle, il est fluide au niveau de la navigation, il correspond à la description faite sur le site, le must il est doté de la reconnaissance faciale"
Client d'Amazon,"5,0",3 décembre 2018,"Téléphone super. Facile d'utilisation.
Répond très bien. Rapide.
La qualité de l'appareil photo est vraiment super"
Stella,"1,0",1 mai 2019,Un peux déçu car même pas deux mois il beugue déjà
Client d'Amazon,"3,0",27 mars 2019,"Je met en garde de ne pas faire des mises à jours Huawei ou autre car vous perdez le fonctionnement de la rotation en photo ou en vidéo. A cause d'une mise faite après 2 mois de l'achat du Huawei P20 lite mon appareil ,se trouve en atelier déjà après 4 mois d'utilisation ???"
borja tony,"4,0",3 mai 2019,je suis trés satisfait de ce smarthphone ...
ROUILLARD Laëtitia,"5,0",17 avril 2019,"Un téléphone à 200€ qui vaut largement le coup voire même plus qu'un seul téléphone à 1000€. Qualité de photo, écran, réactivité irréprochables. Je recommande"
Yves Le Goasteller,"1,0",23 janvier 2019,Le téléphone est arrivé avec une panne sur la rotation de l'écran. Apparemment un soucis connu. retour du téléphone.
pehlivanian julien,"4,0",9 janvier 2019,"bien mais le haut de l’écran est cache par l'appareille frontal et la rotation automatique ne marche que d'un coté, de plus le système de notifications est différent de d'habitude ce qui peut perturber"
Orléans 45,"5,0",18 mai 2019,"Téléphone de très bonne qualité il a tout d'un grand, avant de l'acheter j'avais un doute sur cette marque mais après l'avoir tester il fonctionne aussi bien qu'un iPhone ou Samsung"
Client d'Amazon,"4,0",2 juin 2019,Très bien
delgove,"5,0",6 décembre 2018,"Utilisation personnelle, très bien
Satisfaite."
LAMBERT christophe,"4,0",22 décembre 2018,"Je suis très content de ce téléphone qui est assez intuitif et correspond bien à mes attentes. J'étais très ""htc"" mais ils se sont dégradé au fil des années. Bravo huawei, c'est adopté !"
Castet,"4,0",9 janvier 2019,"J'ai commandé ce produit pour changer de téléphone, j'ai toujours eu des IPhone et je ne suis pas déçu
Quelque petit bug quand je vais sur snapchat mais mis à part ça, très bon téléphone je recommande"
Emy,"5,0",22 novembre 2018,J adore ce téléphone je connaissais déjà cette marque je savais ce qu elle valait mais la pas déçue du tout je ne changerai plus de marque
gaubert francoise,"5,0",1 janvier 2019,"offert à mon mari pour ses 60 ans .il trouve ce portable très facile à utiliser , léger et pratique .La batterie tient plusieurs jours .joli design.Nous avons acheté une coque pour le protéger quand mème. Rapport qualité prix excellent"
Huguette H.,"2,0",23 avril 2019,"TRES MAUVAISE RECEPTION, NE CAPTE PAS LA 4G, IMPOSSIBLE UTILISER WAZE CAR EST EN RECHERCHE DE RESEAU PERMANENTE. JE RETOURNE CE PRODUIT."
Client d'Amazon,"5,0",7 mars 2019,Très bon téléphone
Clea carvalho,"5,0",3 décembre 2018,"Génial j'en suis fan... Je ne suis pas très connecté... Donc léger, facile d'utilisation, tiens la charge, jolies photos...
Parfait !"
Valentin,"5,0",23 mai 2019,"En remplacement d'un XZ, très bon rapport qualité prix, les couleur photo ne sont pas identiques mais la résolution est bonne
Rapide et léger"
Client d'Amazon,"3,0",10 juin 2019,"Je pensais pouvoir utiliser les payement sans contact mais tous les P20 lite, contrairement aux spécifications ne possèdent pas la carte NFC et ce n'est pas indiqué avant l'achat !
Sinon le téléphone fonctionne correctement."
B. Jessica,"5,0",3 mars 2019,Trésorerie contente de mon p8 lite j'ai investi dans le p20 lite et une fois de plus je ne suis pas déçue !
Jean Mierop,"5,0",7 avril 2019,Appareil qui nous convient parfaitement
Josette,"4,0",4 avril 2019,Ras
lolo,"5,0",23 octobre 2018,"Super produit, bonne qualité, rapide, facile d'utilisation et résolution de l'écran impeccable. Je recommande vivement ce produit, rapport qualité/prix rien à redire"
Client d'Amazon,"2,0",6 avril 2019,"cela fait seulement  4 mois que j'ai ce smartphone, le capteur d'empreinte digitale ne fonctionne plus.
A savoir pourquoi?"
Jean De Faulx.,"5,0",5 janvier 2019,Le top ! Mais attention pas possible pour Netflix ! Dommage de ne pas être prévenu avant. Pour le reste meilleur qualité /prix.
Client d'Amazon,"5,0",21 avril 2019,"J ai offert ce smartphone. Il l apprécié beaucoup. Il aime la grandeur de l écran, l ampreinte pr débloquer, la facilité à l utiliser, les photos... Il est très fan de cette marque car avant il avait le P8."
Julie Thevenin,"5,0",31 mars 2019,J'en suis totalement satisfaite !
agnes murcia,"3,0",21 février 2019,"beaucoup plus petit que le huawei 8 que j,avais .je m,etait abituer au 8 pour son ecran plus grand ."
Marion Cayla,"5,0",14 mai 2019,"Téléphone reçu dans les temps, carton légèrement abîmé mais ça n'a pas touché l'emballage du tel. Conforme aux attentes et fonctionne bien pour l'instant donc je recommande !"
Bourdolle,"3,0",22 mai 2019,"Super téléphone
Du retard sur la livraison. Une ouverture carte sim pas si évidente
Mais pour l'instant un bon rapport qualité prix"
ALAIN,"1,0",2 mai 2019,"J'ai reçu ma commande aujourd'hui hors la boite contenant le téléphone est ouverte, le film de protection de l'écran n'est plus la, ce n'est clairement pas un téléphone neuf alors que celui ci est vendu comme tel. Que proposais vous?"
Client d'Amazon,"5,0",30 décembre 2018,Très bon rapport qualité prix je suis passé de Samsung à huawei et je ne suis pas déçu du tout. Portable facile d'utilisation et belle qualité photo le seul bémol et peut être la batterie qui ne tient pas très longtemps mais j'ai beaucoup d'applications.
mik413,"5,0",16 janvier 2019,Le portable est parfait pour mon fils il en est content rien a dire
Bernard,"4,0",19 avril 2019,"Produit conforme à mes attentes, j'ai pu grâce à un flash code transférer toutes mes données ( de mon ancien téléphone) sur ce nouveau téléphone.
très beau produit, je le recommande."
RM,"5,0",28 décembre 2018,Livraison rapide et produit correct. Le téléphone est conforme à la description et il y avait même une coque transparente inclus. Très contente de l'achat.
Oceanne,"5,0",9 novembre 2018,"Je recommande ce téléphone
Facile, qualité photo plutôt bien, beug pas, chargement de batterie ultra rapide et tiens bien"
mag,"5,0",17 mars 2019,"Facile d'utilisation, super écran et photo"
Client d'Amazon,"5,0",26 décembre 2018,Cadeaux de Noël de mon fils nous sommes déjà client de Huawei et en sommes très satisfaits ce model que nous avons acheté correspond à notre budget du moment
Teddy76,"5,0",28 avril 2019,Parfait
JCW,"4,0",21 décembre 2018,"Prise en main rapide sauf problèmes de transfert de données d'un autre téléphone.
Téléphone ok mais livraison par Amazone inadmissible paquet jeté dans le jardin"
Boavida Laura,"5,0",14 avril 2019,"J'ai choisis ce portable pour la qualité des photos et je ne regrette pas, elles sont très jolies avec beaucoup d'options. Elles sont parfaites. Portable rapide, bonne mémoire, bonne prise en main."
kiara12,"5,0",11 janvier 2019,"Smartphone Huawei P20 Lite, très contente du téléphone, fait de très belle photo facile d'utilisation"
miika13,"5,0",14 novembre 2018,Impeccable
Romanon,"5,0",18 avril 2019,"Bonne prise en main bonne qualité d'image et de photos
Je recommande"
Virginie,"1,0",9 mars 2019,Téléphone qui ne capte pas la 4G alors que dans le descriptif il dit 4G  déplus lors que vous êtes en partage de réseau les autres peuvent utiliser le réseau mais vous sur le téléphone vous n avez plus internet . Vraiment nul comme téléphone
Guérin muriel,"5,0",2 décembre 2018,utilise surtout en téléphone et pour me tenir au courant des dernières informations  .transfert des données de l ancien téléphone asus rapide et assez complet.tient bien la charge
christian  alline,"4,0",28 mai 2019,"c'est un bon produit, je l'ai acheté au mois de décembre 2018 au mois de mai 2019 j'ai eu un soucis avec la rotation de l'écran, comme il était  sous garantie j'ai fait un échange."
Mumtobe,"5,0",7 février 2019,"Portable génial, le tactile est super, la qualité de l'appareil photo est incroyable !!! Pas déçu de mon achat !"
LA Cat,"5,0",24 octobre 2018,Conforme à ce que j'attendais. Facile à prendre en main. Super pour les photos. Fonction NFC ok.
JyuOh,"2,0",6 décembre 2018,Bien sauf qu'il présente un bug lorsque je le met sur la fixation aimant de ma voiture (fonctionnait très s bien avec mes deux anciens téléphones)... Écran noir avec un affichage décalé...
Client d'Amazon,"5,0",9 décembre 2018,"Très bon smarphone
Tient bien la charge et simple d utilisation
Je prendrai que des huawei maintenant
Thierry"
SADI Ferida,"5,0",7 janvier 2019,Utilisation personnelle du mobile Huawei. Simple à utiliser :-) Pratique à débloquer avec la reconnaissance faciale surtout quand on est très occupé. Je le recommande autant pour une utilisation personnelle et professionnelle.
Gastard,"1,0",10 mars 2019,"L’article ne répond pas à sa description. Il n’est pas dual sim.
Je suis très mécontent."
Client d'Amazon,"1,0",8 mars 2019,"Bonjour,
Voici l'énoncé de ma commande:
Huawei P20 Lite Smartphone débloqué 4G (5,84 pouces - 64 Go/4 Go - Double Nano-SIM -
A la réception, ce portable n'a pas d'emplacement pour une double Nano Sim. Publicité mensongère."
Client d'Amazon,"4,0",25 avril 2019,"pour téléphoner bien sur , photos et applications différente pas encore put tout tester , il manque quand même la notice en Français pour moi"
Fanny agnetti,"5,0",28 avril 2019,"Beau téléphone, contente de mon achat.
Bon rapport qualité prix"
patricia cheneau,"4,0",17 mars 2019,"J'étais déjà satisfaite de mon précédent HUAWEI mais le manque de mémoire m'a décidée à en choisir un nouveau .
Avec 64 MO j'en  suis très contente.
Je ne regrette pas mon choix ."
Client d'Amazon,"4,0",21 mai 2019,"Bon téléphone, batterie au top
Rien a redire"
Diallo thierno sadou,"4,0",15 décembre 2018,Bon téléphone
Client d'Amazon,"3,0",15 février 2019,Smartphone très facile d'utilisation seul bémol le chargeur ne charge pas le téléphone
Leroux,"5,0",26 mai 2019,Bien
MATHIEU Marie Jeanne,"5,0",19 février 2019,"Déjà 1 mois d'utilisation...Pour l'instant tout va bien, très satisfaite mais pas encore essayé toutes les fonctions dont la faciale car tout n'est pas dans le mode d'emploi qui est légé...."
Lydie,"5,0",16 mai 2019,C'est un cadeau pour mon fils il en est très content
LOMBARD Laure,"4,0",23 février 2019,"Téléphone au top
Je regrette pas mon achat"
sophie,"5,0",3 mai 2019,"Ravie de mon achat ! Super téléphone, de belles photos et reçu très rapidement"
Client d'Amazon,"5,0",14 février 2019,"Rien de plus à dire que très bon portable, il est leger, la qualité photo est dingue, il est fluide, tout est vraiment de très bonne qualité ! je le recommande vivement !"
PIC,"5,0",16 avril 2019,Très bon rapport qualité prix.
Marina,"5,0",9 février 2019,Très jolie comme téléphone
Vincent,"5,0",23 janvier 2019,Téléphone reçu en avance et je suis super content de mon achat le téléphone correspond plus qu'à mes attentes il est juste géniale sur tous les points de vue. Je le recommande
leistenschneider,"5,0",11 décembre 2018,"Livraison vraiment rapide,
Très belles finitions.
Ultra haute définition d'image avec double capteur optique.
Version avec double sim intégrées"
Patrice,"5,0",6 janvier 2019,C'est un bon téléphone avec une belle qualité d'image et une facilité d'utilisation !!!
Aurélie F.,"5,0",2 mars 2019,"Téléphone conforme à mes attentes! Grand écran! Autonomie comme ce que je recherchais!
Par contre, prendre une coque car le téléphone est très glissant, j'ai donc beaucoup plus peur de le tomber que mon ancien portable...."
Riveneau Delphine,"5,0",11 décembre 2018,"Téléphone surprenant pour le prix j'i pratiquement la qualité Apple, je recommande livrais sans problème.
Téléphone avec la reconnaissance facial, l'empreinte, la qualité des photo et très très bonne la mémoire c'est génial"
Client d'Amazon,"4,0",26 avril 2019,Acheter pour ma femme et elle en est content
Pierre,"1,0",24 mars 2019,"Téléphone reçu avec protection écran déjà posée alors que soi disant neuf.
Le vendeur nie le problème.
Vendeur a fuir."
Pattanapanichakul Sabaiporn,"3,0",22 décembre 2018,"Bon produit, facile à utiliser, malheureusement je dois le renvoyer parce qu'il y a un problème de caméra arrière, chaque fois que je voulais prendre une photo, l'écran devient blanc après deux trois essais cela remarche. Quel dommage !"
Balou,"4,0",14 février 2019,"Fonctionne bien
Appareil photo parfait"
Jérémie C.,"5,0",7 mars 2019,Superbe smartphone et pas cher.
Vanessa C.,"4,0",13 octobre 2018,Très bon produit qui devance largement le samsung galaxy s8 que j'ai eut juste avant. Seul bémol il a un default et je ne peut pas faire de partage de connexion
Eloise Defonte,"5,0",10 février 2019,"Commander après que mon ancien téléphone me lâche (un Asus zenfone selfie), j'en suis complètement satisfaite, absolument rien à dire. Il est parfait"
Client d'Amazon,"5,0",8 décembre 2018,"Déjà détenteur d'un psmart qui me satisfait, le besoin familial de 2 smartphones avec un budget correct mais pas illimité m'a orienté sur le P20 lite."
Cyril LABARRE,"5,0",21 février 2019,"Produit confotme à la description. L'article est arrivée rapidement sans problème.
Je recommande cet achat."
CHRETIEN,"5,0",22 mai 2019,Super contente de mon achat
Melissa,"5,0",22 décembre 2018,Téléphone reçu rapidement. Je suis très satisfaite du produit et le recommande !
Moi,"5,0",23 décembre 2018,"Super téléphone, même si il est arrivé en retard"
Fauvel,"5,0",6 janvier 2019,"Top, fluide et bon rapport/qualité/pris produit"
Ccile ,"5,0",6 décembre 2018,"produit que je recommande avec un grand R, amatrice de samsung habituellement ce téléphone répond a toute mes attentes ! au top du top"
fabrice ,"1,0",26 décembre 2018,"bonjour telephone qui ne se met pas en mode paysage dans les applis qui le permetent comme youtube chrome avec la rotation auto activé dans les parametres android, d ou ma note car sinon telephone au top niveau fluidité ecran."
Marina85,"5,0",17 novembre 2018,Bon produit pas déçu
Kindle Customer,"4,0",2 novembre 2018,Très bonne qualité et facilité d utilisation
Client d'Amazon,"5,0",21 octobre 2018,Très contente
Client d'Amazon,"5,0",7 novembre 2018,"Très bon téléphone qui répond parfaitement à mes attentes. Fluidité de l'écran tactile, légèreté, facile d'utilisation et esthétique soignée (en bleu il est vraiment très beau)"
David LOBJEOIS,"5,0",5 juin 2019,RAS
mireille,"5,0",26 décembre 2018,AU TOP!!
farias,"5,0",6 mai 2019,"Parfait , mon garçon en est content."
Parv,"1,0",27 novembre 2018,"Article reçu ce jour, lecteur de carte SIM impossible à ouvrir. Dois partir en réparation..."
lennyka,"4,0",19 octobre 2018,Il est bien bon rapport qualité prix. Qualité de l'image est super rien a envié à la gamme Samsung ou iPhone. Je vais prendre le pro le mois prochain
Graeling,"5,0",30 janvier 2019,"Excellent rapport qualité/prix, fonctionnabilté parfaite."
jlequilliec,"3,0",20 mai 2019,"Autonomie trop faible pour moi😠, le tel tient a peine un journée très déçu mon ancien p8 lite 2017 après 1 année et demi d utilisation tenait mieux la charge avec la même utilisation."
Régine Dengoyan,"5,0",7 mai 2019,"bonne prise en main , couleurs vives , installation facile ,  contente de ses diverses fonctions .
Gros problème  , ma voix est coupée sur chaque phrase"
Mohamed ,"5,0",18 mars 2019,"Bonjour
Très bon téléphone en terme qualité prix."
Gaillard Matthieu,"5,0",16 décembre 2018,"Je viens de passer d'un Samsung S7 edge que je détestais au P20 lite, et je ne regrette rien.
Super Design et paraît très robuste."
Stephan,"5,0",5 mars 2019,Un achat sans regret. Je suis fan !!!
Client d'Amazon,"5,0",11 décembre 2018,J'ai acheter ce téléphone et je le trouve très bien il a une bonne qualité photos pareil sur les vidéo YouTube et rapide la batterie tient très bien je recommande
chris,"5,0",3 février 2019,Parfait et vu le prix pas besoin de chercher une autre marque
johanna,"5,0",1 août 2018,"J'adore, aussi bien qu un Samsung"
Moustache  Daniel,"3,0",21 décembre 2018,"Comme son nom l' indique, c' est un téléphone 😜je suis satisfait, même si ma préférence allait sur une autre marque. Celui-ci fonctionne bien !"
Client d'Amazon,"5,0",5 mars 2019,Entièrement satisfait de cette achat correspond à mes attentes.
Mahefa,"5,0",18 janvier 2019,"Je suis ravi de ma commande.
Le téléphone est plutôt simple d'utilisation, une bonne ergonomie. Naviguation pas compliquée.
La batterie dure longtemps, je confirme."
S.P Emilie ,"5,0",23 décembre 2018,"La batterie tient très bien (facilement une journée d'utilisation et plus).
La qualité des photos est remarquable, super écran, bon tactile. J'en passe... Pour ceux qui hésitent je recommande absolument!"
Eva,"1,0",12 avril 2019,"Malgré une coque de protection et écran de protection, le portable est fissuré. Exceptionnellement fragile. Déçue"
otop06,"5,0",11 mai 2019,"articles conformes.délai de livraison respecté. téléphone performant et fluide.
réponse rapide à ma demande de facture.
je recommande"
Cecil,"4,0",17 février 2019,Reçu à la date prévue rapide... bien emballé.. conforme à la description .. très beau téléphone portable avec tout les accessoires version français je recommande
Jessy,"5,0",3 décembre 2018,Bon rapport qualité prix
San,"5,0",9 décembre 2018,Première fois que je commande un Huawei et je dois dire que je suis agréablement surprise. Facile d'utilisation la qualité photo est parfaite pour le moment rien à dire j'espère qu'il tiendra dans la durée...
Client d'Amazon,"5,0",3 février 2019,Similaire à Samsung dont j'ai l'habitude. Je verrais à la longue mais excellent rapport qualité prix
Client d'Amazon,"5,0",11 mars 2019,"Habitué à l'Iphone, j'étais un peu réticent avant de recevoir Huawei P20 Lite . Agréablement surpris, rapidité, écran et qualité de l'image et du son. Rapport Qualité Prix intéressant."
Gino.,"5,0",31 décembre 2018,Produit profesional
chris,"5,0",23 avril 2019,Livraison rapide bon produit
Fifi ,"5,0",15 décembre 2018,Très satisfait
jack,"5,0",10 mai 2019,Largement suffisant pour moi
Client d'Amazon,"5,0",16 février 2019,bien
Caméra extérieure,"5,0",13 mai 2019,Suite à la destruction de mon Samsung j'ai voulu changer de marque début d'expérience avec Huawei
Arnaud,"5,0",13 octobre 2018,Le téléphone est facile d'utilisation et les photos sont nickel
Sarriau,"5,0",28 décembre 2018,Très bon rapport qualité prix. Ma femme est ravi.
Client d'Amazon,"5,0",5 septembre 2018,"Très bon produit, largement équivalent (voir même mieux) qu'un Iphone."
Katia C.,"5,0",21 février 2019,Portable de bonne qualité appareil photo au top j'adore huawei
Client d'Amazon,"5,0",27 mai 2019,Économie et stockage conforme s
Nico,"5,0",21 avril 2019,"C'était un cadeau, donc ....."
Damien,"5,0",10 janvier 2019,"Pour le moment tout ce passe à merveille, je suis très content de se téléphone"
Mathé,"5,0",10 mars 2019,"Téléphone non configuré en français mais dès qu'on lie son compte gmail et Google play il nous propose de se baser en français.
Excellent état rendu tactile génial !"
Client d'Amazon,"5,0",25 décembre 2018,pas pu encore m en servire pas de car de carte annoncée. Part contre pas de notice en Français. Très difficile de le mettre en route.
Yoann R,"4,0",26 novembre 2018,"Configuré en quelques minutes, Qualité à la prise en main plutôt bonne. Il fera un bon cadeau de Noël pour remplacer un vieux smartphone."
DEBON Valentin,"5,0",10 mars 2019,Excellent produit avec un bon tarif ! Je n'ai aucun regret. La livraison était rapide et le colis bien emballé !
Bon portable mais reçu avec une batterie défaillante ,"2,0",8 avril 2019,Portable très fonctionnel mais reçu avec un problème de batterie perte de 5% toutes les 10 minutes. J'ai donc dus le renvoyer a huawei pour réparation .
Mel14600,"5,0",7 avril 2019,"Rapport qualité prix très bien.
Quelque beug parfois mais rien d’important.
Très bien"
Guy Sougnez,"1,0",29 mars 2019,"Bonjour, smartphone en réparation depuis 4 jours. Impossible de répondre à un appel. J entend l interlocuteur, mais lui non. Assez déçu pour un nouvel appareil."
De pinho Emilia,"5,0",27 mars 2019,Le téléphone est super léger l écran et bien belle photo et belle belle qualité je le conseil
Pascal,"5,0",12 mars 2019,"Ravi, très bon téléphone 👍😉"
Sergero54,"5,0",16 décembre 2018,Bon produit sans surprise
Client d'Amazon,"5,0",28 novembre 2018,Très bien
Pauline .M,"1,0",10 juin 2019,"Bon téléphone, durée du téléphone 1 journée. Téléphone reçu le samedi, décédé le dimanche aprem. Obligé de le renvoyer.
A EVITER !!!!!!!!!!!!"
Client d'Amazon,"4,0",29 janvier 2019,voir ci-dessus
Client d'Amazon,"4,0",27 décembre 2018,"Bonne prise en main, qualité de l'écran supérieure. Deux bémols : qualité des photos (surtout en zoom) et réactivité du clavier décevante"
Client d'Amazon,"5,0",28 janvier 2019,"POUR L INSTANT JE SUIS RAVIE
TRES BON RAPPORT QUALITE PRIX"
tapia,"5,0",28 décembre 2018,"Hyper satisfaite de cet achat, un telephone qui répond à mes attentes"
Gauter,"4,0",20 janvier 2019,"Produit qui a l'air de bonne qualité.
A voir dans le temps mais semble un bon rapport qualité prix"
Sylviane,"5,0",28 avril 2019,"Le modèle P8 était déjà bien,
Celui ci est encore mieux, très contente de cet achat
Livraison très rapide"
CBI59112,"5,0",21 mai 2019,"Facile d utilisation, lèger , pratrique à voir la suite avec le conflit avec Google !!!"
pisangbon51,"4,0",17 mars 2019,"Téléphone conforme à mes attentes, fait de très belle photo, le problème c'est la notice n'est pas en français.
Pour l'instant très satisfaite du produit"
Client d'Amazon,"5,0",29 mai 2019,Il est au top
