user,rating,date,review
Nick,"5,0",25 juin 2018,"Ce smartphone est très bien.
Huawei à mis la barre très haut.
Contrairement à d'autres personnes, j'ai bien reçu un téléphone neuf.
Je confirme qu'il est bien dual-sim, on peut insérer deux cartes SIM dans le téléphone et ça fonctionne très bien.
On a pas d'information à ce sujet dans la description Amazon et j'ai du envoyer un message au vendeur pour avoir la réponse, c'est vraiment dommage!!
Un ami a pris ce téléphone chez Orange et il a reçu une version single-sim (il ne prend pas en charge la deuxième carte sim).
Je me suis donc poser des questions mais au final je suis ravi puisque cette version prend bien en charge les deux cartes SIM.
Voici une petite astuce pour savoir au premier coup d'oeil si un téléphone est dual-sim, il suffit de regarder sur la boite ou directement dans les réglages du téléphone (Système / A propos du téléphone), si il dispose de deux numéros IMEI, c'est qu'il est DUAL-SIM.
Pour en revenir au téléphone en lui même son design est vraiment sympa, il fait penser à l'iPhone 10 avec son encoche en haut.
Je recommande sans hésitation."
Sandrine A.,"1,0",14 décembre 2018,"J'ai reçu ce téléphone en cadeau. Je connais bien ce téléphone vu que mon compagnon a le même. Il est très fonctionnel.
Or, quand j'ai reçu le mien, il ne capte pas la 4G. Après plusieurs configurations, il capte la 4G mais n'a pas de réseau (barre) donc encore plus lent que si j'étais en 3G+. On a changé de sim, sur nos deux téléphones  (on est chez le même opérateur), et mon compagnon ne capte pas la 4G sur mon téléphone, alors que sur le sien aucun problème.
A savoir que j'avais la 4G sur mon ancien téléphone (samsung S7)
J'ai demandé le remboursement du téléphone (service client Amazon parfait!).
J'irai acheter le téléphone chez Orange, vu qu'il est au même prix et j'aurais plus de garanties !!"
Mélanie,"5,0",29 juillet 2018,Je n ai pas acheté la version française et pourtant le téléphone par défaut est en français. J avais peur de passer sur Android et maintenant je ne regrette pas du tout. On peut cloner son i Phone du coup c est super simple
Aude,"2,0",19 décembre 2018,"J'ai rencontré le soucis de beaucoup de personnes, mais bon ça je l'ai découvert une fois en utilisation, le 1er jour TOP ! Vraiment contente de mon achat, un super appareil photo, facile d'utilisation... Le soir je l'ai éteint, le lendemain celui-ci me demandait mon code PIN + 1 code de déverrouillage ! j'ai donc essayé le code que j'avais rentré pour le verrouillage écran, ça ne fonctionnait pas ! J'ai donc rechercher comment faire sur internet, le conseil étant de le réinitialiser ! Super après avoir passé une journée à charger toutes mes applications ! Le téléphone re fonctionne après la réinitialisation, je re télécharge mes applications, le soir je ré éteint le téléphone. Et au moment de le rallumer : devinez ..... Code PIN + Code déverrouillage !!!!!!! Du coup renvoi du téléphone ! Remboursement rapide merci Amazon, ça franchement rien à dire ! Mais suis vraiment déçu pour le téléphone qui en lui-même quand il doit fonctionner normalement est top"
Jimmy,"5,0",2 octobre 2018,Pour ma part j'avais un Huawei p8 lite 2017 qui m'a très bien servie mais avec peux de mémoire le p20 lite a 64go et j'ai déjà mis bien plus que ce que j'avais besoin en application plus fluide meilleur qualité d'écrans l'effet sans bordure et excellent la seul chose que je trouve dommage et le fait que sur les 2 appareil photos arrière il y ai un décalage sur le centre optique j'ai dû tomber sur une mauvaise série. chargeur aux normes européennes et langue française au démarrage reste un excellent smartphone tiens bien la batterie en mode eco le son et bon et la qualité photos assez bonne très bon produit dans l'ensemble compenser jeudi reçu lundi
momo,"4,0",3 octobre 2018,Le téléphone est vraiment très maniable je suis passé d'un p-9 Huawei P20 Lite et je le regrette pas la seule chose un petit peu ennuyé sur ce téléphone est le temps de réaction lorsqu'on ouvre une application mais sinon il est très très bien
Denis,"4,0",14 août 2018,"C'est un smartphone d'un excellent rapport qualité/prix
Offert à mon épouse en remplacement de son Iphone 7 plus, elle est ravie.
Plus de Icloud, Itunes et autres joyeusetés propriétaires...
Une bonne autonomie / bel écran fluide / Rapide et 3x moins cher qu'un Iphone
Que demande le peuple"
nicole VINCENT,"4,0",17 août 2018,"Pour: téléphoner en premier (ça marche), l'appareil photo (nickel), le seul inconvénient c'est sur les notifications !! il n'est pas possible de différentier la réception d'un sms ou mail !!
je recommande ce tel."
Basmakh,"3,0",31 octobre 2018,"Téléphone répondant à mes attentes pour le moment SAUF que le chargeur fourni s'est de suite coincé dans ma prise. L'embout ne fonctionne pas et mtn dispose d'une seule dent ! Il a limite émet un sens d'explosion quand je l'ai branché. Très déçue de ce côté.
Les écouteurs ne permettent pas d'entendre clairement la musique. Mauvaise qualité."
Client d'Amazon,"1,0",24 décembre 2018,"J'ai rentré en boutique Huawei une première fois mon GSM P20 lite tous neuf de même pas deux mois pour un problème de rotation automatique d'écran. Ce problème a été résolu en changeant la carte mère. Après la réparation de mon GSM, la rotation automatique refonctionne mais plus les caméras avant et arrière. Je ne l'ai pas constaté lorsque j'ai récupéré mon GSM à la boutique et je n'ai pas eu l'occasion d'y retourner immédiatement. Peu après, pendant la nuit un bruit et un flash lumineux ont retenti du téléphone et l'écran s'est fissuré, sans aucune chute du téléphone. Je suis retourné chez Huawei, ils refusent de croire que l'écran s'est fissuré tout seul et prétendent que mon téléphone est tombé, c'est pour cela que mes caméras ne fonctionnent plus et que l'écran est fissuré. Ils considèrent que dans ces conditions la garantie n'est pas applicable.
EN RESUME J'AI UN TELEPHONE DE MEME PAS TROIS MOIS AVEC DEUX CAMERAS QUI NE FONCTIONNENT PLUS ET UN ECRAN FISSURE.
JE SUIS TRES DECU DE LA MARQUE ET JE N'ACHETERAI PLUS HUAWEI CA C'EST SÛR."
Client d'Amazon,"1,0",6 décembre 2018,"Le produit était conforme à la description - un Huawei P20 Lite - Cependant, après moins d'une semaine d'utilisation le GPS et la boussole on cessé de fonctionner en pleine utilisation. Je dois le retourner... c'est hélas le côté obscure de la commande en ligne.... J'espère obtenir l'échange ou le remboursement."
David,"1,0",25 janvier 2019,"Première expérience avec un smartphone sous Android. Avant uniquement en possession d'Iphones.
Point négatifs :
- Qualité très médiocre de l’Assistance Technique de Huawei -> Impossible de résoudre mes problèmes.
- Impossible de synchroniser mes mails avec ma messagerie sur mon PC
- L'appareil chauffe beaucoup après seulement 5 minutes passées sur Internet.
- Réglages beaucoup trop compliqués.
- Appareil photo médiocre.
- Beaucoup trop de bugs.
Point positif :
- Bonne autonomie.
Je suis déçu et maintenant je suis coincé car je ne peux plus retourner l'article. Article acheté en se référant aux avis des autres acheteurs. Conclusion : je me suis trompé et j'ai payé 250 Euros pour avoir un téléphone qui me sert uniquement à téléphoner et à envoyer des SMS. C'est lamentable de la part d'Amazon."
Pascal Tassez,"5,0",13 août 2018,"Smartphone arrivé rapidement, en parfait etat.
Bonne prise en main, bon appareil photo, assez rapide dans les menu, aucun crash d'application constaté (pour le moment), pour son prix, ce smartphone fait du très correct. Et le design est somptueux en bleu."
ZitJerem,"1,0",19 février 2019,"Bonjour , le téléphone est annoncé neuf hors il arrive non scellé, des traces et micro rayures sur le téléphone ! Il est clairement pas neuf ! Pourquoi !?"
Zawisza,"5,0",21 septembre 2018,"J'utilise Huawei depuis leur début, je n'ai jamais été déçue au contraire, téléphone de qualité et très résistant aux chocs. Interface pratique ne bug pas comme d'autres marques à obsolescence programmée.. Super"
alice,"5,0",27 novembre 2018,"Huawei p20 lite reçu très rapidement neuf. Conforme à la description, léger, fin. Offre pendant le black friday. Il fait de très belle photos. Recommande +++."
Orianne,"1,0",23 novembre 2018,"J'ai reçu le téléphone ce soir, impossible d'ouvrir le système qui me permet de mettre ma carte sim ! Celui ci est bloqué, j'ai beau essayer avec une aiguille, et n'importe quel autre objet pointu, à part abîmé le téléphone l'emplacement de la carte Sim ne s'ouvre pas! C'est inadmissible d'envoyer des téléphones censés être neuf défectueux à ce point !"
Client d'Amazon,"5,0",29 septembre 2018,Parfait pour mon fils qui a eu plusieurs téléphones d’autres marques. Il rivalise avec les grands. La qualité de photo est bonne et la reconnaissance faciale est très pratique
Cliente Amazon,"1,0",9 novembre 2018,"Je le acheté récemment et même après un jour, il a commencé à se comporter comme ça.
Dans ce cas, j'ai immédiatement demandé un remboursement.
Je mets 1 étoile juste pour cet article, j'espère que les autres sont comme on dit, c'est de la qualité."
Zahra,"4,0",20 novembre 2018,"Tout est nickel , sauf que le réseau wifi -4 G est très faible , ça marche pas dans les stations métro , et quand je suis parfois au niveau sous sol , je compte contacter le service technique pour résoudre ce problème , appart ça tout est parfait , j'adore la caméra , facil à utiliser , chic . Apart le problème réseau je crois avoir fait un bon choix , sachant que j'avais un iphone 5 avant ."
feneck rudy,"1,0",31 décembre 2018,"Téléphone relativement bien dans l ensemble, mais le système de boussole/rotation ecran/accéléromètre etc.. Ne fonctionne pas.
Retour demander via Amazon pour remboursement.
D après un forum huawei le problème est récurent.. Je déconseille donc fortement tant que le problème sera pas résolu."
Vince GRAV,"1,0",3 décembre 2018,"Ecran de belle qualité, photos impeccables, navigation fluide, la reconnaissance tactile fonctionne très bien
Par contre, gros bémol sur la qualité du son, elle est très mauvaise autant en haut parleur qu'avec leurs écouteurs livrés dans la boite (pas essayé avec un casque).
La rotation ne fonctionne déjà plus après 3 semaines."
Client d'Amazon,"5,0",15 juin 2018,Arriver rapidement en excellente état il est vraiment top
BOREL LAURINE,"5,0",14 septembre 2018,Super téléphone. Mon ancien iPhone 6 ne marchait plus et je ne pouvais me permettre financièrement Apple. J'ai entendu parler d'huawei par des connaissances. J'ai choisi celui ci pour sa qualité photo et j'en suis RAVIE
Marion Potier,"1,0",8 février 2019,J’ai commander le téléphone pour ma maman pour sa facilité d’utilisation et la qualité de ses photos au final le produit qui est neuf beug il nous est impossible de la joindre ou bien elle ne peut pas d’écorcher siens on l’appelle. Niveau design le produit est vraiment joli mais là encore un souci puisque le téléphone protéger depuis son ouverture a perdu la vitre de l’appareil photo a l’arrierre !! En outre je suis vraiment déçu du produit
The GeekTV,"5,0",9 janvier 2019,"Légèrement plus puissant que ce qui est écrit (peu importe et tant mieux).
- La batterie tiens 13h sur Youtube (non stop) et 1j en mode ""passif"" = Parie tenue
- Le processeur est très performant
- L'appareil photo aussi et ne possède pas les ""blu reflet""
- La RAM est assez nombreuse"
Laureen92220,"5,0",2 décembre 2018,"Ressemble beaucoup à l’iPhone X je l’ai commander pour mon copain il en est très ravis. Reconnaissance faciale et même avec le doigt à l’arrière. Très léger. Rapide. Qualité photo faut pas attendre à l’iPhone mais c’est suffisant pour peu de photo.
Bon rapport qualité prix."
Client d'Amazon,"1,0",27 décembre 2018,"Reçu dans les temps ,emballage ok ,produit conforme.Après 3 semaines d'utilisation la rotation automatique ne fonctionne plus, malgré qu'elle soit validée sur les paramètres ,retour du Huawei p20 lite dans le mois qui a suivi sans aucun problème par Amazon et remboursement effectué.J'ai acheté un Honor 8X à la place ,on verra si celui-là fonctionne mieux"
turquin2,"4,0",25 janvier 2019,"Bel objet qui se distingue des autres smartphones, notamment dans son habit bleu. Navigation rapide. Reconnaissance faciale efficace, même en cas de très faible luminosité. Son pas philharmonique mais pas si catastrophique que ça. Photo : bonne définition. Manque de performance si faible luminosité. Vidéo : moyen. A noter (car recherché) : possède la radio FM (avec écouteurs branchés).
Bref, fait le job qu'on attend de lui et reste un smartphone correct dans cette gamme. Bon rapport qualité/prix.
Petite déception : le rendu écran (les blancs pas complètement blancs - malgré la correction des paramètres - et une reflectance pas agréable. Après possession d'un Samsung, c'est vraiment un moins et malgré la haute qualité de la dalle écran très résistante : un mois dans la poche sans protection et pas une micro rayure ! Bravo Huawei."
Nicaude,"5,0",25 juillet 2018,"Corresponds parfaitement à mes attentes ainsi qu'à sa description. Top, rien à dire."
Client d'Amazon,"4,0",9 novembre 2018,"Très bon produit, cependant lors de la livraison, descendu acheter du pain. Il a fallu que je me connecte sur mon compte Amazon pour savoir que mon Colis été chez le voisin !! Heureusement qu'ils me l'on vraiment donné et qu'ils ne l'on pas ouvert.
C'est gravées !
La Notice n'est pas en français + il y a déjà une coque transparente basic avec le téléphone. Ce pendant très bon téléphone."
Suzanne,"5,0",31 juillet 2018,"Très bon téléphone, puissant pour un rapport qualité /prix défiant toute concurrence. Tactile hyper fluide, très belle résolution d'écran... Ma fille est ravie"
V. MARC,"5,0",22 février 2019,"Le 2ème dans la famille : Ma fille avait le même depuis 6 mois.
Je suis passé d'un Nokia Lumia 530 (sous Win ""daub"") à ce modèle avec plaisir.
Pour un peu moins de 240 euros, c'est Top pour mon usage : Téléphone, main libre voiture, oreillette Bluetooth, photo de belle qualité, lecture des pièces jointes sur boite mail, adaptation à la lumière ambiante, 64 Go...
Un Bémol, soit on utilise l'emplacement pour la 2ème carte Sim soit pour la carte mémoire : dommage.
Acheté en même temps :
-  Verre Trempé 9H (convient parfaitement)
-  Housse en Cuir HOOMIL H3255 (Superbe mais ne convient pas pour la reconnaissance digitale P20 Lite)"
fifi,"5,0",7 octobre 2018,"Pour le moment je suis très satisfait de se téléphone la reconnaissance facile fonctionne très bien, le reste aussi juste un petit avec le wifi
Je recommande"
Astrée,"2,0",21 mai 2019,"J'ai eu le regret de le renvoyer hier car j'ai crains de faire les frais des mesures américaines et de me retrouver sans les mises à jour d'Android et compte tenu du prix.... Quelques mots cependant sur son utilisation dont la mise en route  n'est pas réservée aux débutants.
Notification de messages : Quelqu'un sur le forum s'est plaint de ne pas savoir si les messages reçus étaient des sms ou mails (ce qui n'est pas prouvé car il me semble avoir vu une personnalisation des sonneries)  mais il y a pire et j'ai failli le renvoyer à cause de cela. La notification est signalée par une mini led de la taille d'une demi tête d'épingle qui clignote et si vous n'avez pas les yeux en permanence sur votre téléphone (et une excellente vue) vous n'êtes pas informé si évidemment vous n'avez pas entendu le popop ou avez teint la sonnerie. De plus, la mise en place de l'appli NoLED s'est passée difficilement.
Réglages laborieux (empreinte pas évident) et lorsqu'on veut sortir d'Huawei non seulement il  faut bien connaître Android mais aussi L'Iphone Apple car ils ont cherché à l'imiter et les ceux qui ont eu cette expérience s'en sortent plus facilement.
Vous allez passer des heures à obtenir ce que vous souhaitez."
Client d'Amazon,"3,0",21 décembre 2018,"Bonjour, je vient d'acquérir le huawei P20 lite ,sur le descriptif on doit me vendre un smartphone de 5.84""et a l'arriver il ne fait pas beaucoup plus de 5""passé ce détail je n'ai pas grand chose a dire, il sera utiliser après noel."
Evelyne V,"5,0",23 avril 2019,"Extrêmement satisfaite de ce produit, tout ce que je souhaitai pour un téléphone.
Même très étonnée par l'appareil photo, en effet, je ne préoccupai pas de l'appareil photo car j'ai une petite caméra (style Go Pro) avec laquelle je peux prendre des photos et des petites vidéos.
Lors d'un oubli de celle-ci, j'ai pris des photos avec le téléphone, de bonne qualité, prise de vu en caméra, pas mal.
Je recommande le téléphone pour sa légèreté, son design et tout ce que l'on recherche dans un bon téléphone, ainsi que son prix très abordable."
AnneSo,"1,0",6 mai 2019,"J'ai commandé ce téléphone en Décembre 2018, en mars la lentille de l'appareil photo s'est décrochée sans avoir subi de choc.
J'appel donc Amazon... qui me renvoie vers Huawei... J'appel Huawei qui m'annonce que le téléphone est destiné au marché chinois selon son N° de série et qu'il n'est donc pas garanti !!! (avant cela on m'a dit qu'il était garanti jusqu'en septembre 2019 ?! moins d'un an de garanti pour un téléphone NEUF ?)
Finalement Amazon se contente de me rembourser le téléphone sans plus d'excuse ni même d'explication
Tout simplement scandaleux"
Yang,"5,0",3 juin 2019,"J'ai récemment acheté sur produit pour un proche qui l'utilise principalement pour les réseaux sociaux et des petites applications telles que des jeux (Brawlstar, Fortnite)
Les plus :
Un esthétique assez séduisant ( semblable au smartphone de chez Apple notamment la gamme iPhone X)
Un écran de très bonne définition pour un prix très raisonnable vis à vis de ces concurrents.
Une autonomie assez satisfaisante avec une utilisation normale, peut tenir largement la journée.
Les moins :
La puissance et c'est tout à fait normal vu le prix du produit, cependant si vous utilisez des applications pas très gourmandes en termes de puissances, le téléphone fait très bien le travail."
Nouna,"1,0",13 janvier 2019,"Très mauvais produit qualité médiocre. vraiement très déçue de mon achat. pas du tout solide l'arrière s'est cassé la deuxième semaine, le téléphone s'est glissé de ma main et tombé parterre. Bcp de problèmes de software, complètement en décalage avec plusieurs applications . Je trouve que c'est un téléphone qui ne mérite pas son prix."
Borgne,"5,0",26 septembre 2018,"Téléphone génial aucun souci rencontré ! Plus que satisfaite je RECOMMANDE ce produit vraiment ! Double NANOSIM et possibilité de mettre une carte SD.
Au top!!"
francky,"1,0",7 novembre 2018,c est mon premier huawei et il sera le dernier .....apres 3 mois le voila deja hs...en colère et impression d'être arnaquer. ...je déconseille fortement .....
Agnel,"5,0",8 mai 2019,"J'aime sa qualité de couleurs les différents choix de fonds d'écran qui permettent de changer souvent la présentation. Bonne prise en mains il est lisse et pas trop large et son écran est bien large pour lire les vidéos. Surtout le mode bokeh pour faire des photos ou le sujet est net et le reste flou. J'aime la retouche couleur et flou aussi ça fait des photos créatives. J'aime que l'on puisse changer le clavier pour les SMS. La reconnaissance faciale fonctionne bien sauf quand il n'y a pas de lumière c'est normal. Pour un usage appel/sms/photos il tient la charge 3 jours. Le son est très bon également même dans la rue.
J'en suis bien contente et je le préfère au Samsung j6 pour un même format et prix."
Pat24150,"5,0",9 avril 2019,"ça vaut largement un SAMSUNG avec un prix inférieur. La reconnaissance digitale (pour mon choix) est géniale. Chargement rapide et ne se décharge pas vite. aisance de navigation. Attention au verre. Je l'ai fait tomber le 1er jour et la vitre s'est brisée en menu morceaux. Donc, coque et verre renforcé sont fortement recommandés."
Les créa au crochet de Lulu,"5,0",14 novembre 2018,"Excellent article tres pratique et leger, je recommande vivement ce produit"
MR M.,"5,0",22 février 2019,"un rapport qualité prix excellent
Bonne qualité de réception
belles photos et vidéos
Huawei fournit un outil de clonage à installer sur son vieil Androïd parfaitement efficace
Côté sécurité, c'est parfait entre la reconnaissance digitale, la reconnaissance faciale et le code secret
Vraiment ravi de cet achat qui remplace très avantageusement mon vieux Galaxy S4 que j'avais payé 3 fois plus cher à l'époque"
A.B.,"1,0",9 décembre 2018,"Gyroscope défectueux se traduisant par la non-fonctionnalité de tout ce qui touche à la localisation spatiale du téléphone : rotation de l'écran, boussole, ...
Heureusement, l'équipe Amazon permet de retourner l'article (en cours), j'attends mon remboursement."
Christian Nlandu,"5,0",10 janvier 2019,"Je me suis fait un grand plaisir d'acheter ce smartphone et depuis je l'apprécie beaucoup.
Notamment sa fluidité: je peux ouvrir en même temps 3-5 applications sans le faire planter (4GO de RAM) ; la qualité de l'appareil photo (avant et arrière) mais le mode panoramique n'est pas évident à le réaliser et il faut le déplacer de gauche à droite en horizontale et sa légèreté et son design."
Cl,"5,0",6 janvier 2019,"Téléphone reçu 2 jours après la commande. Utilisation très facile, tout est en français et il a sauvegardé les données de l'ancien téléphone. Dans la boîte, il y a le chargeur, les écouteurs et une coque de protection transparente. Je ne regrette pas cet achat"
Isis Meyer-crance,"5,0",17 janvier 2019,"Passer d'un iPhone 7 au huawei p20 lite ? Sans soucis ! Parfaite transition pour renouer avec Android ! Bon rapport qualité prix, je recommande. Appareil photo top, interface fluide."
Déborah DESIRE-SEYISSIAN,"2,0",27 mars 2019,"Très très déçue. Je l'ai achetée car la batterie de mon Sony ne marchait plus, elle tenait à peine une journée contre 2 avant. J'ai donc décidé d'investir dans ce téléphone. Je n'ai aucune musique, ne passe pas d'appels, ne joue à aucun jeu. La seule chose que je fais c'est me servir de messenger. Dès que je me sers de ce téléphone, je perds à peu près 1% par minute, soit depuis 48 minutes que je discute, j'ai perdu 37% de batterie. Il est neuf, et depuis 3 jours que je m'en sers, il n'a pas tenu une seule journée et s'est éteint entre 15 et 17h..."
Mimy95,"5,0",9 février 2019,Produit de bonne qualité et double puces en plus ! J'en achèterai à nouveau pour offrir. La personne à qui je l'ai offert en ai satisfaite.
torres chrystelle,"5,0",4 novembre 2018,"Très satisfaite de ce produit.
Bel écran il est très rapide je ne regrette pas mon Samsung.
Je recommande."
garambois,"5,0",18 février 2019,parfait aussi bien qu un i phone pour 1/4 du prix...le rose est magnifique.
Guillaume Bzh,"5,0",13 avril 2019,"Je suis très content de ce téléphone, un peu surpris que l'étiquette de garantie ait été déjà ouverte (au niveau de la boîte du téléphone) il y avait un film protecteur derrière mais pas devant, je ne sais pas si cela est normal. En tout cas le contenu était bien là (chargeur, écouteurs, téléphone, notices et le petit outil pour retirer le cache de la carte sim) et le téléphone semble bien neuf. Je suis donc satisfait dans l'ensemble. Il est bien plus puissant que l'ancien téléphone que j'avais qui datait de 2015 et beaucoup moins cher."
CELINE,"5,0",24 août 2018,"téléphone perforent  , bon qualité prix facile d utilisation , photos plutôt net.
je pense qu au même prix il n y a pas mieux"
TroussetM,"4,0",11 mars 2019,"Produit de qualité !
Un super téléphone franchement je recommande à 100%..
Je ne suis vraiment pas dessus plus cas attendre par la suite si il tiens toujours..
Sa va fait 1moi que je l'es je m'ent sert toute la journée avec des application qui consomme de la batterie et je le charge qu'une fois par jour !!"
R V,"2,0",10 janvier 2019,"L'annonce d'un produit reconditionné doit faire partie du descriptif.
Après être passé par le service client Huawei à cause d'un problème de rotation j'ai été informé que mon smartphone avait été reconditionné et que sa garantie était réduite de 8 mois.
Attention aux fausses informations !"
Danto,"5,0",16 janvier 2019,"J'adore !! La qualité photo est impressionnante ainsi que le graphisme en lui même. Je n'ai pas encore vu toutes les fonctionnalité mais ne serais ce que la capacité memoire j'en suis très contente. Je t'ai avant sur le p8lite2017. Ce p20 lite est vraiment au top. Le. Verre tremper adhère vraiment bien à l'écran comparé au p8 qui était légèrement incurvé. Et effectivement c'est vraiment agréable de voir la grandeur de l'écran. Je recommande vivement, l livraison à été dans les délai et aussi bien protéger"
